Review_number,User_rating,Review_title,User_id,User_id_link,Created_at,Review_Text,Spoiler
1,9,Pixar's best feature to date,kylopod,n/a,15/08/2025,"I have enjoyed most of the computer-animated films made so far, ranging from Pixar films like ""Toy Story"" and ""The Incredibles"" to DreamWorks films like ""Shrek."" But ""Finding Nemo"" is the one that remains unparalleled, not because of its comedy or creativity, both of which are equaled in the ""Toy Story"" movies and in ""Monsters Inc.,"" but because it truly, more than any of the previous computer-animated features, reinvents the genre of the children's animated film.Humor in traditional animation is usually based on broad slapstick and physical exaggeration. There are occasional nods to this brand of humor in ""Finding Nemo,"" as when a flock of seagulls ram into a boat and we see their beaks crowing on the other side of the sail. But such sequences only call attention to how far this movie generally departs from old cartoon conventions. Instead, the movie invests its world of sentient animals with a surprisingly scientific texture. All of the animals are based on real species. The fish tank is constructed out of real devices. There is a strong sense of locale, as Marlin (Albert Brooks) travels across the Pacific to Australia, where even the animals speak with an Australian accent. In a scene that I'm sure Gary Larson of ""Far Side"" fame loved, a pelican discusses with a group of fish the intricate details of dentistry. The fact that the animals talk and understand what's going on is treated as though it were a natural feature of the world. The realism is so striking that by the end of the film, you'll almost believe it possible for fish to plot an escape from a tank.Far from making the film pedantic, this approach results in an intelligent but still entertaining picture. Most of the humor is based on parodies of human behavior: repentant sharks start a club that's like Alcoholics Anonymous, a school of fish act like obnoxious DJs while forming themselves into spectacular patterns, and a four-year-old girl behaves like most kids that age, oblivious and destructive. The manner in which Marlin finds his way to his son is so inventive that we can forgive the film for the number of coincidences involved.The story employs the same basic formula used in ""Toy Story,"" in which two characters, one uptight and the other clueless, are thrown together as they're forced to journey through a world populated by creatures that are a lot more knowing than the humans realize. This movie, however, creates a unique character in Dory (Ellen DeGeneres), a fish with short-term memory loss. To give a cartoon character a real human disorder is risky, to say the least, and I'm glad the filmmakers didn't lose the nerve to include this ingenious device, which not only generates some of the film's biggest laughs, but reinforces the character interaction that is so central to the story. This is in fact the only Pixar film to feature true character development. In the course of his voyage, Marlin learns to be more adventurous, getting parenting tips from a surfer-dude turtle voiced by the film's director Andrew Stanton, while his son Nemo learns to be self-reliant.Of course, none of the sharks, jellyfish, whales, gulls, pelicans, lobsters, and humans that Marlin encounters along the way really mean any harm. They're just doing what they do. As Nigel the Pelican tells Nemo at one point, ""Fish gotta swim, birds gotta eat."" That's perhaps the film's most interesting insight, that there are no true villains, just creatures that act according to their nature, and a few that transcend it.",False
2,8,"Yes, it's THAT good !!",Coventry,n/a,15/08/2025,"I'll be totally honest and confirm to you that everything what they say about this movie is true. It's a brilliantly animated masterpiece with lots of humor that actually works and a plot that really brings tears to your eyes from time to time. The modern artists of Pixar never cease to amaze the audience in expanding their horizons. Finding Nemo is visually stunning and you can have nothing but respect for the people who created it.I was more or less skeptic about watching it, because it was so overhyped ! Two days before it got released in my country, the TV and press loudly announced that the DVD broke all records in the USA during its first release-day. That's usually a sign of being typically mainstream and fake...but Finding Nemo is not. I'm allergic to fake sentiment and pathetic feel-good movies but I was really touched by this one. The moral and valuable life lessons are always present, but they're not shoved down your throat or thrown in your face all the time. This movie really relativates itself and that's important for a good comedy. And it's hilarious !!! Every side character in Finding Nemo (and there are a LOT of them) is exceptional and worth a mention. And the voices are cast perfectly as well...like the voice of Willem Dafoe for Gill, for example...a perfect choice. The character of Dory ( speaks through the voice of Ellen DeGeneres ) steals the show. She's an adorable blue fish who suffers from amnesia. She forgets what she's doing or going to every five minutes and that really leads to hilarious situations.Movies like this aren't just being made for children exclusive... They're good for everyone to realize you have to entertain yourself from time to time and just to enjoy the little things in life. I recommend this to everyone in the world. No matter if you're 9 or 99 years old, Finding Nemo will bring a smile on your face and leave behind a warm feeling in your heart.",False
3,9,"""Finding"" A Flight odf Fancy",lhseaglerunner,n/a,15/08/2025,"Remember back when you were little.you know, back when tall to you was about as high as a mailbox? In those days, Disney animated films (e.g. `Lion King' and `Beauty and the Beast') were some of the coolest things out there and were movies to watch over and over (much to your parents' chagrin). Now, animated movies aren't exactly the `coolest' things to see, but an exception can be made for the uber-hip Pixar movies, the most recent of which being `Finding Nemo'.After losing all but one of his brood, Marlin (Albert Brooks) an over-protective clown fish that strangely lacks a sense of humor, has resolved to protect his one (slightly disabled) `child' remaining, Nemo (Alexander Gould). But disaster strikes as Nemo is taken by a Sydney dentist and plopped into a fish tank where he is comforted by a host of other captive fish (William Dafoe, Vicki Lewis, Allison Janney, et al). But back in the big ocean Down Under, Marlin has resolved to search out his one remaining progeny.Along the way on his quest, Marlin acquires a tag-along `friend', Dory (Ellen DeGeneres)-a fish with, well, the memory capacity of a fish. The two must surmount hurdles like a group of sharks (Eric Bana, Barry Humphries and Bruce Spence) that have (mostly) sworn off eating other fish, a nasty swarm of jellyfish, a bird-brained flock of seagulls, and others.This is the bridge! Well, in a way. Back when I was younger, one of my favorite films was `The Incredible Mr. Limpet', which, for the uninitiated, combined live-action with under-the-sea fish animation. What Pixar has done here was bring back that film to my mind and start me thinking, because they have created a wondrous undersea environment (with `normal-looking' fish instead of 1960s animated fish).My favorite feature in this movie chock-full of sweet treats must be the sharks. I have always been partial to the shark family, but what has been done in creating three humorous sharks (what a movie concept), just sent paroxysms of laughter through me. Another thing that (mostly) works is Ellen DeGeneres' fish (character?) that provides a fairly constant source of laughter with her antics (although a couple gags do wear on the viewer with time). On the whole though, there is not a single bit of shoddy voice-acting or animation in it.Compared to `Monsters Inc.', `Finding Nemo' is something of a revival for Pixar. I like how they have stepped up their efforts to make an altogether pleasing film without any big flaws. The thing that I did not like with `Monsters' was the inclusion of a single key (but EXTREMELY annoying) character. Director Andrew Stanton has done an excellent job at making the film work and be (basically) non-annoying to most of the general public (and this critic).I suppose life has come full circle-now that I am (relatively) old as a high school graduate, animation is cool again, thanks to high-powered computers, at any rate. `Finding Nemo' is one heckuva movie and a good one to take anyone you know to, trust me on this-nine out of ten.",False
4,10,The Greatest Pixar Movie Ever.,FreakingMovieFanatic,n/a,15/08/2025,"Yes you read that correctly.Finding Nemo had brilliant, breathtaking underwater scenes that blow your mind!! Characters that you connect with, that have emotion, style and humour. The soundtrack is perfect to boot. Honestly what more could you ask for? In glorious 4K HDR with vibrant Dolby Atmos it gives this iconic classic a whole new life!!",False
5,10,Swimming with Sharks is a Whale of a Time,PizzicatoFishCrouch,n/a,15/08/2025,"Marlin, a nervous and neurotic clownfish is heavily overprotective of his son Nemo, who only wants to explore the sea in its entirety. When Nemo gets caught by a scuba diver and taken away, it is up to Marlin to swallow his own fears and find Nemo. The ensuing search and rescue organized by the him is a mass effort by swimming and flying creatures of all sizes and personalities, such as a threesome of vegetarian sharks, a fish with short term memory and an aged turtle, all helping him realise the error of his ways in restricting himself to just his home.As charming as it is beautiful, Finding Nemo is a joy, both visually and cinematically. The characters are all so appealing and sweet that you want to hug each and every one of them, Nemo and Dory in particular. But the film transcends above just a generic animated film, for there are lessons to be learnt by it too. The film often tells a children's tale from an adult's point of view, with risky situations and emotional soul-searching putting stress on a disjointed family.The sea is brought to us in such a memorable and unique way that there is brilliance and beauty in every frame. The animation is of all time high for Pixar, and the sound mixing and editing are also to be credited, as they capture the heart of the sea creditably. But perhaps the best thing about the film is the musical score by Thomas Newman. He creates the essence of the sea, as well as the emotions felt by the fish throughout. Note the masterwork that occurs as an upbeat, jovial number quickly escalates into something darker in a matter of minutes. In short, the music is superb.The voice cast are capable and cannily chosen, from young Alexander Gould as the naïve Nemo, as well as Albert Brooks as the bumbling Marlin. But the star of the show is Ellen DeGeneres as Dory. As the forgetful but caring fish, she is sweet and soulful, and provides much of the comedy of the film. But the humour is also provided by the great script, which delivers a potentially dull story with wit and soul, and shies away from the sentimentality that could so easily arise of a Disney film. And the jokes, what jokes  from satire, spoof and slapstick, they'll be a one-liner for everybody here.Gorgeous to look at and utterly adorable, Finding Nemo sets the standard for how animated movies should being terms of entertainment value as well as story and themes  ending with the touching, thought-provoking message of how too much protectiveness on the parent's side will repel, but, no matter how independent a child (or fish) believes themselves to be, they'll always need their parents.",False
6,n/a,quite a catch,n/a,n/a,15/08/2025,"Pixar Studios have done it again. I have to say that these guys are totally good in computer animation, as well as in storytelling. Rarely do those qualities come together but here they are, delivering unto the audience once again something that one can only be drowned with wonder. Such is the marvel of Finding Nemo.The story is about Nemo (voiced by Alexander Gould), a young clownfish who is fed up with his dad Marlin's (Albert Brooks) excessive paranoia over him. He swims to a place where his dad forbids him and ends up being captured by a scuba diver. He is then placed in a fish tank in a dental clinic somewhere along the harbors of Sydney. Thus the quest of Marlin, along with Dory (a hilarious forgetful blue tang voiced by Ellen DeGeneres) to find Nemo before it's too late.The story is a simple one but where the film more than makes up is on the overwhelming sense of detail and rich, lavish colors and textures as if we aren't really watching an animated film at all. Scenes such as Marlin bringing Nemo to school while swimming through corals and anemones, to the aquarium where Nemo was taken to, are nothing short of breathtaking, and undoubtedbly one of the most outstanding animation ever to hit the screen.The world of ""Finding Nemo"" is simply alive with lovable creatures swimming about their daily lives under the ocean, darting across the screen in playful manners. The viewer almost literally dives into another world for nearly two hours and one cannot help but be completely captivated.The music and screenplay also blend very well with the visual feast that it produces such a high quality movie. From its basic storyline, to the father-and-son relationship theme, to the wonderful underwater world throughout, this is really an adventure through an ocean of stunning visuals and storytelling.Grade: A",False
7,8,Another Disney/Pixar Classic,mjw2305,n/a,15/08/2025,"Those guys and girls at Disney/Pixar have done it again, they've created the perfect underwater world, full of fascinating Disney characters.A truly enchanting story of a father (Marlon) who loses his son (Nemo), and with help of his new found friend (Dory) ventures out into the ocean to try to find him. On this epic voyage he gets to battle sharks, surf with some turtle dudes, dice with some jellyfish and survive an encounter in a whales stomach.All the characters are vibrant with Disney charm, but my favourite is Dory, the comic relief, probably one of the funniest Disney characters ever written and superbly voiced by Ellen DeGeneres, pure genius.All in all this is another success for Disney and Pixar, It brings out the child in all of us.Solid family fun 8/10",False
8,9,A classic from Disney Pixar.,Sleepin_Dragon,n/a,15/08/2025,"Marlin loses his wilful son Nemo, and the fact that 71% of the Earth is water, that's a lot of water to find a single fish.Back to a time where Disney Pixar were giving us truly memorable, meaningful and wonderful films. Finding Nemo surely rates as one of the great animations.This film is both funny and moving, it's a film that that whole family can enjoy, I'm sure this will end up on over thr upcoming Christmas period, it usually does, and it always makes us giggle, Ellen DeGeneres truly does provide the laughs as dippy Dory.I'm only surprised to that the followup took so long, and though I don't think Finding Dory is quite as good, it's still worth seeing.As much as I adore Dory, it's Bruce that I like most, his animation is just perfect.It's moving, it's funny, there is definitely a meaningful story, the animation remains terrific.9/10.",False
9,10,Pixar's best movie.,RightWingGuy,n/a,15/08/2025,"I didn't see this movie until it came out on DVD. My family and I don't go to the movies very often, mostly because there's hardly anything worth seeing.But this movie was absolutely flawless. The voice cast was super. The voice of Nemo is Alexander Gould, who is 11 years old now. I saw his picture, and I really like his smile.""Finding Nemo"" is a classic. It'a among my favorite movies, and is a movie everyone should see. Unlike about 96% of movies, this movie is Rated ""G"", and can be viewed by children. There might be a few moments when it gets ""scary,"" but they soon turn into comedy.Watch ""Finding Nemo"" and I think you'll be a happier person by the end of the movie!My Score: 10/10.",False
10,9,Who said fish are boring?,Boba_Fett1138,n/a,15/08/2025,"""Finding Nemo"" is a wonderful animated adventure movie that simply is irresistible for young as well as older persons.The most excellent thing about ""Finding Nemo"" is the perfect timing, just like in ""Monsters, Inc"" the jokes are extremely well placed in a quick pace and are good for more then just a few laughs.There are some very fun and great characters which brings me to the only problem I have with this movie. There are too many minor characters, I would have really loved to see some of the characters getting a bigger role with some more importance to the story instead of meeting character after character that are only on screen for no more than 5 minutes (such as the sharks). Sure it's good for the sense of adventure but it leaves some missed opportunities to make the story even more fun.I think it's pretty obvious that the story is inspired on the ""Lord of the Rings"" trilogy since it uses lot's of elements from it and it has the some feeling of adventure and excitement so it's really not a big thing that the story isn't very original, the original and fun way the story is told in compensates for this.The voice cast as in many animated movies is impressive but the one that stood out was Ellen DeGeneres as Dory that you love to hate.Irresistible movie for the whole family with great jokes and lines and some memorable characters and situations.Mine, mine, mine!9/10http://bobafett1138.blogspot.com/",False
11,7,Pixar goes to the fishes,soymilk,n/a,15/08/2025,"This is a good film but overrated. There, I said it.This was just too reminiscent of when 'Shrek' first hit the screens, in 2001  the 3D animation everyone was going gaga over, repeatedly hailing as the greatest animated movie ever, and yet didn't really impress me all that much. Seemingly, I was the only person on the planet to feel that way. I didn't really 'get' 'Shrek', don't especially 'get' it even now, and for some reason I didn't quite manage to 'get' 'Finding Nemo' either, the next 3D film to get the 'greatest animated movie' ever proclamation, in spite of the fact that I was really, really determined to kick off my socks and enjoy this one. Well, it's cute and it's colourful, and the idea of a father clownfish (named Marlin) trekking the ocean to be reunited with his missing son (named, oddly enough, Nemo) is a nice one for sure, but there was just something about it which left me feeling strangely unsatisfied. All in all it's a worthy venture for the Pixar cabinet, visually gorgeous and with a handful of effective moments, but seriously, they have done better.The main problem comes in the story structure, which is too rambling and disjointed to do it for me. I actually agree with another viewer who commented that it felt more like that of a multi-levelled video game than a movie. All it really involves is Marlin swimming along and avoiding getting chomped by dangerous sea-dwelling predator after sea-dwelling predator. We meet plenty of interesting characters along the way, but the nature of the story means that they're removed from the action within minutes. For example, the trio of sinister but slow-witted sharks struggling to go veggie, who have a lot less screen time than the promotional posters and trailers might imply and are never given the chance to amount to much more than a few time-filling wisecracks. Nigel the pelican, in spite of Geoffrey Rush's spunky voicing, is a mostly bland character whose motives for befriending and assisting the fish are left conveniently unspoken (after all, naturally he's another sea-dwelling predator himself), and I found the surfer turtles just a tad annoying (particularly the young ones  call me heartless, but bleh!).Another pretty nagging drawback is that neither protagonist, be it Marlin or Nemo, is nearly as sympathetic as past Pixar creations like Woody or Sulley. Marlin is too whiny to be truly likable, and Nemo doesn't really get the great deal of development you'd usually expect in a title character. The script is notably also less sharp than previous Pixar instalments. There was one scene in the dentist's waiting room which had me in stitches, but that was about it. It's mostly just movie in-jokes for most of the time. While in 'Toy Story' the various nods to other movies were little more than subtle extras for the sharp-eyed viewer to enjoy alongside a script brimming with plenty of witty gags of its own, they're pretty much integral to this screenplay. 'Finding Nemo' suffers from the same 'self-indulgent movie spoof' syndrome that you can find in most 3D animation from the Dreamworks stable, with a slew of constant parodies (that most of us have already seen at some point in 'the Simpsons') substituting for real humour. Usually, Pixar are always one step ahead of their rivals in this respect, but this time round even they were unable to resist succumbing to it.There are certain aspects of 'Finding Nemo' that I liked. For example, Dory, the regal blue tang who trails Marlin insistently on his travels  technically she's as 2D as everyone else in this flick, her whole character consisting of little more than the one-joke comedy gimmick that she suffers from short term memory loss and can never remember quite what she's doing. There's so much potential here to be annoying, but somehow she manages to pull through and, against the odds, prove a surprisingly charming character throughout. Perhaps it comes down to Ellen DeGenere's brilliant voice work. Also, I like it that the standard comic relief sidekick can finally be female, and that Marlin and Dory manage to maintain an entirely platonic relationship throughout (no token love interests here).But the most interesting character by far is William Dafoe's hard-bitten Moorish idol, Gill  he's given some hints of a personal history, yet it goes curiously understated throughout. Many of the 'Tank Gang' sequences seem pretty out of place (what does the welcome ritual have to add to the story, other than establishing the existence of that bubble volcano?), but nonetheless, some of the dialogue exchanged between Gill and Nemo is quite nice and add a sprinkling of depth to a film which I otherwise found to be just a little toohollow?Plus, the sight of an angler fish caught up in a pair of diving goggles is unexpectedly alluring - still, the poor, poor creature ;)'Finding Nemo' isn't a bad film by any means. In fact, it's pretty darn good. But Pixar have made other movies which, ironically, could blow this clean out of the water. In short, it's sweet and pleasant but  there's that word again - overrated.Grade: B",False
