Review_number,User_rating,Review_title,User_id,User_id_link,Created_at,Review_Text,Spoiler
15,n/a,Best Performance in Film History: Gloria Swanson,n/a,n/a,15/08/2025,"SpoilerThe plot has been discussed at length in other comments.To me SUNSET BOULEVARD has it all. The comedy is sly, the drama is of epic proportions because it's not JUST a story about Hollywood or an aging actress. It's really about the giving up of dreams.Norma's dream of return, held to for 20 years, is ironic because Norma so closely parallels Gloria. That Norma cannot make a comeback in 1950 even with connections to DeMille is sad. The sadness is due to Norma's refusal to accept her aging or the politics of Hollywood that worship youth. It's ironic that Norma has no place in Hollywood (the parade has passed by) but DeMille is still working and in the scenes from Samson and Delilah we spot other old-timers like Henry Wilcoxon and Julia Faye--still working but not as STARS. The final irony here is that Gloria did make the comeback that Norma couldn't make.Norma has a thing about STARS.... she says at one point... ""the stars are ageless."" Well this is true in a filmic sense. I can still watch Gloria Swanson in THE LOVE OF SUNYA or MANHANDLED and yup, she is ageless. She is still twenty something. That screen image is forever held up like a bad mirror to the reality of being 50. On another occasion Norma says ""nobody leaves a STAR, that's what makes one a STAR."" True again, but it's not just Gillis who is leaving Norma, her fans have already left. Hence if one is left, one cannot be a STAR.Gillis also gives up his dream (temporarily) of being a writer, Max gives up his dream of directing, and even Betty gives up her dream of love with Gillis. Scary stuff.The film is also about LOVE. Look what these people have done for love: love of another person or love of fame or whatever. Max loves Norma. Norma loves Gillis. Gillis loves Norma and Betty. Betty loves Gillis and Artie. Artie loves Betty. And all of them love Hollywood.Everyone is crushed at the end of this film..... The scene of Max ""directing"" the scene as Norma descends the staircase is one of the all-time great scenes in a film. Norma's final speech, which sums up everything (""there is nothing else""), is devastating. Can she really be insane and make this lucid speech? If she's NOT insane then she has knowingly killed Gillis to prevent his leaving her (a STAR)....... Also the shots of Max blinking away tears as Norma descends (supposedly into madness) and also of Hedda Hopper crying are equally as devastating as Norma's speech about ""being back"" and ""all those wonderful people out there in the dark"" (which of course includes us every time we watch the film).I cannot think of any other film (possibly CITIZEN KANE) that works on so many different levels. And Gloria Swanson gives the greatest performance in film history!",True
16,10,"""Mr. Wilder, I'm ready for my close-up""",jotix100,n/a,15/08/2025,"Billy Wilder and Charles Brackett were about the best writing team in Hollywood for more than three decades. ""Sunset Boulevard"" shows the men at the pinnacle of their profession. Billy Wilder directed the film with his usual panache at this nostalgic look at a Hollywood that had faded almost a quarter of a century before. If you haven't seen the film, please stop reading here.With the advent of the ""talkies"" a lot of film stars of the silent era lost their privileged positions as the most admired people in movies. When the new generation appeared in the scene, they were more accessible to the fans that flocked to see the new technique in the movies that came out. One of those movies stars, Norma Desmond, lives in the past as she never adapted to the new reality, which is evident in the way she stays out of the scene dwelling in her antiquated castle on Sunset Boulevard.Enter Joe Gillis, the man who never made it into the industry. As a writer, all his screen plays were rejected by the studio machinery because they were not what the heads of the production departments wanted to produce, or just were plain, not interested. Joe Gillis comes into the Desmond mansion by accident and it's an accident he encounters on his way out of it! Tbe egotistical Norma Desmond lives in the her palatial home with Max Von Mayerberg, the loyal servant, who was himself, somebody in the silent era. Norma falls for the young Gillis in ways she never expected, but as a desperate woman she wants to possess what she can't otherwise buy, even a man going through financial bad times the way Joe Gillis is.Billy Wilder got magnificent performances out of the three principals. William Holden had one of the best opportunities of his film career with Joe Gillis, a character he wasn't even scheduled to play, but which Montgomery Cliff handed to him in a silver platter when he refused to appear in the picture! Gloria Swanson, having experienced that old Hollywood, was a natural choice to play Norma, which was perhaps, the crowning role in her distinguished career. Erich Von Stroheim, the great director, himself, is absolutely wonderful as Von Mayerling.We see some of the silent era stars such as Buster Keaton, Hedda Hopper, Anne C. Nilsson, H.B. Warner, as well as Cecil B. DeMille, the director of Hollywood epics par excellence.The great musical score of Franz Waxman enhances the film. John Seitz black and white photography brings us back to that time. Ultimately, it's the genius of Billy Wilder that keeps things in balance showing a man who understood movies as perhaps the only one that could have directed the classic ""Sunset Boulevard"".",False
17,10,Absolute Perfection,Incalculacable,n/a,15/08/2025,"Sunset Blvd. is a terrifyingly realistic portrayal of a washed up movie silent screen star and her quest to rekindle her popularity... and a poor writer on the run from the police who gets involved with her. The story starts backwards: you see a man floating face down in the water, and so the story begins... how it all started.Norma Desmond is a character that you hate, love and feel sorry for all at the same time... she is very selfish, self absorbed and needy. But I felt a strong pang of sympathy when Norma talks about her script for Salome... how she has such high hopes about her comeback. She just wants to be loved again. I could not imagine anyone else playing Norma Desmond.. Gloria Swanson plays it to perfection. William Holden is great also - and I didn't realize this until someone mentioned it to me, but playing such a casual, nonchalant character such as he did against such a strong character of Norma is quite challenging. He did it wonderfully and delivered the lines with ease.After watching it the first time, I watched the bits I wasn't sure of - I was sure if I liked the lines the way they were delivered - and it grew on me. For example, I always imagined the magnificent last line delivered more slowly than Swanson did it... but as I watched it again, I began to like it more and more. Now that I have watched it twice, I cannot really find anything wrong with this movie. It has it all: drama, romance, two fantastic actors, comedy, emotions of sympathy, hate, greed, lust... I would say this one of the top 5 movies of all time, if not the top.After I saw this for the first time, there was a wonderful feeling as if I had just seen a special bit of movie history... and I was a part of that history. I don't know how to explain it, but it was a great feeling that cannot be described. This can appeal to all ages, from 12 and upward's I'd say! A true Hollywood masterpiece - they don't make 'em like this anymore.",False
18,8,"weird, bizarre, fascinating, great",rupie,n/a,15/08/2025,"SpoilerThis movie deserves all the accolades it has gotten here, as well as ""Maltin's"" four stars. It certainly ranks up there as one of Hollywood's greatest achievements. Seeing it again only reinforces my opinion that William Holden was one of the truly great actors of the last [!] century. Gloria Swanson, however, steals every scene she's in; you can't turn away from watching her, even though she makes you really uncomfortable - it's like watching a train wreck. I don't know if the black & white was an economic or an artistic choice, but the film would never have been as effective in color. The opening shot - the floating, dead body of Joe Gillis, eyes wide open, shot looking up from the bottom of the pool - is one of the great shots, and an unforgettable opener, matched perfectly by the unforgettable closing closeup of Norma Desmond. To have Cecil B. deMille actually play himself was an inspired touch. Throw in Eric von Stroheim and you have an unbeatable combination. Truly one the all-time must-see films, although I don't know how to classify it - film noir? black comedy? Hollywood fable ? horror story? psychodrama? Who cares; just see it.",True
19,9,"All right, Mr. DeMille",Boyo-2,n/a,15/08/2025,"Gloria Swanson must be commended for her bravery in taking a part which may or may not have echoed her own Hollywood career. William Holden took a role which required him to be a kept boy; and he's not the nicest guy in the world either. If this had been made with Mae West and Montgomery Clift, I would probably not be writing this and no one else would give a damn about this movie either.Both of them got Oscar nominations and I am sorry both lost. I am also sorry that ""All About Eve"" won Best Picture that year.  Of course ""Eve"" is a great movie, but its not this.This movie is part of our collective memory and most of the dialogue continues to be quoted even today. Thank God for whatever it was that brought Billy Wilder to Hollywood. I can't think of anyone who did such a wide variety of movies so well.And please, no remakes.",False
20,10,"""And must you chew gum?""",snow0r,n/a,15/08/2025,"It so happens that as I was watching Sunset Boulevard, I was chewing gum, and Gloria Swanson's clipped, derisive tone felt more like it was directed not at William Holden's washed up Joe Gillis in 1950, but at me, sitting on my couch in 2008. I didn't throw my gum away like Gillis does, but still, I did feel a little disconcerted. Norma Desmond knew I was chewing, and she didn't like it one bit.But this is part of Sunset Boulevard's charm. While it's a movie about the ways movies had changed, were continuing to change, and those they left behind, it also shows us how, in some ways, they've remained the same. Its references to the WGA, popcorn cinema, and the tragicomic nature of washed-up celebrity feel oddly contemporary while simultaneously being firmly rooted in the Fifties.While some of the period references to actors and directors went over my head - I'm no expert on the silent era - it didn't affect my enjoyment of them one bit. The fact that Wilder and his team were brave enough to include such comments gives the film a cool, relaxed feel even as the web that binds the characters draws ever-tighter.It's fantastically acted too. Holden is brilliant as the struggling everyman who quickly realises that he's gotten way more than he bargained for, and Swanson is pitch-perfect as the faded screen star whose grip on reality has crumbled far quicker than the walls of her mansion, right down to the wide roving eyes and claw-like hands. They're well-supported, especially by Erich von Stronheim's eerily restrained butler Max.Of course, great dialogue and performances are nothing without a plot to match. Despite the fact that the beginning reveals the end, Sunset Boulevard still manages to keep you hooked from the moment Holden sits at his desk for the first time right up until the movie's cruel, haunting, tragically human conclusion.Very rarely do ""old"" movies actually live up to their reputations, but I'm pleased to say that Sunset Boulevard does, and it's a credit to Wilder's team's ability that this noir-drama stands the test of time. A truly great film.",False
21,10,The Wild Roller-coaster of Fame,bkoganbing,n/a,15/08/2025,"In many ways Sunset Boulevard is like the reverse side of the coin of A Star Is Born. In that film we have young Vicki Lester going through all the travails and heartache before achieving her goal of movie stardom.Sunset Boulevard is the reverse. A Star Is Born has its tragic figure in Norman Maine who commits suicide rather than face being a has been. In Sunset Boulevard we have the character of Norma Desmond who has not taken that route. She lacks for nothing in the material world, she wisely saved and invested her money. But the acclaim of the audience is a drug she craves. She's been at the top on the celebrity roller-coaster and now is at the bottom.Into her life comes Joe Gillis quite accidentally. Fleeing from some repo men looking to take his car, Gillis drives into the garage of what he thinks is a deserted mansion. It looks pretty run down from the outside. Gillis compares it to the house of Miss Faversham from Great Expectations, little knowing how right he was.Billy Wilder was a casting genius though in some ways he fell into the cast he had. Gloria Swanson was not his first choice, he approached both Mary Pickford and Pola Negri for the Desmond role first. Gloria Swanson who actually had made the transition to sound well, but had gone on to stage and radio since her success in Music in the Air, drew from the experiences of many of her colleagues. At the time she was cast in Sunset Boulevard she had a radio show out of New York.Bill Holden was sheer serendipity. Originally Montgomery Clift was to do the part, but at the last minute he said no, feeling that this was to similar a part to the one he played in The Heiress. Wilder then went through the list of contract leading men at Paramount.Wilder saw something in Holden, God bless him. Holden had done a whole series of what he termed 'smiling Jim' roles. He was considered an amiable and non-threatening leading man. Although he had done well in a role as a psychotic killer in The Dark Past, Sunset Boulevard brought him his first real acclaim as an actor. An Academy Award nomination came with the acclaim.Nancy Olson and Erich Von Stroheim were nominated in the Best Supporting Player categories as was Swanson for Best Actress. Von Stroheim was another inspired choice. His is a strange part indeed. He was Desmond's first director in silent films and left his career behind to take care of her. He was also her first husband.Sunset Boulevard for it's time and with the Code firmly in place was a brutal look at the sexual needs of a middle-aged woman. Before Holden knows it, he's giving up his life as an aspiring screenwriter to be a kept gigolo. He doesn't like it, but can't leave it. When he does, it results in tragedy.Nancy Olson plays a reader at Paramount studios where Holden is trying to sell a script. She and Holden had good chemistry and after this they did four more films together.Casting Cecil B. DeMille as himself was of necessity for who could play the great DeMille, but DeMille. DeMille in fact was a former actor and playwright at the turn of the last century. In his autobiography DeMille lets us in on a private joke. He in fact did direct many of Gloria Swanson's early silent films and a pet name he had for her was 'young fella.' Note that when Norma Desmond comes to the Paramount lot to see him, he greets her with that same expression. Note that DeMille got a plug for his own film Samson and Delilah which was in production at the same time. It is the set of that film where Swanson and DeMille meet.You will never forget the finely etched characters of Sunset Boulevard. You can see it many times as I've done, but if you see it only once you will have it burned in your memory. Especially that last scene before the newsreel cameras where Swanson loses whatever sanity she has left. She descends down the stairs of her mansion and descends into the comfort of insanity.I've often wondered should a sequel have been done covering the trial of Norma Desmond. I'm sure Billy Wilder wanted to move on to other projects. Still that would have been a film to see.",False
22,7,Overrated in my humble opinion,bsinc,n/a,15/08/2025,"Dom De Luise once uttered a line I use quite often:""Nice, not thrilling, but nice!"" That's exactly how I feel about ""Sunset Blvd."", because as much as the first 30 minutes of it were extremely promising the overly long and much less entertaining middle just slowed the pace a gear to many. I somehow hoped that Joe Gillis would get himself mixed up in a murder case or something, when in fact he wound up being a victim of one in the end.Good performance all around, although not really Oscar worthy(maybe the fact that I saw ""A Man For All Seasons"" just a couple of days ago speaks for itself). I truly hope it wasn't the murder plot or shall I say the final ""twist"" that impressed so many viewers, because as much as it is unusual (and for that time perhaps almost revolutionary) I saw it coming a mile away, which is the main reason with my disappointment with ""Sunset Blvd."" Once I knew exactly what was going to happen there just wasn't any fun in watching the lonesome and forgotten old silent-movie actress tormenting herself and others anymore. I can't figure out why this movie stands so tall in the IMDb 250 greatest; a great beginning, a nice ending and some of the best narration(By William Holden) ever put onto the big screen, but the predictability of it all made ""Sunset Blvd."" overly long and not nearly as pleasing and good as it could have been. 7/10",False
23,10,A Bitter and Tragic Masterpiece,claudio_carvalho,n/a,15/08/2025,"In Hollywood of the 50's, the obscure screenplay writer Joe Gillis (William Holden) is not able to sell his work to the studios, is full of debts and is thinking in returning to his hometown to work in an office. While trying to escape from his creditors, he has a flat tire and parks his car in a decadent mansion in Sunset Boulevard. He meets the owner and former silent-movie star Norma Desmond (Gloria Swanson), who lives alone wit her butler and driver Max von Mayerling (Erich von Stroheim). Norma is demented and believes she will return to the cinema industry, and is protected and isolated from the world by Max, who was his director and husband in the past and still loves her. Norma proposes Joe to move to the mansion and help her in writing a screenplay for her comeback to the cinema, and the small-time writer becomes her lover and gigolo. When Joe falls in love for the young aspirant writer Betty Schaefer (Nancy Olson), Norma becomes jealous and completely insane and her madness leads to a tragic end.""Sunset Boulevard"" is a bitter and tragic masterpiece of the genius Billy Wilder that exposes how Hollywood uses people and forgets them when they get old and are considered decadent by the industry. Further, it also shows the consequences of the lack of adaptation of a former star to the end of a successful career, being forgotten by fans and the industry, and the price that some persons accept to pay to join this business. The last time I saw this film was on 22 September 2002 and even having watched ""Sunset Boulevard"" for maybe five or six times, I still get excited with most of the scenes and I dare to say that it is in my Top 10 movies ever. The DVD has an interesting documentary called ""Sunset Blvd.: A Look Back"" (a.k.a. ""The Making of Sunset Boulevard"" with the presence of a still impressively beautiful Nancy Olson telling peculiarities about this awesome feature. My vote is ten.Title (Brazil): ""Crepúsculo dos Deuses"" (""Dusk of the Gods"")",False
24,7,The ghosts of Hollywood's ravaged past...,moonspinner55,n/a,15/08/2025,"Hack screenwriter chances upon mansion of a faded Hollywood silent screen star who 'hires' him to ghost-write her return project ""Salome"", but who really wants him for her lover. Poor Norma Desmond: she's 50 years old and over the hill! Literate, but queasy black comedy has a great script and majestic performances, but creeps its way to the depressingly inevitable. The palpable aroma of vintage cigarettes and the smell of rosy perfume hanging in the air permeates this incredible Billy Wilder film; yet, the deeper it crawls into its dark corner, the more repulsive it all seems. It can easily be called a masterpiece, but is it an entertaining movie? Great to see Hollywood circa 1950, with Schwab's Drug Store still there, but it's sad to think that even in 1950, stars were being discarded, replaced by the new and the younger, and even a star like Norma Desmond couldn't get a picture made. Thank goodness she had those oil wells in Bakersfield (""Pumping...pumping.""). There's a lesson to be learned from the film: invest! *** from ****",False
25,3,"Okay, definitely not great",moonmonday,n/a,15/08/2025,"It was okay.Gloria Swanson stole every scene she was in, and her expressive slightly overacting perfectly reflected her character, a performer from an age where vivid facial emotion was crucial in the absence of spoken dialogue. Eric von Stroheim plays an understated role and provides a strong, often silent presence. And William Holden is pretty, but not much else.Honestly, the only person who is remotely sympathetic or identifiable is Swanson's character of Norma Desmond, and the rest are fairly awful, aside from Stroheim's Max, who is basically very interesting scenery; I was pretty sad to reach the end and feel that everyone had basically come away with more or less just desserts. Holden's character was especially difficult to like and seemed to choose, at any given time, the worst and most idiotic possible choice of action.Was this Wilder's attempt at self-parody? Some parts of it would seem to be more satirical than serious, and the whole thing was entirely over the top. It could work as a Gothic tongue-in- cheek work, something like the Addams Family meets the silent age of film, which had aged past its prime.Perhaps it's just that the premise and the characters that populate it cannot really be seen the way they might have been in 1951. Desmond and Max's pathos and need for love and companionship juxtaposed with their isolation in a decaying yet still darkly splendid palace cannot fail to draw sympathy and interest. But Holden's Joe is just a stupid schmuck with a pretty face who never does anything right and was a poor choice for a protagonist.Ultimately it's hard to feel anything for him, though part of that may be the truly asinine choice to begin a film knowing your protagonist is...well, see for yourself. Or don't. It's good for a watch. I don't think I'll ever need to see it again.",False
