Review_number,User_rating,Review_title,User_id,User_id_link,Created_at,Review_Text,Spoiler
1,9,A bible for future action film makers!,devulapallic,n/a,16/08/2025,"A) RRR: Behind and Beyond (2024) is a good reference manual and a clear-eyed primer for filming action sequences. A bible for future action film makers!B) This documentary film provides a revealing look, a more three-dimensional view of the artistry behind RRR (2022). It accomplishes this thro':
i) immersive on-the-ground footage (archival footage),
ii) revelatory first-hand accounts, and
iii) plenty of nostalgia leading upto the historic night of the Oscars.C) It's good storytelling, mostly personal viewpoints by RRR's cast and crew told with a matter-of-fact honesty - creatively structured, and the film makes a good impression on first viewing itself.D) It is nice to see this film accomodating multiple perspectives when talking about a particular sequence.E) The documentary does an excellent job of breaking it down in simpler terms for viewers who are not savvy about modern filmmaking methods.F) The documentary film is edited with razor-sharp precision and it delivers the best possible experience. Enjoyable!G) It does take a talented production team to make a movie like RRR (2022) and this crew pulls it off, creating a piece of art that is affecting, educational, and inspiring.H) Rajamouli Garu clearly rubs off good vibes and positive energy on to his cast and crew. People seem to be vibrating with the same energy, trying to give more than they can, and wanting to create something of their own. Definitely, he's an inspirational figure!I) This documentary also makes room to honor the crew who are not into speaking English fluently. It's a nice gesture telling them that they are not forgotten or left behind.J) i am sure there are still some well-kept secrets in the making of RRR, but at some point it will have to come from the horse's mouth alone!",False
2,10,Respect Respect Respect !! Truly Beyond,abhilash-bit,n/a,16/08/2025,"Every frame was a sketch and executed to perfection.This will make the movie loving audience connect, empathise and cherish the real film making to the core.Mad respect to the greatest Rajamouli. Sir, you have pushed the storytelling to ups with every frame. Thank you for choosing to release this. Personally I rate this movie even higher than all your previous ones on the performances and storytelling front. Your entire team's sync with one another and to rally behind the vision and execute to the dot is what makes this film so special.Tarak and Charan performances will be etched in the history of movie performances.Hats off, Truly beyond !!",False
3,10,"An inspiring documentary for future film makers all over the world!! The Rise, Rise and Rise of Indian cinema 🔥",SohailH22,n/a,16/08/2025,"One of the finest and bestest documentaries on a masterpiece!!! RRR is the best Indian film ever made! Truly nothing less than a masterpiece and a great film!SS Rajamouli garu, thank you for taking Indian cinema globally and making every Indian proud! You're one of the greatest directors in Indian cinema!A film like RRR is made once in a lifetime and it's a film that is hugely successful and grand ! An incredibly amazing film with amazing VFX and CGI, writing, direction, BGM and music, performances, cinematography, storytelling, production values, art direction, action sequences and grandeur!Rajamouli garu, your contribution to Indian cinema is totally unforgettable!! Thank you for making epic films like Eega, Baahubali 1 & 2 and RRR!!! Can't wait for SSMB29!!",False
