Review_number,User_rating,Review_title,User_id,User_id_link,Created_at,Review_Text,Spoiler
1,8,Thanks,jack_o_hasanov_imdb,n/a,16/08/2025,"Even though the series appeals to a lot of teenagers, I was a teenager when I started watching it, but I continued until the end. It was sad.",False
2,10,Thanks for the ride!,kimmivamp,n/a,16/08/2025,"What a fitting ending to a show that has brought good people into my real life, made giving back so much fun, & helped me find a place my weird fits. 💙💙",False
3,10,Thank you!,mixailliaggas,n/a,16/08/2025,"The last seasons, especially the 15th, might not have been so good, but you kept us company so many years now that I can't complain about anything. The last episode of 15th season was so emotionally intense that for the first time I cried watching a film or series. Thank you for those amazing years lads!!",False
4,10,A beautiful homage,robinknutsen-98344,n/a,16/08/2025,"After 15 years, the cast and crew look back at the most memorable moments. Classic episodes, character introductions, unforgettable props, and the big story lines. No road lasts forever. This has everything to prepare you for the series finale.",False
5,10,Great,jenrivera-06266,n/a,16/08/2025,What a great tribute. I will always be a true fan and keep watching and enjoying.,False
6,5,Expected more.,chunkylefunga,n/a,16/08/2025,I was expecting proper interviews and in depth chats.But really this was a clip show with a bit of a chat in between.Should have been soo much more.,False
7,1,Legacy?,miyaarte,n/a,16/08/2025,"Ah yes, the writers, producers and others talk about the legacy of h*mophobia and m*sogyny.
15 years thrown down the drain, never to be seen again.
What's left, you ask?
Sam's party city wig is thriving, I hear!
Thank you cast members, Dabbs and the other guy? Not so much.",False
8,1,so bad,kakootah-34976,n/a,16/08/2025,I just don't understand why they would do something so bad,False
