Review_number,User_rating,Review_title,User_id,User_id_link,Created_at,Review_Text,Spoiler
14,5,"Stylish but lacks a real emotional connectionother than racing scenes, movie lacks urgency",matthewssilverhammer,n/a,15/08/2025,"Ron Howard is the rare Hollywood auteur that doesn't have a distinctive style (how did the guy that gave us ""Frost /Nixon"" give us Jim Carrey's ""How the Grinch Stole Christmas""?!). In his latest film ""Rush"", we get a glimpse of Howard playing with some Danny Boyle-esque flair, especially in the racing scenes. Unfortunately, outside of this visceral, kinetic spirit, ""Rush"" lacks an emotional connection with its audience, leaving us in the dust with only a memory of what just sped past. The amazing true story about the on-and-off-the-track rivalry of racers James Hunt (Hemsworth) and Niki Lauda (Bruhl) should be ripe pickings for good filmmaking. The story has some unexpected turns that are enlivened by their being true. Add to that some decent performances and a strong middle section involving a hospital, this should be a no-brainer success. Sadly the film fails in a number of other ways: the dialogue, while not bad, is unoriginal and boring, clichéd and overly-Hollywood. This along with some silly, overwrought Hollywood moments (""We may hate each other, but at least we respect each other"") hurt ""Rush"" immensely. Admittedly, I am not a racing fan of any kind, and this is clearly a movie made for them. Nonetheless, I think Howard is trying to reach beyond this demographic but comes up short. ""Rush"" is by no means a complete failure, but when it steps away from the formula 1 racing and slows down, it really putters outpun totally intended.",False
15,n/a,Bound to win Academy Award nominations - and rightly so,n/a,n/a,15/08/2025,"In 1976, the rivalry between two brilliant racing car drivers, the British James Hunt and the Austrian Nikki Lauda, came to a head in the almost literally life-and-death struggle of the Formula One championship. American director Ron Howard (""Apollo 13"", ""A Beautiful Mind"", ""Frost/Nixon"") and British scriptwriter Peter Morgan (both play and screenplay of ""Frost/Nixon"") have done a terrific job bringing the titanic struggle to the big screen, aided by some excellent casting and powerful sound and cinematography. Those were the days when most years a couple of drivers would be killed, so the stakes could not be higher.Sensibly the car racing does not over-dominate, since this is essentially a character- driven conflict, but when the racing is on screen - notably in the final race - the excitement is visceral. The Australian Chris Hemsworth (previously best known as ""Thor"") and the Spanish-born German Daniel Brühl (""Inglourious Basterds"") are so good as the British and Austrian drivers respectively that the dialect coaches should receive a special commendation. Arguably Brühl gives the stronger performance which should auger well for his future career.A great strength of this tale is that there is not a hero or a villain. Both drivers had privileged backgrounds and were superbly talented, but both were flawed. although in very contrasting ways, including styles of thinking, driving and womanising (Olivia Wilde as model Suzy Miller and Alexandra Maria Lara as aristocratic Marlene Knaus respectively).I never saw the recent film ""Senna"" (2010) so ""Rush"" reminded me most of the much older ""Grand Prix"" (1966), but what is stunning about ""Rush"" is that it all happened. A season of the fastest sport in the world decided in the last race by one point - you couldn't make it up. Rush to see the movie.",False
16,9,A super cool movie,auuwws,n/a,15/08/2025,A super cool movie Beautiful story and wonderful acting main actors,False
17,10,Daniel Bruhl even beats Oscar bound Leonardo,RichardvonLust,n/a,15/08/2025,Niki Lauder is among the most well known personalities in the history of Formula One. Even today millions of Germans watch his TV presentation at every race. We know his manner and speech extremely well and any actor portraying him faces an uphill if not impossible task.But Daniel Bruhl delivers a performance so wonderfully convincing in his faithful and profound portrayal that he should clearly be among the Oscar nominees for Best Actor. The story of Lauda's famous struggle with Hunt in 1976 has become the stuff of legends. And perhaps this production has used some artistic license to enhance them.But the film isn't really about the thrilling story of those events. That's just the vehicle for a much deeper drama examining the ever relevant dialectic between hedonism and pragmatism. It's about the self beneath the skin rather than the glamor of the surface: a concept normally quite alien to the Oscar awarding Hollywood elite. So poor Daniel Bruhl must await another vehicle to display his superb talents. And one day he might be remembered internationally in his career as Niki was himself.,False
18,9,Way more than just a Formula 1 sports film,Vartiainen,n/a,15/08/2025,"I liked this film a lot more than I would have anticipated. Sure I knew going in that the two main leads were both brilliant actors - Hemsworth especially has become a recent favourite of mine - but they both exceeded my wildest expectations. They became James Hunt (Hemsworth) and Niki Lauda (Daniel Brühl), down to the smallest of detail, the most delicate of nuance. The 1976 racing season was before my time, but even though I'm just a casual Formula 1 fan, I had heard about it and I knew who these two were. They were such large characters, such giants in their chosen field, that had this film not captured them perfectly, it wouldn't have been half as good as it is now. Luckily Howard's directing and the performances of these two are some of the finest I've seen in a long time.I also really like the fact that Rush is more than just a sports film about racing. It's a character study about two masters of their craft, embedded in deep rivalry. Both of them know that they stand unopposed, except for that one man, who's their polar opposite in both personality and driving style, yet who is just as capable. That's a great setting for a movie and Rush beautifully explores the possibilities given to it. You buy the rivalry and by the time of the final race I found myself at the edge of my seat, even though I already knew the outcome.It's also great how the movie never takes sides. It's not a film about Niki Lauda - even though he was involved in its making - nor is it about James Hunt. It's about them both and about the sport as a whole.To sum it up, I'd say this is the best sports movie I've seen in my life. But it's that because it's more than a simple example of its genre. It's a brilliant character study, an interesting period piece, a gripping drama and yes, at its core, a film with furiously fast cars. Highly recommended.",False
19,10,Rush brings intense racing action,insessionfilm,n/a,15/08/2025,"DIRECTION Ron Howard is amazing. His camera work here is absolutely incredible. I wouldn't at all be surprised if the cinematography and the sound editing are nominated for Oscars. The engines roaring alongside Hans Zimmer's score really gets you into the mood. The backdrop is gritty with lots of dark and gray colors giving it a tough 1970′s aesthetic. Howard places is camera so specifically and we get so many different angles that are gripping. Camera work inside the cars giving you the intense look of driving an F1 car as well as camera's on the grass looking up as they fly by. Howard's use of slow motion is also perfect and helps build the intensity of the rivalry he is exploring here. The racing is intense and the dangers are shown in some dramatic ways as the suspense keeps building up. The biggest problem is that Formula 1 isn't the biggest of sports here in the U.S. If people can get past that and go see this, they won't regret it.Grade: ASCRIPT The story follows two F1 drivers in the mid 1970′s that don't always get a long but have a mutual respect for one another. It centers around British driver, James Hunt and the Austrian Niki Lauda. Peter Morgan's script is brilliant and Howard brings it to life in some really great ways. In essence, both characters are the protagonist and the antagonist of the story. The film explores Hunt and his immature ways but at the same time makes him very likable. Then the story switches to Lauda and his quest to live his own life outside the big family business, yet again making him likable. However, at the same time each take their own turn in being the ""bad guy"" and showing you qualities that make this person flawed and unlikable in some ways. But then the movie brings it back around showing you why these characters are good characters to root for and the mutual respect they have for one another. It's the competition that drives them in this story. What makes it so great though, is that the audience really gets to choose who they want to root for. They build up and tear down each character so flawlessly. The use of narration at the beginning and at the end was a perfect choice as well. The ending becomes a bit sentimental and hits the buttons that you'd expect from Howard and company.Grade: APERFORMANCES Daniel Brühl and Chris Hemsworth are amazing. This is perhaps Hemsworth's best as he portray's James Hunt in some incredible ways. He's the dangerous driver that has Tony Stark mentalities in terms of partying, women and being extremely likable. Yet Hemsworth shows some depth and some emotion here as well which this character calls for in some ways. Brühl, who you may know from Inglorious Basterds, almost steals the show. He's the Austrian car genius who becomes famous for knowing how to make the cars lighter and faster, thus making him part of the Ferrari team. One can argue he's the bigger lead here as he narrates a good chunk of the story and brings in some great perspectives. Brühl's performance is spot on though and brings life to this character even when Lauda is more deadpanned. Olivia Wilde is good here although her character is a small role. This is about Brühl and Hemsworth and they carry the movie extremely well.Grade: A+SCORE Freakin Hans Zimmer. The dude is on fire lately. A lot of people like to criticize Zimmer for having score's that are similar or nothing new but they work. His score for Man of Steel added a lot to that film and his score for The Lone Ranger was about the only good part of that movie. And his score for Rush was really great, again. It added a lot of intensity to the racing moments and has become something he's perfected. The score here is more laid back and in the backdrop though many moments but when the action ramped up, so did his score as well as your emotion.Grade: A-FINAL THOUGHTS Rush was an unexpected pleasant surprise. Given the sports stature of F1 in the U.S., I didn't have much expectations but Ron Howard usually delivers and he does once again. The cinematography is gorgeous and makes it visually very exciting. The performances are stand outs which makes the story feel so alive in many places.Overall Grade: A",False
20,7,Couldn't get much Louda.,Quietb-1,n/a,15/08/2025,SpoilerOn of the best Grand Prix movies ever made.RUSH is a testosterone race fest. Ron Howard deserves credit for taking a redundant series of races and making them interesting and watchable.Good performances all around. The movie is elevated by an outstanding Hans Zimmer score. Excellent cinematography and ear pounding sound of engines put the viewer in the action.The hospital scenes are a bit tough for the faint of heart. The quiet face to face scene at the end between the competitors takes the movie to a higher level.This one should be seen and heard on a big screen.,True
21,8,What's This? A Ron Howard Movie That Isn't Intolerable?,evanston_dad,n/a,15/08/2025,"I never thought I would ever watch a Ron Howard movie again much less write a good review of one.Howard hasn't made a movie since ""Parenthood"" that has not bored me to tears and almost angered me with its pedestrian refusal to take any risks. He's turned into a lesser version of Steven Spielberg -- his films are just as maudlin and emotionally manipulative, but they lack Spielberg's technical panache.However, the great reviews of ""Rush"" and the awards attention that swirled briefly around Daniel Bruhl got my butt in the seat for it, and I was surprised by actually liking it. It's a lean, mean telling of the intense rivalry between race car drivers James Hunt and Niki Lauda. You don't need to care much about race car driving (I certainly don't) to enjoy the story, particularly that of Lauda, who overcame a devastating accident to return to the track. Bruhl is as good as everyone said he was at the time, and Chris Hemsworth, as Hunt, is serviceable if nothing special. This is still a Ron Howard film, so don't expect it to push any boundaries, but it's much more technically daring than anything else he's made, the cinematography and editing putting the audience in the driver's seat more than once.Grade: A-",False
22,7,Underrated,mgd_m,n/a,15/08/2025,"I was quite surprised by this movie. The ratings are good, but I don't like Ron Howard and I thought it was the usual, hollow overdramatization of actual events. Instead, it's a very nice movie, fairly accurate, and a must-see for any racing enthusiast.First and foremost, the racing scenes and the championship events are accurate and spectacular, they're pure fun.
I have to say there are some of the most perfect special effects I've ever seen, you can't say what's real and what's not.Also, I've NEVER seen a more accurate depiction of the 70's style; that's a very important thing to preserve the atmosphere and let you believe the movie is actually set in the 70's. Lots of movies fail miserably while attempting this. Here, every single t-shirt and haircut of the crowds in the stands is spot-on, the film grain for the racing scenes is very good, the cars are perfect, and most notably the tracks are straight out of the seventies.I like when the actors look like the real people they are interpreting. Here, everybody is a dead ringer: Niki, Marlene, Clay, everyone.Acting is good, Bruhl starts a bit over the top, but soon you'll get aquainted with his persona, and you'll find it's actually a very good performance.
Supporting cast is on par.
Just Hemsworth is a bit off target, because Hunt had a playful note he's not able to replicate. Here he plays just the ""handsome rogue"", and little more.The Lauda-Hunt relationship is the less accurate part of the story, but this is an understandable license.Lastly, some quotes have real swagger, the Drake makes a cameo appearence, and the scene where Lauda drives in the italian countryside is outstanding.",False
23,9,Surprisingly Great movie!!,ishan_vadera,n/a,15/08/2025,"RUSH is such an enthralling movie!! Amazing direction by Ron Howard, strong performances by Chris Hemsworth and Daniel Bruhl (he exactly sounded like Niki Lauda). Hanz Zimmer is the man for scoring this movie. The movie is not about the sport, it's about the hateful and envious relationship between two rivals the whole world knows about. I did not expect this movie to surprise me so much as it did, the drama was invigorating and exciting at the same time. It was such an honor to meet Niki Lauda who flew himself specially from Monza, Italy for the premier at TIFF. Such an amazing night.The movie is based on the rivalry of Britain's McLaren F1 driver James Hunt and Austrian driver Niki Lauda who represented Ferrari at the time. Great men!",False
24,7,Everything It Should Be,JackCerf,n/a,15/08/2025,"After a short framing section, this starts off with a bloody-mouthed Chris Hemsworth in half-undone racing coveralls strutting into an emergency room on a wave of testosterone like a cock into a hen house. Every female head in the place turns, and a glaze of lust falls across nurse Natalie Dormer's face. Within a minute and 4 lines of dialogue, he and she are doing the horizontal mambo on the examining table and, through a series of quick cuts, plenty of other places. In short, it looks like we're going to get a 16 year old boy's dream of being a race car driver.It turns out to be a great deal more. Director Howard and writer Morgan turn out to have a lot more empathy with the precise, earnest, űber-professional Austrian Niki Lauda (known as the Rat or the Sour Kraut) than they do with long haired, gorgeous English party animal James Hunt – there's a montage after Hunt wins the 1976 Formula 1 driving championship that subtly trivializes and belittles what he does with his victory, and a concluding tête á tête between Hunt and Lauda that makes it explicit. This isn't surprising considering the way the critics have treated Howard's body of work over the years.But along the way we're treated to a struggle between Cavalier and Roundhead, JFK and Nixon, inspiration and perspiration that is never less than captivating. The personal distaste between the two men, the contrast of styles, and the way they get into each other's heads are too intense for the subject of their rivalry, which after all is only motor racing. You feel that they were born 30 years too late, and that they should have been up in the sky a generation earlier, trying to kill each other in Spitfires and Messerschmitts instead of zipping around in McLarens and Ferraris. The gorgeous women (Dormer, Olivia Wilde, Alexandra Maria Lara) are more or less along for the ride as arm candy, although Hunt gets to display some dry, malicious English wit after his supermodel wife (Wilde) dumps him for Richard Burton. The racing sequences pull you in, and the overwhelming sound design gives you a real feel for the power (and fascination) of the internal combustion engine. The climactic race is subtly different than you'd expect from a sports movie but absolutely true to the characters.This is not great art, but it is thrilling popcorn entertainment the way it's supposed to be done, and it is to racing movies like Das Boot is to submarine movies. They'll never have to make another one.",False
25,5,When was the bar lowered?,utgard14,n/a,15/08/2025,"Not bad but terribly overrated drama. Seems like these days every movie that is halfway good is over-hyped and hailed as a masterpiece. I don't know when it happened but at some point in the last decade or so the bar was lowered. Now every moderately good film is lumped in with the greatest of all time. I'm no racing fan but I have enjoyed racing films before. Rush is overlong and doesn't build to anything really. The ending, or more to the point the last half hour, felt like a story searching for a powerful finish that it never found. I know this is based on real people and events, but I fail to see how that matters in the context of judging how they told the story. A dramatic film is not a documentary and artistic license is acceptable and, in many cases, desperately needed. What it comes down to is that this is a middle-of-the-road drama. Nothing exceptional and certainly nothing new. The performances are adequate, but nothing to rave about. The story, real or not, is fractured and lacking in any sense of a point in the end. I felt like I learned nothing of significance about the two men that the film focuses on. This is particularly true for James Hunt, portrayed by Chris Hemsworth. Other than being a walking cliché, what else was there to the man? The film has no answers. It has few more for Daniel Bruhl's Niki Lauda. Perhaps if they had chosen to focus on just one of the men rather than both, they could have told a more interesting story. As it is, it's a superficial drama about two men with unimpressive racing footage sprinkled throughout.",False
