Review_number,User_rating,Review_title,User_id,User_id_link,Created_at,Review_Text,Spoiler
1,10,Emotional and profound,fra_panfy,n/a,15/08/2025,"This episode really shows fears, insecurities and obstacles that get overcome thanks to hard work and team work, both professionally and personally. It makes you understand we all have the same doubts about ourselves, our partner, our relationship, our work, and the way Chiara gets to manage it all is simplyg inspiring. She's really an example and puts all herself in everything she does, being it for her family or her work. I cried with her trough out the entire episode because I felt her feelings! She's so humble and kind with everyone in her life and she deserves all her success! Absolutely loved it!",False
2,10,Amazing,prizhorvath,n/a,15/08/2025,"SpoilerSuch an amazing and emotional special episode.The way we are invited to this family's lives, showing us their insecurities, their success, their pain is humbling and made in such a beautiful, truthful way.This episode was just another way of this amazing family to show us life is not perfect and how they can overcome the challenges of marriage, family and career.Chiara is such an incredible person, her letter to herself and to all women out there is so inspiring and give us strength to believe in ourselves and keep going.Fedez showing us his imperfections, being truthful to himself, supporting what he believes in, owning up his mistakes and being willing to be better for himself and his family is extremely emotional.Love it and absolutely recommend it.",True
3,10,Chiara one of us 💜,manuelaremo,n/a,15/08/2025,"Chiara is very authentic and intended.The storytalling of the episodes is emotional and enjoyable.Chiara and her team communicate empathy.The countdown to the start of the festival
is anxiety.-provoking but it makes you experience Chiara's emotions and with Chiara.Not all that is gold glitters but Chiara glitters to presxinder because she is true, simply human.Fedez loves you but you need to grow, despite everything.You are an amazing family because you are two beautiful people and we see it 💜
I hope to see another season soon.Thank you Ferragnez for your transparency, keep it up 🙏",False
4,10,Really emotional,yjnymmbd,n/a,15/08/2025,"This episode is the centre of everything, it show the entire Chiara's view and her feelings... happiness, fear, anxiety, a lot of courage and how fierce she is about herself.We can't see everything from a device so watching her life and seeing who really she is, what she think, how she lives her life is amazing, how much she loves very single person in her life.I really like Chiara, she is a strong woman, she was able to create a empire from nothing and step by step she is arrived here: an important imagine in the fashion's world, she ad an own enterprise, she has milion of people who are inspired by her.She has all my admiration.",False
5,10,Inspiring,maryann-16312,n/a,15/08/2025,"SpoilerIt's just like a real journey in this experience, Chiara doing her best as always but this time we can see the behind the scenes which proves once again she's just like us, and we shouldn't let fear stop us but achieve the best we can achieve. It is all done nicely, the interviews, the storytelling, the scenes from the production following her. Fedez's mental difficulties that happened in that period are not being told in this episode, but if I'm not wrong, another one should be released.The mood is the same as her documentary (which is wonderful and my favourite of her tv programs) and the previews series of the Ferragnez, but shows more her focus and the way she prepares and handles her family in a big project. Loved it.",True
