"movie_link","movie_name","movie_poster_link","movie_year","movie_time","movie_rating","genre","short_description","how_many_people_rated","movie_popularity_score","director_name","writer_name","star_name","user_review","critic_viewers","meta_score","wins_and_nominations","oscar_link","top_cast_name_and_link","all_cast_crew_link","more_like_movie_link","aspect_ratio","sound_mix_company","box_office","production_company","also_known_as","language","country_of_origin","release_date","faq_link","user_review_link","facts_and_links","all_video_link","all_photo_link","filming_location_info"
"https://www.imdb.com/title/tt11173544/","JFK Revisited: Through the Looking Glass","https://m.media-amazon.com/images/M/MV5BMjI5NzlhN2UtNTdkNC00N2Q0LWJmNTAtZjI0NGJkOWFhOTFlXkEyXkFqcGc@._V1_.jpg","2021","PT1H58M","7.5","['Documentary', 'History']","Declassified files related to President Kennedy's assassination in a far larger context, aiming to shine more light on what really happened in 1963.","4709","","['Oliver Stone', '', '']","['James DiEugenio', '', '', '', '']","['Donald Sutherland', 'Oliver Stone', 'Whoopi Goldberg']","75","32","55","{'wins': 0, 'nominations': 0}","https://www.imdb.com/event/ev0000147/2021/1/?ref_=ttawd_1","{1: {'org_name': 'Donald Sutherland', 'org_link': 'https://www.imdb.com/name/nm0000661/?ref_=tt_cst_t_1', 'char_name': 'Narrator', 'char_link': 'https://www.imdb.com/title/tt11173544/characters/nm0000661/?ref_=tt_cst_c_1'}, 2: {'org_name': 'Oliver Stone', 'org_link': 'https://www.imdb.com/name/nm0000231/?ref_=tt_cst_t_2', 'char_name': 'Self, also co-narrator and interviewer', 'char_link': 'https://www.imdb.com/title/tt11173544/characters/nm0000231/?ref_=tt_cst_c_2'}, 3: {'org_name': 'Whoopi Goldberg', 'org_link': 'https://www.imdb.com/name/nm0000155/?ref_=tt_cst_t_3', 'char_name': 'Narrator', 'char_link': 'https://www.imdb.com/title/tt11173544/characters/nm0000155/?ref_=tt_cst_c_3'}, 4: {'org_name': 'Robert F. Kennedy Jr.', 'org_link': 'https://www.imdb.com/name/nm0447884/?ref_=tt_cst_t_4', 'char_name': 'Self - Environmental Attorney, Author, American Values: Lessons I Learned From My Family', 'char_link': 'https://www.imdb.com/title/tt11173544/characters/nm0447884/?ref_=tt_cst_c_4'}, 5: {'org_name': 'John F. Kennedy', 'org_link': 'https://www.imdb.com/name/nm0448123/?ref_=tt_cst_t_5', 'char_name': 'Self - 35th President of the United States', 'char_link': 'https://www.imdb.com/title/tt11173544/characters/nm0448123/?ref_=tt_cst_c_5'}, 6: {'org_name': 'Walter Cronkite', 'org_link': 'https://www.imdb.com/name/nm0004847/?ref_=tt_cst_t_6', 'char_name': 'Self - Host, CBS Evening News with Walter Cronkite', 'char_link': 'https://www.imdb.com/title/tt11173544/characters/nm0004847/?ref_=tt_cst_c_6'}, 7: {'org_name': 'Geraldo Rivera', 'org_link': 'https://www.imdb.com/name/nm0729273/?ref_=tt_cst_t_7', 'char_name': 'Self - Host, Good Night America', 'char_link': 'https://www.imdb.com/title/tt11173544/characters/nm0729273/?ref_=tt_cst_c_7'}, 8: {'org_name': 'Jacqueline Kennedy Onassis', 'org_link': 'https://www.imdb.com/name/nm0448080/?ref_=tt_cst_t_8', 'char_name': 'Self - First Lady of the United States', 'char_link': 'https://www.imdb.com/title/tt11173544/characters/nm0448080/?ref_=tt_cst_c_8'}, 9: {'org_name': 'Richard Nixon', 'org_link': 'https://www.imdb.com/name/nm0633271/?ref_=tt_cst_t_9', 'char_name': 'Self - 37th President of the United States', 'char_link': 'https://www.imdb.com/title/tt11173544/characters/nm0633271/?ref_=tt_cst_c_9'}, 10: {'org_name': 'Dan Rather', 'org_link': 'https://www.imdb.com/name/nm0711710/?ref_=tt_cst_t_10', 'char_name': 'Self - CBS Correspondent', 'char_link': 'https://www.imdb.com/title/tt11173544/characters/nm0711710/?ref_=tt_cst_c_10'}, 11: {'org_name': 'Tom Brokaw', 'org_link': 'https://www.imdb.com/name/nm0111232/?ref_=tt_cst_t_11', 'char_name': 'Self - Host, NBC Nightly News with Tom Brokaw', 'char_link': 'https://www.imdb.com/title/tt11173544/characters/nm0111232/?ref_=tt_cst_c_11'}, 12: {'org_name': 'Martin Luther King', 'org_link': 'https://www.imdb.com/name/nm0455052/?ref_=tt_cst_t_12', 'char_name': 'Self - Civil Rights Activist', 'char_link': 'https://www.imdb.com/title/tt11173544/characters/nm0455052/?ref_=tt_cst_c_12'}, 13: {'org_name': 'Lee Harvey Oswald', 'org_link': 'https://www.imdb.com/name/nm0652640/?ref_=tt_cst_t_13', 'char_name': 'Self - Alleged Assassin', 'char_link': 'https://www.imdb.com/title/tt11173544/characters/nm0652640/?ref_=tt_cst_c_13'}, 14: {'org_name': 'Fidel Castro', 'org_link': 'https://www.imdb.com/name/nm0004242/?ref_=tt_cst_t_14', 'char_name': 'Self - Leader of Cuba', 'char_link': 'https://www.imdb.com/title/tt11173544/characters/nm0004242/?ref_=tt_cst_c_14'}, 15: {'org_name': 'Dwight D. Eisenhower', 'org_link': 'https://www.imdb.com/name/nm0252032/?ref_=tt_cst_t_15', 'char_name': 'Self - 34th President of the United States', 'char_link': 'https://www.imdb.com/title/tt11173544/characters/nm0252032/?ref_=tt_cst_c_15'}, 16: {'org_name': 'Gerald Ford', 'org_link': 'https://www.imdb.com/name/nm0004934/?ref_=tt_cst_t_16', 'char_name': 'Self - Representative from Michigan, Member of Warren Commission', 'char_link': 'https://www.imdb.com/title/tt11173544/characters/nm0004934/?ref_=tt_cst_c_16'}, 17: {'org_name': 'Lyndon B. Johnson', 'org_link': 'https://www.imdb.com/name/nm0425696/?ref_=tt_cst_t_17', 'char_name': 'Self - 36th President of the United States', 'char_link': 'https://www.imdb.com/title/tt11173544/characters/nm0425696/?ref_=tt_cst_c_17'}, 18: {'org_name': 'Charles de Gaulle', 'org_link': 'https://www.imdb.com/name/nm0208540/?ref_=tt_cst_t_18', 'char_name': 'Self - French President 1959 - 1969', 'char_link': 'https://www.imdb.com/title/tt11173544/characters/nm0208540/?ref_=tt_cst_c_18'}}","https://www.imdb.com/title/tt11173544/fullcredits/?ref_=tt_ov_3#cast","{1: {'movie_name': 'JFK: Destiny Betrayed', 'movie_link': '/title/tt15815500/?ref_=tt_mlt_t_1'}, 2: {'movie_name': 'JFK', 'movie_link': '/title/tt0102138/?ref_=tt_mlt_t_2'}, 3: {'movie_name': 'JFK: What the Doctors Saw', 'movie_link': '/title/tt29702876/?ref_=tt_mlt_t_3'}, 4: {'movie_name': 'Nuclear Now', 'movie_link': '/title/tt21376908/?ref_=tt_mlt_t_4'}, 5: {'movie_name': 'South of the Border', 'movie_link': '/title/tt1337137/?ref_=tt_mlt_t_5'}, 6: {'movie_name': 'The Putin Interviews', 'movie_link': '/title/tt6840134/?ref_=tt_mlt_t_6'}, 7: {'movie_name': 'The Untold History of the United States', 'movie_link': '/title/tt1494191/?ref_=tt_mlt_t_7'}, 8: {'movie_name': 'Lula', 'movie_link': '/title/tt32186444/?ref_=tt_mlt_t_8'}, 9: {'movie_name': 'JFK: The Smoking Gun', 'movie_link': '/title/tt2945784/?ref_=tt_mlt_t_9'}, 10: {'movie_name': 'Castro in Winter', 'movie_link': '/title/tt2316672/?ref_=tt_mlt_t_10'}, 11: {'movie_name': 'Salvador', 'movie_link': '/title/tt0091886/?ref_=tt_mlt_t_11'}, 12: {'movie_name': 'Ukraine on Fire', 'movie_link': '/title/tt5724358/?ref_=tt_mlt_t_12'}}","16:9 HD","['Stereo', 'https://www.imdb.com/search/title/?sound_mixes=stereo&ref_=tt_spec_att', 'Dolby Digital', 'https://www.imdb.com/search/title/?sound_mixes=dolby_digital&ref_=tt_spec_att']","{'Gross worldwide': '$15,508'}","['Ingenious Media', 'Ixtlan Productions', 'Pantagruel Productions']","['Як убили Джона Кеннеді']","['English']","['United States', 'United Kingdom']","11/12/2021","https://www.imdb.com/title/tt11173544/faq/?ref_=tt_faq_1#run-time","https://www.imdb.com/title/tt11173544/reviews/?ref_=tt_ururv_sm","{'Trivia': ['Towards the end of the film Robert F Kennedy Jr talks about JFK\'s popularity being measured by how many boulevards are named after him. The fourth example says ""Kennedy Road"" and underneath ""32-26"" then some Chinese characters, then ""24-22A"". This sign is in Hong Kong, but the road is named after Arthur Kennedy, the 7th Governor of Hong Kong, not JFK.', 'https://www.imdb.com/title/tt11173544/trivia/?ref_=tt_dyk_trv'], 'Quotes': ['Robert F. Kennedy Jr.: My father wanted to convey a message to Premier Krushchev that our family knew that the Soviets were not involved in the assassination, that it was a right-wing plot from our own country... . The day that his brother died, my father\'s first phone call was to the CIA desk officer at Langley, and he asked them, ""Did your people conduct this horror?""', 'https://www.imdb.com/title/tt11173544/quotes/?ref_=tt_dyk_qu'], 'Connections': ['Features CBS Evening News with Walter Cronkite (1941)', 'https://www.imdb.com/title/tt11173544/movieconnections/?ref_=tt_dyk_cnn']}","","[('https://m.media-amazon.com/images/M/MV5BMGIzM2JiYWYtYmRjYi00OGY5LWEzOTktNjA0Nzg0ZGUyZWNjXkEyXkFqcGc@._V1_.jpg', 'Oliver Stone at an event for JFK Revisited: Through the Looking Glass (2021)'), ('https://m.media-amazon.com/images/M/MV5BMGIzM2JiYWYtYmRjYi00OGY5LWEzOTktNjA0Nzg0ZGUyZWNjXkEyXkFqcGc@._V1_.jpg', 'Oliver Stone at an event for JFK Revisited: Through the Looking Glass (2021)'), ('https://m.media-amazon.com/images/M/MV5BYWNmYzNlNzctM2FlMC00N2IyLTgwYjMtMTNiYzZmZTgzMjMxXkEyXkFqcGc@._V1_.jpg', 'Lyndon B. Johnson and John F. Kennedy in JFK Revisited: Through the Looking Glass (2021)'), ('https://m.media-amazon.com/images/M/MV5BZTMzNWUzODItZWQ2Ny00ZGE0LTk2YjktYjdjZjlkYjUyYTE5XkEyXkFqcGc@._V1_.jpg', 'W.E. Newman Jr. and Jay Watson in JFK Revisited: Through the Looking Glass (2021)'), ('https://m.media-amazon.com/images/M/MV5BZjAwM2E3YTItODgyNi00OTg2LWI2NjgtM2RjMTRkMzdlOWFiXkEyXkFqcGc@._V1_.jpg', 'Lee Harvey Oswald and Thomas Arthur Vallee in JFK Revisited: Through the Looking Glass (2021)'), ('https://m.media-amazon.com/images/M/MV5BYjM4ODIwMDYtMmRhNy00ZDgyLTk0MTgtNTNiM2I2NTcxNGY4XkEyXkFqcGc@._V1_.jpg', 'Gerald Ford, Hale Boggs, John Sherman Cooper, Allen Dulles, John J. McCloy, J. Lee Rankin, Richard B. Russell, and Earl Warren in JFK Revisited: Through the Looking Glass (2021)'), ('https://m.media-amazon.com/images/M/MV5BNzE0ZTdlNmQtYjFiNi00MGU3LWE4ZmItNjYwODNjZmZkMzJkXkEyXkFqcGc@._V1_.jpg', 'JFK Revisited: Through the Looking Glass (2021)'), ('https://m.media-amazon.com/images/M/MV5BNjM0YzJkOTMtZjQzMy00ZGFjLWI4N2QtMGNjM2JhNzQwNjU5XkEyXkFqcGc@._V1_.jpg', 'Walter Cronkite and John J. McCloy in JFK Revisited: Through the Looking Glass (2021)'), ('https://m.media-amazon.com/images/M/MV5BZWVkOTc1NjEtNzg1NC00YjBiLWI2M2UtNTRiYmY2MjE4YTIxXkEyXkFqcGc@._V1_.jpg', 'Gerald Ford, Hale Boggs, John Sherman Cooper, Allen Dulles, John J. McCloy, Richard B. Russell, and Earl Warren in JFK Revisited: Through the Looking Glass (2021)'), ('https://m.media-amazon.com/images/M/MV5BYzNlZTg2YjUtNDdhYS00MWE5LWI4NGUtYWM0MmRiYmU1YmY0XkEyXkFqcGc@._V1_.jpg', 'JFK Revisited: Through the Looking Glass (2021)'), ('https://m.media-amazon.com/images/M/MV5BYTRiZmU4NTItYzFjMS00YmQwLWExMTItMmU4ZmRjZTM2MTQxXkEyXkFqcGc@._V1_.jpg', 'JFK Revisited: Through the Looking Glass (2021)'), ('https://m.media-amazon.com/images/M/MV5BYjVjZGVhZjMtZWFmOC00OTU3LTg3ZGEtYzQ3ZjBlY2Q5YTYxXkEyXkFqcGc@._V1_.jpg', 'Jacqueline Kennedy Onassis in JFK Revisited: Through the Looking Glass (2021)'), ('https://m.media-amazon.com/images/M/MV5BNmY2OWI0NTYtNjgwYy00NDQ2LWI1MmQtZDYwYTNlNDQ0ODRjXkEyXkFqcGc@._V1_.jpg', 'Lee Harvey Oswald in JFK Revisited: Through the Looking Glass (2021)'), ('https://m.media-amazon.com/images/M/MV5BZTM5OTI2YWMtYjZjMi00NDA0LWI2YjktZDE0YTY0NmNhOTQ3XkEyXkFqcGc@._V1_.jpg', 'Lee Harvey Oswald in JFK Revisited: Through the Looking Glass (2021)'), ('https://m.media-amazon.com/images/M/MV5BZTJlOTNmOTYtMGI0Yi00NmM1LTgwNWItMmU1NDZmODgxMmFhXkEyXkFqcGc@._V1_.jpg', 'Oliver Stone in JFK Revisited: Through the Looking Glass (2021)'), ('https://m.media-amazon.com/images/M/MV5BMWM4MTI2ZjctZGE3Mi00NDJlLWFhODktNWJiMTg5ZjdiMjI4XkEyXkFqcGc@._V1_.jpg', 'Dwight D. Eisenhower, Lyndon B. Johnson, Jacqueline Kennedy Onassis, John F. Kennedy, and Richard Nixon in JFK Revisited: Through the Looking Glass (2021)'), ('https://m.media-amazon.com/images/M/MV5BMTQ3ZmQwYjEtNTkzYy00NGFmLWEwZGEtZjRiNGQ2MDRiNTM2XkEyXkFqcGc@._V1_.jpg', 'Allen Dulles in JFK Revisited: Through the Looking Glass (2021)'), ('https://m.media-amazon.com/images/M/MV5BZDA0MjgxOTYtMGQxNy00ODUxLTk5ZTUtNzQ1Yzk1NzhjZjE3XkEyXkFqcGc@._V1_.jpg', 'Lee Harvey Oswald in JFK Revisited: Through the Looking Glass (2021)'), ('https://m.media-amazon.com/images/M/MV5BZDE2MjBlMmYtZWQxNC00YTc2LTgwOWMtYjYyYTNhM2M3MDZiXkEyXkFqcGc@._V1_.jpg', 'Jacqueline Kennedy Onassis and John F. Kennedy in JFK Revisited: Through the Looking Glass (2021)'), ('https://m.media-amazon.com/images/M/MV5BNTliZTg1ZTQtYmI4OS00ZjYwLTg5YWMtODc1NjA0ZmQyZjM0XkEyXkFqcGc@._V1_.jpg', 'JFK Revisited: Through the Looking Glass (2021)'), ('https://m.media-amazon.com/images/M/MV5BNWM1YjhiNzgtMzQ4YS00YTVmLWI1NWQtNjI4ZWU2ZjU4YmY2XkEyXkFqcGc@._V1_.jpg', 'Oliver Stone in JFK Revisited: Through the Looking Glass (2021)'), ('https://m.media-amazon.com/images/M/MV5BOTA5ZjQyZjItODk1Yy00ZGI2LTgxZmUtNmYyN2YzMGVhZTI1XkEyXkFqcGc@._V1_.jpg', 'Jacqueline Kennedy Onassis and John F. Kennedy in JFK Revisited: Through the Looking Glass (2021)'), ('https://m.media-amazon.com/images/M/MV5BNzEyZGMwNzItYzE2OS00MTViLWFmOTktZmQ5YjJmNzU4ZGJkXkEyXkFqcGc@._V1_.jpg', 'Oliver Stone in JFK Revisited: Through the Looking Glass (2021)'), ('https://m.media-amazon.com/images/M/MV5BNzEyZGMwNzItYzE2OS00MTViLWFmOTktZmQ5YjJmNzU4ZGJkXkEyXkFqcGc@._V1_.jpg', 'Oliver Stone in JFK Revisited: Through the Looking Glass (2021)'), ('https://m.media-amazon.com/images/M/MV5BYmU1YzQxZTItNGQ2NS00YjQ1LTg4ZTctZDYwYzQ0NzUyOWZhXkEyXkFqcGc@._V1_.jpg', 'John F. Kennedy in JFK Revisited: Through the Looking Glass (2021)'), ('https://m.media-amazon.com/images/M/MV5BYmI0YzM5NGYtNDY3MC00N2FhLWFkMGYtMWQxOTMzYjJmM2YyXkEyXkFqcGc@._V1_.jpg', 'JFK Revisited: Through the Looking Glass (2021)'), ('https://m.media-amazon.com/images/M/MV5BNGRjMTljMmQtNmI5MS00OWIzLWFmNmUtMTlhMmM5OTNlZjM2XkEyXkFqcGc@._V1_.jpg', 'Jacqueline Kennedy Onassis and John F. Kennedy in JFK Revisited: Through the Looking Glass (2021)'), ('https://m.media-amazon.com/images/M/MV5BMzAyMjcwNDYtNjVkYS00ZTA2LWIxZTMtN2Q1NGVjODJkODg2XkEyXkFqcGc@._V1_.jpg', 'JFK Revisited: Through the Looking Glass (2021)'), ('https://m.media-amazon.com/images/M/MV5BMjI5NzlhN2UtNTdkNC00N2Q0LWJmNTAtZjI0NGJkOWFhOTFlXkEyXkFqcGc@._V1_.jpg', 'John F. Kennedy in JFK Revisited: Through the Looking Glass (2021)'), ('https://m.media-amazon.com/images/M/MV5BNmM2NDkwZDQtNmQ3OC00ZjYzLThlODAtOWIwNDVmOGIzNDJhXkEyXkFqcGc@._V1_.jpg', 'John F. Kennedy in JFK Revisited: Through the Looking Glass (2021)'), ('https://m.media-amazon.com/images/M/MV5BMDVjMzJkYTEtODBhZi00N2JmLWE0NTYtZjBkY2VkYzIzMzQ3XkEyXkFqcGc@._V1_.jpg', 'John F. Kennedy in JFK Revisited: Through the Looking Glass (2021)'), ('https://m.media-amazon.com/images/M/MV5BMmZlNzRlYmEtNzVhZS00N2Q3LTg5YjctNzIwOTc0M2EzMjc1XkEyXkFqcGc@._V1_.jpg', 'John F. Kennedy in JFK Revisited: Through the Looking Glass (2021)')]","{'location': 'Dallas, USA', 'description': 'n/a', 'link': 'https://www.imdb.com/title/tt11173544/locations/?ref_=tt_dt_loc'}"
"https://www.imdb.com/title/tt14081460/","Futura","https://m.media-amazon.com/images/M/MV5BOWM1YTcxYTctNjlkYy00ZTdjLTliMjYtZWYzMDA1ZDVjMDZmXkEyXkFqcGc@._V1_.jpg","2021","PT1H45M","6.8","['Documentary']","A portrait of Italy observed through the eyes of teenagers who talk about the places they live in and imagine themselves, torn between the opportunities that surround them, the dream of what they want to become, the fear of failin...","609","","['Pietro Marcello', 'Francesco Munzi', 'Alice Rohrwacher']","['Stefano Laffi', 'Pietro Marcello', 'Francesco Munzi', '', '']","['Pietro Marcello', 'Francesco Munzi', 'Carlotta Parodi']","4","23","73","{'wins': 0, 'nominations': 0}","https://www.imdb.com/event/ev0000033/2021/1/?ref_=ttawd_1","{1: {'org_name': 'Pietro Marcello', 'org_link': 'https://www.imdb.com/name/nm2754122/?ref_=tt_cst_t_1', 'char_name': 'Self', 'char_link': 'https://www.imdb.com/title/tt14081460/characters/nm2754122/?ref_=tt_cst_c_1'}, 2: {'org_name': 'Francesco Munzi', 'org_link': 'https://www.imdb.com/name/nm0613359/?ref_=tt_cst_t_2', 'char_name': 'Self', 'char_link': 'https://www.imdb.com/title/tt14081460/characters/nm0613359/?ref_=tt_cst_c_2'}, 3: {'org_name': 'Carlotta Parodi', 'org_link': 'https://www.imdb.com/name/nm9905037/?ref_=tt_cst_t_3', 'char_name': 'Marzia', 'char_link': 'https://www.imdb.com/title/tt14081460/characters/nm9905037/?ref_=tt_cst_c_3'}, 4: {'org_name': 'Alice Rohrwacher', 'org_link': 'https://www.imdb.com/name/nm3114621/?ref_=tt_cst_t_4', 'char_name': 'Self', 'char_link': 'https://www.imdb.com/title/tt14081460/characters/nm3114621/?ref_=tt_cst_c_4'}, 5: {'org_name': 'Luigi Comencini', 'org_link': 'https://www.imdb.com/name/nm0173728/?ref_=tt_cst_t_5', 'char_name': 'Self', 'char_link': 'https://www.imdb.com/title/tt14081460/characters/nm0173728/?ref_=tt_cst_c_5'}}","https://www.imdb.com/title/tt14081460/fullcredits/?ref_=tt_ov_2#writer","{1: {'movie_name': 'Corpo celeste', 'movie_link': '/title/tt1886502/?ref_=tt_mlt_t_1'}, 2: {'movie_name': 'Le meraviglie', 'movie_link': '/title/tt3044244/?ref_=tt_mlt_t_2'}, 3: {'movie_name': 'Quattro strade', 'movie_link': '/title/tt14556014/?ref_=tt_mlt_t_3'}, 4: {'movie_name': 'Le pupille', 'movie_link': '/title/tt20215392/?ref_=tt_mlt_t_4'}, 5: {'movie_name': 'Omelia contadina', 'movie_link': '/title/tt12792516/?ref_=tt_mlt_t_5'}, 6: {'movie_name': 'Allégorie citadine', 'movie_link': '/title/tt33029917/?ref_=tt_mlt_t_6'}, 7: {'movie_name': 'Cameraperson', 'movie_link': '/title/tt5375040/?ref_=tt_mlt_t_7'}, 8: {'movie_name': 'Checosamanca', 'movie_link': '/title/tt1282029/?ref_=tt_mlt_t_8'}, 9: {'movie_name': 'Marx può aspettare', 'movie_link': '/title/tt12544762/?ref_=tt_mlt_t_9'}, 10: {'movie_name': 'O umbra de nor', 'movie_link': '/title/tt2362502/?ref_=tt_mlt_t_10'}, 11: {'movie_name': 'As Mil e Uma Noites - Volume 1: O Inquieto', 'movie_link': '/title/tt3284178/?ref_=tt_mlt_t_11'}, 12: {'movie_name': 'Bella e perduta', 'movie_link': '/title/tt2188860/?ref_=tt_mlt_t_12'}}","1.66 : 1","['Color', 'https://www.imdb.com/search/title/?colors=color&ref_=tt_spec_att']","{'Budget': '€1,300,000 (estimated)', 'Gross worldwide': '$1,245'}","['Avventurosa', 'Rai Cinema', 'Ministero della Cultura (MiC)']","['Gelecek']","N/A","['Italy']","10/25/2021","https://www.imdb.com/title/tt14081460/faq/?ref_=tt_faq_1#run-time","https://www.imdb.com/title/tt14081460/reviews/?ref_=tt_ururv_sm","{'Connections': ['Edited from Chi legge? Un viaggio lungo il Tirreno (1960)', 'https://www.imdb.com/title/tt14081460/movieconnections/?ref_=tt_dyk_cnn']}","","[('https://m.media-amazon.com/images/M/MV5BZGJkNDlmNjktYWU3OS00MjZlLWE4NGEtNDIyNGY1YWU4ZGZlXkEyXkFqcGc@._V1_.jpg', 'Futura (2021)'), ('https://m.media-amazon.com/images/M/MV5BZGJkNDlmNjktYWU3OS00MjZlLWE4NGEtNDIyNGY1YWU4ZGZlXkEyXkFqcGc@._V1_.jpg', 'Futura (2021)'), ('https://m.media-amazon.com/images/M/MV5BMTUwNzM0MDktMTViMi00YjYwLWJjOWMtMTgyNGI3NmZhMDBmXkEyXkFqcGc@._V1_.jpg', 'Futura (2021)'), ('https://m.media-amazon.com/images/M/MV5BMWQyMmI5OWUtMGQwZC00MDk1LTkyZDgtZDA4ZTVmMTNjNzE1XkEyXkFqcGc@._V1_.jpg', 'Futura (2021)'), ('https://m.media-amazon.com/images/M/MV5BNjJlMDhlMTUtODEwMy00N2Q4LWFlZDAtN2Y0ZTAxZTcwZjU3XkEyXkFqcGc@._V1_.jpg', 'Futura (2021)'), ('https://m.media-amazon.com/images/M/MV5BZmI3ZDcxYzMtZDFkNi00NzRlLTlhYTEtYzJmNTBhMWYwNzkwXkEyXkFqcGc@._V1_.jpg', 'Futura (2021)'), ('https://m.media-amazon.com/images/M/MV5BMzM4OGZkZTgtOTliMy00NGRlLTkzMDctMDQ0ZjhiY2MwODgwXkEyXkFqcGc@._V1_.jpg', 'Futura (2021)'), ('https://m.media-amazon.com/images/M/MV5BZGQyMjA0YTAtZDQyYS00Y2UyLTkzNTgtOWU0ODk0YjM2NzE1XkEyXkFqcGc@._V1_.jpg', 'Francesco Munzi, Pietro Marcello, and Alice Rohrwacher in Futura (2021)'), ('https://m.media-amazon.com/images/M/MV5BNDk2ODk0NDQtZWNjMy00YThmLTk3MWYtNmQyOWNjZTg0YTY0XkEyXkFqcGc@._V1_.jpg', 'Futura (2021)')]","{'location': 'n/a', 'description': 'n/a', 'link': 'n/a'}"
"https://www.imdb.com/title/tt14927320/","Invisible demons: tuhon merkit","https://m.media-amazon.com/images/M/MV5BOTc3ZWZhMmMtMTU3YS00Y2ZmLWFiMmQtMjRkYzcxOTZhOTM3XkEyXkFqcGc@._V1_.jpg","2021","PT1H10M","7.1","['Documentary']","Explores the dramatic consequences of India's growing economy, capturing not only a city in crisis but magnifying our collective climate realities.","632","","['Rahul Jain', '', '']","['Yaël Bitton', 'Rahul Jain', 'Iikka Vehkalahti', '', '']","['Rahul Jain', 'Divya Wadhwa', 'Mrutyunjay Mohapatra']","1","N/A","N/A","{'wins': 2, 'nominations': 9}","https://www.imdb.com/event/ev0000147/2021/1/?ref_=ttawd_1","{1: {'org_name': 'Rahul Jain', 'org_link': 'https://www.imdb.com/name/nm8119812/?ref_=tt_cst_t_1', 'char_name': 'Self', 'char_link': 'https://www.imdb.com/title/tt14927320/characters/nm8119812/?ref_=tt_cst_c_1'}, 2: {'org_name': 'Divya Wadhwa', 'org_link': 'https://www.imdb.com/name/nm16237954/?ref_=tt_cst_t_2', 'char_name': 'Self, weather presenter, New Delhi Television', 'char_link': 'https://www.imdb.com/title/tt14927320/characters/nm16237954/?ref_=tt_cst_c_2'}, 3: {'org_name': 'Mrutyunjay Mohapatra', 'org_link': 'https://www.imdb.com/name/nm16237955/?ref_=tt_cst_t_3', 'char_name': 'Self, Director General of Meteorology, India Meteorological Department', 'char_link': 'https://www.imdb.com/title/tt14927320/characters/nm16237955/?ref_=tt_cst_c_3'}}","https://www.imdb.com/title/tt14927320/awards/?ref_=tt_awd","{1: {'movie_name': 'Razzhimaya kulaki', 'movie_link': '/title/tt14775666/?ref_=tt_mlt_t_1'}, 2: {'movie_name': ""My Mother's Girlfriend"", 'movie_link': '/title/tt13905616/?ref_=tt_mlt_t_2'}, 3: {'movie_name': 'Futura', 'movie_link': '/title/tt14081460/?ref_=tt_mlt_t_3'}, 4: {'movie_name': 'Free Chol Soo Lee', 'movie_link': '/title/tt16376512/?ref_=tt_mlt_t_4'}, 5: {'movie_name': 'The Watchman', 'movie_link': '/title/tt30954113/?ref_=tt_mlt_t_5'}, 6: {'movie_name': 'La caja', 'movie_link': '/title/tt13846544/?ref_=tt_mlt_t_6'}, 7: {'movie_name': 'Lingui', 'movie_link': '/title/tt13846546/?ref_=tt_mlt_t_7'}, 8: {'movie_name': 'Los colonos', 'movie_link': '/title/tt10370812/?ref_=tt_mlt_t_8'}, 9: {'movie_name': 'Les Cinq Diables', 'movie_link': '/title/tt13391708/?ref_=tt_mlt_t_9'}, 10: {'movie_name': 'Alcarràs', 'movie_link': '/title/tt11930126/?ref_=tt_mlt_t_10'}, 11: {'movie_name': 'A Chiara', 'movie_link': '/title/tt14324296/?ref_=tt_mlt_t_11'}, 12: {'movie_name': 'Allégorie citadine', 'movie_link': '/title/tt33029917/?ref_=tt_mlt_t_12'}}","1.85 : 1","['Color', 'https://www.imdb.com/search/title/?colors=color&ref_=tt_spec_att']","{'Box Office': 'n/a'}","['Ma.Ja.De Filmproduktion', 'Participant', 'Toinen Katse']","['Invisible Demons']","N/A","['Finland', 'Germany']","11/26/2021","","https://www.imdb.com/title/tt14927320/reviews/?ref_=tt_ururv_sm","{}","","[('https://m.media-amazon.com/images/M/MV5BOTc3ZWZhMmMtMTU3YS00Y2ZmLWFiMmQtMjRkYzcxOTZhOTM3XkEyXkFqcGc@._V1_.jpg', 'Invisible demons: tuhon merkit (2021)'), ('https://m.media-amazon.com/images/M/MV5BOTc3ZWZhMmMtMTU3YS00Y2ZmLWFiMmQtMjRkYzcxOTZhOTM3XkEyXkFqcGc@._V1_.jpg', 'Invisible demons: tuhon merkit (2021)'), ('https://m.media-amazon.com/images/M/MV5BNTlkNTVhNzktYTVmMC00NWFjLTgxMTQtNWVlNzI4MDRmZDc5XkEyXkFqcGc@._V1_.jpg', 'Invisible demons: tuhon merkit (2021)'), ('https://m.media-amazon.com/images/M/MV5BZjJlOGM3MWUtM2VjNy00OGEzLTliMjgtNjUwMzI3MzYwMmM5XkEyXkFqcGc@._V1_.jpg', 'Invisible demons: tuhon merkit (2021)'), ('https://m.media-amazon.com/images/M/MV5BNjI2YzUyYjEtMzdlMy00NmI2LWEzNWUtYWEzZGY5OTNkMzc5XkEyXkFqcGc@._V1_.jpg', 'Invisible demons: tuhon merkit (2021)'), ('https://m.media-amazon.com/images/M/MV5BYzc0MzdmN2MtMTIxNS00OTI0LTljYjMtNDUwZmFjMjgwNTEwXkEyXkFqcGc@._V1_.jpg', 'Invisible demons: tuhon merkit (2021)')]","{'location': 'n/a', 'description': 'n/a', 'link': 'n/a'}"
