"movie_link","movie_name","movie_poster_link","movie_year","movie_time","movie_rating","genre","short_description","how_many_people_rated","movie_popularity_score","director_name","writer_name","star_name","user_review","critic_viewers","meta_score","wins_and_nominations","oscar_link","top_cast_name_and_link","all_cast_crew_link","more_like_movie_link","aspect_ratio","sound_mix_company","box_office","production_company","also_known_as","language","country_of_origin","release_date","faq_link","user_review_link","facts_and_links","all_video_link","all_photo_link","filming_location_info"
"https://www.imdb.com/title/tt31868785/","An American Bombing: The Road to April 19th","https://m.media-amazon.com/images/M/MV5BYjllY2I0OWItMTNhZC00MDkxLWE0OGEtYWNkMzhkYjE0M2MyXkEyXkFqcGc@._V1_.jpg","2024","PT1H47M","6.8","['Documentary', 'Crime', 'History']","The events surrounding the 1995 Oklahoma City bombing, tracing its roots in anti-government sentiment and examining its lasting impact.","945","","['Marc Levin', '', '']","['', '', '', '', '']","['Kathy Sanders', 'Nancy Shaw', 'Marsha Kimble']","8","N/A","N/A","{'wins': 0, 'nominations': 0}","https://www.imdb.com/event/ev0000493/2025/1/?ref_=ttawd_1","{1: {'org_name': 'Kathy Sanders', 'org_link': 'https://www.imdb.com/name/nm16010628/?ref_=tt_cst_t_1', 'char_name': 'Self - Grandmother of Chase and Colton Smith', 'char_link': 'https://www.imdb.com/title/tt31868785/characters/nm16010628/?ref_=tt_cst_c_1'}, 2: {'org_name': 'Nancy Shaw', 'org_link': 'https://www.imdb.com/name/nm16075863/?ref_=tt_cst_t_2', 'char_name': 'Self - Oklahoma City Bombing Survivor', 'char_link': 'https://www.imdb.com/title/tt31868785/characters/nm16075863/?ref_=tt_cst_c_2'}, 3: {'org_name': 'Marsha Kimble', 'org_link': 'https://www.imdb.com/name/nm16075864/?ref_=tt_cst_t_3', 'char_name': 'Self - Mother of Frankie Merrell', 'char_link': 'https://www.imdb.com/title/tt31868785/characters/nm16075864/?ref_=tt_cst_c_3'}, 4: {'org_name': 'Bud Welch', 'org_link': 'https://www.imdb.com/name/nm3687760/?ref_=tt_cst_t_4', 'char_name': 'Self - Father of Julie Welch', 'char_link': 'https://www.imdb.com/title/tt31868785/characters/nm3687760/?ref_=tt_cst_c_4'}, 5: {'org_name': 'LaDonna Battle-Leverett', 'org_link': 'https://www.imdb.com/name/nm16075867/?ref_=tt_cst_t_5', 'char_name': 'Self - Daughter of Calvin and Peola Battle', 'char_link': 'https://www.imdb.com/title/tt31868785/characters/nm16075867/?ref_=tt_cst_c_5'}, 6: {'org_name': 'Daniel Coss', 'org_link': 'https://www.imdb.com/name/nm16075868/?ref_=tt_cst_t_6', 'char_name': 'Self - Former Oklahoma City Police Officer', 'char_link': 'https://www.imdb.com/title/tt31868785/characters/nm16075868/?ref_=tt_cst_c_6'}, 7: {'org_name': 'Mike Boettcher', 'org_link': 'https://www.imdb.com/name/nm2280875/?ref_=tt_cst_t_7', 'char_name': 'Self - Investigative Reporter', 'char_link': 'https://www.imdb.com/title/tt31868785/characters/nm2280875/?ref_=tt_cst_c_7'}, 8: {'org_name': 'Bob Sands', 'org_link': 'https://www.imdb.com/name/nm13978975/?ref_=tt_cst_t_8', 'char_name': 'Self - Investigative Reporter, NBC', 'char_link': 'https://www.imdb.com/title/tt31868785/characters/nm13978975/?ref_=tt_cst_c_8'}, 9: {'org_name': 'Bill Clinton', 'org_link': 'https://www.imdb.com/name/nm0001051/?ref_=tt_cst_t_9', 'char_name': 'Self - U.S. President 1993-2001', 'char_link': 'https://www.imdb.com/title/tt31868785/characters/nm0001051/?ref_=tt_cst_c_9'}, 10: {'org_name': 'Danny Coulson', 'org_link': 'https://www.imdb.com/name/nm6377429/?ref_=tt_cst_t_10', 'char_name': 'Self - Former FBI Special Agent', 'char_link': 'https://www.imdb.com/title/tt31868785/characters/nm6377429/?ref_=tt_cst_c_10'}, 11: {'org_name': 'Bob Ricks', 'org_link': 'https://www.imdb.com/name/nm0725569/?ref_=tt_cst_t_11', 'char_name': 'Self - Former FBI Special Agent', 'char_link': 'https://www.imdb.com/title/tt31868785/characters/nm0725569/?ref_=tt_cst_c_11'}, 12: {'org_name': 'Dan Herbeck', 'org_link': 'https://www.imdb.com/name/nm4470340/?ref_=tt_cst_t_12', 'char_name': 'Self - Co-Author, American Terrorist', 'char_link': 'https://www.imdb.com/title/tt31868785/characters/nm4470340/?ref_=tt_cst_c_12'}, 13: {'org_name': 'Kerry Noble', 'org_link': 'https://www.imdb.com/name/nm3242988/?ref_=tt_cst_t_13', 'char_name': 'Self - Former Extremist', 'char_link': 'https://www.imdb.com/title/tt31868785/characters/nm3242988/?ref_=tt_cst_c_13'}, 14: {'org_name': 'Stuart Wright', 'org_link': 'https://www.imdb.com/name/nm5062074/?ref_=tt_cst_t_14', 'char_name': 'Self - Author, Patriots, Politics and the OKC Bombing', 'char_link': 'https://www.imdb.com/title/tt31868785/characters/nm5062074/?ref_=tt_cst_c_14'}, 15: {'org_name': 'Stephen Jones', 'org_link': 'https://www.imdb.com/name/nm5632082/?ref_=tt_cst_t_15', 'char_name': 'Self - Attorney', 'char_link': 'https://www.imdb.com/title/tt31868785/characters/nm5632082/?ref_=tt_cst_c_15'}, 16: {'org_name': 'Asa Hutchinson', 'org_link': 'https://www.imdb.com/name/nm2005970/?ref_=tt_cst_t_16', 'char_name': 'Self - Former U.S. Attorney, Arkansas', 'char_link': 'https://www.imdb.com/title/tt31868785/characters/nm2005970/?ref_=tt_cst_c_16'}, 17: {'org_name': 'Kathleen Belew', 'org_link': 'https://www.imdb.com/name/nm13277658/?ref_=tt_cst_t_17', 'char_name': 'Self - Author, Bring the War Home', 'char_link': 'https://www.imdb.com/title/tt31868785/characters/nm13277658/?ref_=tt_cst_c_17'}, 18: {'org_name': 'Steven Snyder', 'org_link': 'https://www.imdb.com/name/nm14099373/?ref_=tt_cst_t_18', 'char_name': 'Self - Former Assistant U.S. Attorney', 'char_link': 'https://www.imdb.com/title/tt31868785/characters/nm14099373/?ref_=tt_cst_c_18'}}","https://www.imdb.com/title/tt31868785/fullcredits/?ref_=tt_ov_2#cast","{1: {'movie_name': 'The Truth vs. Alex Jones', 'movie_link': '/title/tt31189901/?ref_=tt_mlt_t_1'}, 2: {'movie_name': 'The Synanon Fix', 'movie_link': '/title/tt21822256/?ref_=tt_mlt_t_2'}, 3: {'movie_name': 'Oklahoma City', 'movie_link': '/title/tt6333090/?ref_=tt_mlt_t_3'}, 4: {'movie_name': 'Oklahoma City Bombing: American Terror', 'movie_link': '/title/tt36351149/?ref_=tt_mlt_t_4'}, 5: {'movie_name': 'Oklahoma City Bombing: One Day in America', 'movie_link': '/title/tt36415832/?ref_=tt_mlt_t_5'}, 6: {'movie_name': 'Space Shuttle Columbia: The Final Flight', 'movie_link': '/title/tt27789898/?ref_=tt_mlt_t_6'}, 7: {'movie_name': 'Ruby Ridge', 'movie_link': '/title/tt29892594/?ref_=tt_mlt_t_7'}, 8: {'movie_name': ""Atlanta's Missing and Murdered: The Lost Children"", 'movie_link': '/title/tt10720030/?ref_=tt_mlt_t_8'}, 9: {'movie_name': 'Brandy Hellville & the Cult of Fast Fashion', 'movie_link': '/title/tt31189910/?ref_=tt_mlt_t_9'}, 10: {'movie_name': 'MoviePass, MovieCrash', 'movie_link': '/title/tt14257662/?ref_=tt_mlt_t_10'}, 11: {'movie_name': 'Chowchilla', 'movie_link': '/title/tt27845543/?ref_=tt_mlt_t_11'}, 12: {'movie_name': 'American Conspiracy: The Octopus Murders', 'movie_link': '/title/tt31030101/?ref_=tt_mlt_t_12'}}","N/A","[None, None]","{'Box Office': 'n/a'}","['HBO Documentary Films', 'Blowback Productions']","['Un atentado americano: El camino hacia el 19 de abril']","N/A","['United States']","04/16/2024","","https://www.imdb.com/title/tt31868785/reviews/?ref_=tt_ururv_sm","{'Connections': [""Referenced in The Scott Horton Show: 4/25/24 Richard Booth on HBO's New OKC Bombing Documentary (2024)"", 'https://www.imdb.com/title/tt31868785/movieconnections/?ref_=tt_dyk_cnn']}","","[('https://m.media-amazon.com/images/M/MV5BZGM5OGEzMjItYTQzYS00OGUzLTk2MGMtODQzNTYwODcxYjNlXkEyXkFqcGc@._V1_.jpg', 'An American Bombing: The Road to April 19th (2024)'), ('https://m.media-amazon.com/images/M/MV5BZGM5OGEzMjItYTQzYS00OGUzLTk2MGMtODQzNTYwODcxYjNlXkEyXkFqcGc@._V1_.jpg', 'An American Bombing: The Road to April 19th (2024)')]","{'location': 'n/a', 'description': 'n/a', 'link': 'n/a'}"
"https://www.imdb.com/title/tt31723041/","Jimmy Carr: Natural Born Killer","https://m.media-amazon.com/images/M/MV5BMWU5YTE5MTItMGRkNi00ZTk4LWE2MzEtMjVkMWE0OTZkMDNlXkEyXkFqcGc@._V1_.jpg","2024","PT59M","6.7","['Documentary', 'Comedy']","An iconic comedian tackles controversial issues such as gun control, religion, cancellation culture and consent through provocative humor.","2676","","['Jimmy Carr', 'Brian Klein', '']","['Jimmy Carr', '', '', '', '']","['Jimmy Carr']","40","N/A","N/A","{'wins': 0, 'nominations': 0}","N/A","{1: {'org_name': 'Jimmy Carr', 'org_link': 'https://www.imdb.com/name/nm0139743/?ref_=tt_cst_t_1', 'char_name': 'Self', 'char_link': 'https://www.imdb.com/title/tt31723041/characters/nm0139743/?ref_=tt_cst_c_1'}}","https://www.imdb.com/title/tt31723041/fullcredits/?ref_=tt_cst_sm","{1: {'movie_name': 'Jimmy Carr: His Dark Material', 'movie_link': '/title/tt16259786/?ref_=tt_mlt_t_1'}, 2: {'movie_name': 'Jimmy Carr: Funny Business', 'movie_link': '/title/tt5222724/?ref_=tt_mlt_t_2'}, 3: {'movie_name': 'Jimmy Carr: The Best of Ultimate Gold Greatest Hits', 'movie_link': '/title/tt9817258/?ref_=tt_mlt_t_3'}, 4: {'movie_name': 'Neal Brennan: Crazy Good', 'movie_link': '/title/tt31723382/?ref_=tt_mlt_t_4'}, 5: {'movie_name': 'Demetri Martin: Demetri Deconstructed', 'movie_link': '/title/tt31916241/?ref_=tt_mlt_t_5'}, 6: {'movie_name': 'Ricky Gervais: Armageddon', 'movie_link': '/title/tt30088797/?ref_=tt_mlt_t_6'}, 7: {'movie_name': 'The Roast of Tom Brady', 'movie_link': '/title/tt32244679/?ref_=tt_mlt_t_7'}, 8: {'movie_name': 'Fern Brady: Autistic Bikini Queen', 'movie_link': '/title/tt31852892/?ref_=tt_mlt_t_8'}, 9: {'movie_name': 'Dave Attell: Hot Cross Buns', 'movie_link': '/title/tt31433262/?ref_=tt_mlt_t_9'}, 10: {'movie_name': 'Anthony Jeselnik: Bones and All', 'movie_link': '/title/tt34225422/?ref_=tt_mlt_t_10'}, 11: {'movie_name': 'Matt Rife: Lucid - A Crowd Work Special', 'movie_link': '/title/tt32986357/?ref_=tt_mlt_t_11'}, 12: {'movie_name': 'Kevin Hart: The Kennedy Center Mark Twain Prize for American Humor', 'movie_link': '/title/tt31805297/?ref_=tt_mlt_t_12'}}","2.00 : 1","['Color', 'https://www.imdb.com/search/title/?colors=color&ref_=tt_spec_att']","{'Box Office': 'n/a'}","","['吉米．卡爾：天生殺手']","N/A","['United Kingdom']","04/16/2024","","https://www.imdb.com/title/tt31723041/reviews/?ref_=tt_ururv_sm","{'Trivia': ['Filmed at Waterside Theatre Aylesbury', 'https://www.imdb.com/title/tt31723041/trivia/?ref_=tt_dyk_trv'], 'Quotes': [""Jimmy Carr: You can't go around apologizing for jokes. They're jokes. So I've got a plan. The next time I get cancelled over a joke, the next time I upset people with a joke, I'm gonna come out on the day of the cancellation, I'm gonna make a statement, a public statement. I'm gonna say, I've rehearsed this, I'm gonna say 'I'm SORRY!' And the people I've offended will say 'You don't really mean that apology.' And I'll say 'So you're saying I can say something and not mean it.' Now you're getting it."", 'https://www.imdb.com/title/tt31723041/quotes/?ref_=tt_dyk_qu']}","","[('https://m.media-amazon.com/images/M/MV5BYTQ3Yjk5YjYtYTRkOC00YzM4LWEyZTctOWJhMzllZTY2MjRkXkEyXkFqcGc@._V1_.jpg', 'Jimmy Carr in Jimmy Carr: Natural Born Killer (2024)'), ('https://m.media-amazon.com/images/M/MV5BYTQ3Yjk5YjYtYTRkOC00YzM4LWEyZTctOWJhMzllZTY2MjRkXkEyXkFqcGc@._V1_.jpg', 'Jimmy Carr in Jimmy Carr: Natural Born Killer (2024)'), ('https://m.media-amazon.com/images/M/MV5BNzZhYzJkNjctNDcyMy00OTgzLWE0YzgtOWI3ODI5ODZlMDYxXkEyXkFqcGc@._V1_.jpg', 'Jimmy Carr in Jimmy Carr: Natural Born Killer (2024)'), ('https://m.media-amazon.com/images/M/MV5BODc0ZGRjMjktZWRkZS00ODA0LWE2OWItYWVmODU1YjFmNGJjXkEyXkFqcGc@._V1_.jpg', 'Jimmy Carr in Jimmy Carr: Natural Born Killer (2024)'), ('https://m.media-amazon.com/images/M/MV5BNmVjMGU2YjgtNTAxYy00YWU1LWE1ZDEtMjBmNTQzZDdkOWVmXkEyXkFqcGc@._V1_.jpg', 'Jimmy Carr in Jimmy Carr: Natural Born Killer (2024)'), ('https://m.media-amazon.com/images/M/MV5BYzI3ZmI2MTUtZmE1Yy00YTczLTgzOWMtMmRkYzIzYzM3MmQ2XkEyXkFqcGc@._V1_.jpg', 'Jimmy Carr in Jimmy Carr: Natural Born Killer (2024)'), ('https://m.media-amazon.com/images/M/MV5BMWU5YTE5MTItMGRkNi00ZTk4LWE2MzEtMjVkMWE0OTZkMDNlXkEyXkFqcGc@._V1_.jpg', 'Jimmy Carr in Jimmy Carr: Natural Born Killer (2024)'), ('https://m.media-amazon.com/images/M/MV5BMzg4NjliNmYtNjBmZC00MmVlLWJjMjAtMGZjNjRlYzNkYTFiXkEyXkFqcGc@._V1_.jpg', 'Jimmy Carr in Jimmy Carr: Natural Born Killer (2024)'), ('https://m.media-amazon.com/images/M/MV5BYTk3ZjQ0NWQtMzdjZC00MTBjLWJjNDctMjgwMDU5YWQ4N2EwXkEyXkFqcGc@._V1_.jpg', 'Jimmy Carr: Natural Born Killer (2024)'), ('https://m.media-amazon.com/images/M/MV5BNzdmNmJkZTgtM2JhMi00MzI0LTg2ZmUtZWEyYjY2MTViZjQ0XkEyXkFqcGc@._V1_.jpg', 'Jimmy Carr in Jimmy Carr: Natural Born Killer (2024)'), ('https://m.media-amazon.com/images/M/MV5BOTdiMGY3NWQtMjFmMi00MjNkLWE5NDctNjc5MjhjOGVmOWQ0XkEyXkFqcGc@._V1_.jpg', 'Jimmy Carr in Jimmy Carr: Natural Born Killer (2024)')]","{'location': 'n/a', 'description': 'n/a', 'link': 'n/a'}"
"https://www.imdb.com/title/tt31437303/","Nasty","https://m.media-amazon.com/images/M/MV5BYTg0ZDcyNTQtOTBiNC00OTlhLWE0OTgtNGZmNzk5ZmZmOTk0XkEyXkFqcGc@._V1_.jpg","2024","PT1H43M","7.7","['Documentary', 'Biography', 'Sport']","1972 was a turning point in Ilie Nastase's career: winning US Open, reaching Wimbledon and Davis Cup finals. It portrays his victories, controversies, rebellious persona challenging tennis norms, and his influence as a tennis rebe...","1116","","['Tudor Giurgiu', 'Cristian Pascariu', 'Tudor D. Popescu']","['Tudor Giurgiu', 'Cristian Pascariu', '', '', '']","['Ilie Nastase', 'Steve Flink', 'Toni Nadal']","6","N/A","N/A","{'wins': 2, 'nominations': 8}","https://www.imdb.com/event/ev0000147/2024/1/?ref_=ttawd_1","{1: {'org_name': 'Ilie Nastase', 'org_link': 'https://www.imdb.com/name/nm0622021/?ref_=tt_cst_t_1', 'char_name': 'Self - Winner of 2 Grand Slam Singles Titles', 'char_link': 'https://www.imdb.com/title/tt31437303/characters/nm0622021/?ref_=tt_cst_c_1'}, 2: {'org_name': 'Steve Flink', 'org_link': 'https://www.imdb.com/name/nm1648141/?ref_=tt_cst_t_2', 'char_name': 'Self - Sports Journalist and Historian', 'char_link': 'https://www.imdb.com/title/tt31437303/characters/nm1648141/?ref_=tt_cst_c_2'}, 3: {'org_name': 'Toni Nadal', 'org_link': 'https://www.imdb.com/name/nm5739690/?ref_=tt_cst_t_3', 'char_name': 'Self - Tennis Coach', 'char_link': 'https://www.imdb.com/title/tt31437303/characters/nm5739690/?ref_=tt_cst_c_3'}, 4: {'org_name': 'Boris Becker', 'org_link': 'https://www.imdb.com/name/nm0004732/?ref_=tt_cst_t_4', 'char_name': 'Self - Winner of 6 Grand Slam Singles Titles', 'char_link': 'https://www.imdb.com/title/tt31437303/characters/nm0004732/?ref_=tt_cst_c_4'}, 5: {'org_name': 'Billie Jean King', 'org_link': 'https://www.imdb.com/name/nm0973361/?ref_=tt_cst_t_5', 'char_name': 'Self - Winner of 12 Grand Slam Singles Titles', 'char_link': 'https://www.imdb.com/title/tt31437303/characters/nm0973361/?ref_=tt_cst_c_5'}, 6: {'org_name': 'Rafael Nadal', 'org_link': 'https://www.imdb.com/name/nm1755783/?ref_=tt_cst_t_6', 'char_name': 'Self', 'char_link': 'https://www.imdb.com/title/tt31437303/characters/nm1755783/?ref_=tt_cst_c_6'}, 7: {'org_name': 'Jimmy Connors', 'org_link': 'https://www.imdb.com/name/nm1648086/?ref_=tt_cst_t_7', 'char_name': 'Self - Winner of 8 Grand Slam Singles Titles', 'char_link': 'https://www.imdb.com/title/tt31437303/characters/nm1648086/?ref_=tt_cst_c_7'}, 8: {'org_name': 'Eddie Dibbs', 'org_link': 'https://www.imdb.com/name/nm1658301/?ref_=tt_cst_t_8', 'char_name': 'Self - American Tennis Player', 'char_link': 'https://www.imdb.com/title/tt31437303/characters/nm1658301/?ref_=tt_cst_c_8'}, 9: {'org_name': 'Neil Amdur', 'org_link': 'https://www.imdb.com/name/nm0024498/?ref_=tt_cst_t_9', 'char_name': 'Self - Sports Writer', 'char_link': 'https://www.imdb.com/title/tt31437303/characters/nm0024498/?ref_=tt_cst_c_9'}, 10: {'org_name': 'John McEnroe', 'org_link': 'https://www.imdb.com/name/nm0568501/?ref_=tt_cst_t_10', 'char_name': 'Self - Winner of 7 Grand Slam Singles Titles', 'char_link': 'https://www.imdb.com/title/tt31437303/characters/nm0568501/?ref_=tt_cst_c_10'}, 11: {'org_name': 'Curry Kirkpatrick', 'org_link': 'https://www.imdb.com/name/nm1631199/?ref_=tt_cst_t_11', 'char_name': 'Self - Sports Writer', 'char_link': 'https://www.imdb.com/title/tt31437303/characters/nm1631199/?ref_=tt_cst_c_11'}, 12: {'org_name': 'Jonathan B. Rickert', 'org_link': 'https://www.imdb.com/name/nm16429664/?ref_=tt_cst_t_12', 'char_name': 'Self - Junior Diplomat, U.S. Embassy 1972', 'char_link': 'https://www.imdb.com/title/tt31437303/characters/nm16429664/?ref_=tt_cst_c_12'}, 13: {'org_name': 'Richard Evans', 'org_link': 'https://www.imdb.com/name/nm10431977/?ref_=tt_cst_t_13', 'char_name': 'Self - Writer and Historian', 'char_link': 'https://www.imdb.com/title/tt31437303/characters/nm10431977/?ref_=tt_cst_c_13'}, 14: {'org_name': 'Ion Tiriac', 'org_link': 'https://www.imdb.com/name/nm0864233/?ref_=tt_cst_t_14', 'char_name': 'Self - Romanian Businessman, Doubles Grand Slam Winner', 'char_link': 'https://www.imdb.com/title/tt31437303/characters/nm0864233/?ref_=tt_cst_c_14'}, 15: {'org_name': 'Björn Borg', 'org_link': 'https://www.imdb.com/name/nm0096410/?ref_=tt_cst_t_15', 'char_name': 'Self - Winner of 11 Grand Slam Singles Titles', 'char_link': 'https://www.imdb.com/title/tt31437303/characters/nm0096410/?ref_=tt_cst_c_15'}, 16: {'org_name': 'Stan Smith', 'org_link': 'https://www.imdb.com/name/nm10985547/?ref_=tt_cst_t_16', 'char_name': 'Self - Winner of 2 Grand Slam Singles Titles', 'char_link': 'https://www.imdb.com/title/tt31437303/characters/nm10985547/?ref_=tt_cst_c_16'}, 17: {'org_name': 'Petre Marmureanu', 'org_link': 'https://www.imdb.com/name/nm16429691/?ref_=tt_cst_t_17', 'char_name': 'Self - Romanian Tennis Player', 'char_link': 'https://www.imdb.com/title/tt31437303/characters/nm16429691/?ref_=tt_cst_c_17'}, 18: {'org_name': 'Tom Okker', 'org_link': 'https://www.imdb.com/name/nm1872024/?ref_=tt_cst_t_18', 'char_name': 'Self - Winner of 2 Grand Slam Doubles Titles', 'char_link': 'https://www.imdb.com/title/tt31437303/characters/nm1872024/?ref_=tt_cst_c_18'}}","https://www.imdb.com/title/tt31437303/fullcredits/?ref_=tt_ov_3#cast","{1: {'movie_name': 'Hai, România!', 'movie_link': '/title/tt31382099/?ref_=tt_mlt_t_1'}, 2: {'movie_name': 'Libertate', 'movie_link': '/title/tt25504794/?ref_=tt_mlt_t_2'}, 3: {'movie_name': 'Anul Nou care n-a fost', 'movie_link': '/title/tt33030375/?ref_=tt_mlt_t_3'}, 4: {'movie_name': 'Morometii 3', 'movie_link': '/title/tt31513857/?ref_=tt_mlt_t_4'}, 5: {'movie_name': 'Inca doua lozuri', 'movie_link': '/title/tt28153794/?ref_=tt_mlt_t_5'}, 6: {'movie_name': 'Nasty', 'movie_link': '/title/tt22500124/?ref_=tt_mlt_t_6'}, 7: {'movie_name': 'In Inima Nationalei', 'movie_link': '/title/tt32358368/?ref_=tt_mlt_t_7'}, 8: {'movie_name': 'Morometii 2', 'movie_link': '/title/tt9203168/?ref_=tt_mlt_t_8'}, 9: {'movie_name': 'The Netflix Slam', 'movie_link': '/title/tt30413143/?ref_=tt_mlt_t_9'}, 10: {'movie_name': 'De ce eu?', 'movie_link': '/title/tt4016994/?ref_=tt_mlt_t_10'}, 11: {'movie_name': 'Citizen Ashe', 'movie_link': '/title/tt7972668/?ref_=tt_mlt_t_11'}, 12: {'movie_name': 'Horia', 'movie_link': '/title/tt21154402/?ref_=tt_mlt_t_12'}}","N/A","[None, None]","{'Gross worldwide': '$220,715'}","['Libra Film']","['Nasty: More Than Just Tennis']","['English', 'Romanian', 'French', 'Spanish']","['Romania']","04/16/2024","","https://www.imdb.com/title/tt31437303/reviews/?ref_=tt_ururv_sm","{'Connections': ['References 4 mosche di velluto grigio (1971)', 'https://www.imdb.com/title/tt31437303/movieconnections/?ref_=tt_dyk_cnn']}","","[('https://m.media-amazon.com/images/M/MV5BNTVmOThiZjAtODkwNy00ZDlmLWI3NWMtZDQ0NGIwYTFlNGYwXkEyXkFqcGc@._V1_.jpg', 'Ilie Nastase and Ion Tiriac in Nasty (2024)'), ('https://m.media-amazon.com/images/M/MV5BNTVmOThiZjAtODkwNy00ZDlmLWI3NWMtZDQ0NGIwYTFlNGYwXkEyXkFqcGc@._V1_.jpg', 'Ilie Nastase and Ion Tiriac in Nasty (2024)'), ('https://m.media-amazon.com/images/M/MV5BNTgyYzA1NjMtZjUzZC00MGMzLWE2NTEtYjc1NmY2YjAzMzQ1XkEyXkFqcGc@._V1_.jpg', 'Ilie Nastase in Nasty (2024)'), ('https://m.media-amazon.com/images/M/MV5BOTY0NzBkM2UtMWRmNi00YzY4LWFkMTgtOTg3MDUzYWM3MDUyXkEyXkFqcGc@._V1_.jpg', 'Rafael Nadal in Nasty (2024)'), ('https://m.media-amazon.com/images/M/MV5BZWI0ZTY5YWEtYjFjNi00YTllLWEzZjMtZmZiNTlkZGY2NGRhXkEyXkFqcGc@._V1_.jpg', 'Ilie Nastase in Nasty (2024)'), ('https://m.media-amazon.com/images/M/MV5BMjZiZDAzNDUtZTllMS00ZTIwLTk4NTUtMTQ1ZDdmYmNhMjE0XkEyXkFqcGc@._V1_.jpg', 'Jimmy Connors in Nasty (2024)'), ('https://m.media-amazon.com/images/M/MV5BZjc5MGY1NWQtMDNmZi00ZjJiLWIwMmQtOTZhMGQyOWNmNjBlXkEyXkFqcGc@._V1_.jpg', 'John McEnroe in Nasty (2024)'), ('https://m.media-amazon.com/images/M/MV5BMjk0YzYwNzItNGRkZC00NDNlLWJjMjktZGZhZGU0NGFiNGFhXkEyXkFqcGc@._V1_.jpg', 'Ilie Nastase in Nasty (2024)'), ('https://m.media-amazon.com/images/M/MV5BMDExNzRkMmYtZTAwNi00ZTc5LWEyNzktYTNiYmJjMjcyY2MyXkEyXkFqcGc@._V1_.jpg', 'Ilie Nastase in Nasty (2024)'), ('https://m.media-amazon.com/images/M/MV5BOThlZWY5YjYtZGU1Yi00ZGExLWEzNWUtODNiYjFjNjZjY2QyXkEyXkFqcGc@._V1_.jpg', 'Ilie Nastase in Nasty (2024)'), ('https://m.media-amazon.com/images/M/MV5BYTg0ZDcyNTQtOTBiNC00OTlhLWE0OTgtNGZmNzk5ZmZmOTk0XkEyXkFqcGc@._V1_.jpg', 'Nasty (2024)')]","{'location': 'n/a', 'description': 'n/a', 'link': 'n/a'}"
"https://www.imdb.com/title/tt32128980/","Michael Palin in Nigeria","https://m.media-amazon.com/images/M/MV5BNTBjYzYwY2QtZGVhOC00N2IyLWEyODMtNWVlODYwZGE4NzNiXkEyXkFqcGc@._V1_.jpg","2024","N/A","7.3","['Documentary']","In the first leg of an epic 1300 miles across Nigeria, Michael is in bustling Lagos.","149","","['', '', '']","['', '', '', '', '']","['Michael Palin']","7","N/A","N/A","{'wins': 0, 'nominations': 0}","N/A","{1: {'org_name': 'Michael Palin', 'org_link': 'https://www.imdb.com/name/nm0001589/?ref_=tt_cst_t_1', 'char_name': 'Self - Presenter', 'char_link': 'https://www.imdb.com/title/tt32128980/characters/nm0001589/?ref_=tt_cst_c_1'}}","https://www.imdb.com/title/tt32128980/fullcredits/?ref_=tt_cst_sm","{1: {'movie_name': 'Michael Palin: Into Iraq', 'movie_link': '/title/tt21878174/?ref_=tt_mlt_t_1'}, 2: {'movie_name': 'Michael Palin in North Korea', 'movie_link': '/title/tt8683020/?ref_=tt_mlt_t_2'}, 3: {'movie_name': 'Full Circle with Michael Palin', 'movie_link': '/title/tt0122819/?ref_=tt_mlt_t_3'}, 4: {'movie_name': 'Around the World in 80 Days', 'movie_link': '/title/tt0096536/?ref_=tt_mlt_t_4'}, 5: {'movie_name': 'Himalaya with Michael Palin', 'movie_link': '/title/tt0379115/?ref_=tt_mlt_t_5'}, 6: {'movie_name': 'Pole to Pole', 'movie_link': '/title/tt0103514/?ref_=tt_mlt_t_6'}, 7: {'movie_name': 'Brazil with Michael Palin', 'movie_link': '/title/tt2510762/?ref_=tt_mlt_t_7'}, 8: {'movie_name': 'Michael Palin: Travels of a Lifetime', 'movie_link': '/title/tt13345556/?ref_=tt_mlt_t_8'}, 9: {'movie_name': 'New Europe', 'movie_link': '/title/tt1108394/?ref_=tt_mlt_t_9'}, 10: {'movie_name': ""Michael Palin's Hemingway Adventure"", 'movie_link': '/title/tt0179021/?ref_=tt_mlt_t_10'}, 11: {'movie_name': 'Around the World in 20 Years', 'movie_link': '/title/tt1346951/?ref_=tt_mlt_t_11'}, 12: {'movie_name': 'Sahara with Michael Palin', 'movie_link': '/title/tt0329919/?ref_=tt_mlt_t_12'}}","N/A","['Color', 'https://www.imdb.com/search/title/?colors=color&ref_=tt_spec_att']","{'Box Office': 'n/a'}","['ITN Productions']","['N/A']","['ITN Productions']","['United Kingdom']","04/16/2024","","https://www.imdb.com/title/tt32128980/reviews/?ref_=tt_ururv_sm","{}","","[('https://m.media-amazon.com/images/M/MV5BZWZlMjBjZGYtOTk0YS00Y2Q5LWI2OTQtNzIzMTNmYzY2MTg2XkEyXkFqcGc@._V1_.jpg', 'Michael Palin in Michael Palin in Nigeria (2024)'), ('https://m.media-amazon.com/images/M/MV5BZWZlMjBjZGYtOTk0YS00Y2Q5LWI2OTQtNzIzMTNmYzY2MTg2XkEyXkFqcGc@._V1_.jpg', 'Michael Palin in Michael Palin in Nigeria (2024)')]","{'location': 'n/a', 'description': 'n/a', 'link': 'n/a'}"
