"movie_link","movie_name","movie_poster_link","movie_year","movie_time","movie_rating","genre","short_description","how_many_people_rated","movie_popularity_score","director_name","writer_name","star_name","user_review","critic_viewers","meta_score","wins_and_nominations","oscar_link","top_cast_name_and_link","all_cast_crew_link","more_like_movie_link","aspect_ratio","sound_mix_company","box_office","production_company","also_known_as","language","country_of_origin","release_date","faq_link","user_review_link","facts_and_links","all_video_link","all_photo_link","filming_location_info"
"https://www.imdb.com/title/tt17041964/","Navalny","https://m.media-amazon.com/images/M/MV5BZjEzNTdlYzEtMGVkZi00ZWFhLWIzOTUtNjBiZjQyYWRmMGQyXkEyXkFqcGc@._V1_.jpg","2022","PT1H39M","7.7","['Documentary', 'Biography']","Follows the man who survived an assassination attempt by poisoning with a lethal nerve agent in August 2020. During his months-long recovery he makes shocking discoveries about the attempt on his life and decides to return home.","32064","","['Daniel Roher', '', '']","['', '', '', '', '']","['Alexei Navalny', 'Yulia Navalnaya', 'Christo Grozev']","147","175","82","{'wins': 17, 'nominations': 35}","https://www.imdb.com/event/ev0000003/2023/1/?ref_=ttawd_1","{1: {'org_name': 'Alexei Navalny', 'org_link': 'https://www.imdb.com/name/nm6281092/?ref_=tt_cst_t_1', 'char_name': 'Self - Political Opposition Leader in Russia', 'char_link': 'https://www.imdb.com/title/tt17041964/characters/nm6281092/?ref_=tt_cst_c_1'}, 2: {'org_name': 'Yulia Navalnaya', 'org_link': 'https://www.imdb.com/name/nm6764494/?ref_=tt_cst_t_2', 'char_name': ""Self - Alexei's Wife"", 'char_link': 'https://www.imdb.com/title/tt17041964/characters/nm6764494/?ref_=tt_cst_c_2'}, 3: {'org_name': 'Christo Grozev', 'org_link': 'https://www.imdb.com/name/nm10577559/?ref_=tt_cst_t_3', 'char_name': 'Self - Bellingcat Chief Investigator', 'char_link': 'https://www.imdb.com/title/tt17041964/characters/nm10577559/?ref_=tt_cst_c_3'}, 4: {'org_name': 'Dasha Navalnaya', 'org_link': 'https://www.imdb.com/name/nm13345643/?ref_=tt_cst_t_4', 'char_name': ""Self - Alexei's Daughter"", 'char_link': 'https://www.imdb.com/title/tt17041964/characters/nm13345643/?ref_=tt_cst_c_4'}, 5: {'org_name': 'Leonid Volkov', 'org_link': 'https://www.imdb.com/name/nm10789147/?ref_=tt_cst_t_5', 'char_name': ""Self - Navalny's Chief of Staff"", 'char_link': 'https://www.imdb.com/title/tt17041964/characters/nm10789147/?ref_=tt_cst_c_5'}, 6: {'org_name': 'Maria Pevchikh', 'org_link': 'https://www.imdb.com/name/nm12246737/?ref_=tt_cst_t_6', 'char_name': ""Self - Chief Investigator, Navalny's Anti-Corruption Foundation"", 'char_link': 'https://www.imdb.com/title/tt17041964/characters/nm12246737/?ref_=tt_cst_c_6'}, 7: {'org_name': 'Tim Lister', 'org_link': 'https://www.imdb.com/name/nm4319146/?ref_=tt_cst_t_7', 'char_name': 'Self - Journalist, CNN', 'char_link': 'https://www.imdb.com/title/tt17041964/characters/nm4319146/?ref_=tt_cst_c_7'}, 8: {'org_name': 'Fidelius Schmid', 'org_link': 'https://www.imdb.com/name/nm12427157/?ref_=tt_cst_t_8', 'char_name': 'Self - Journalist, Der Spiegel', 'char_link': 'https://www.imdb.com/title/tt17041964/characters/nm12427157/?ref_=tt_cst_c_8'}, 9: {'org_name': 'Zakhar Navalny', 'org_link': 'https://www.imdb.com/name/nm13345644/?ref_=tt_cst_t_9', 'char_name': ""Self - Alexei's Son"", 'char_link': 'https://www.imdb.com/title/tt17041964/characters/nm13345644/?ref_=tt_cst_c_9'}, 10: {'org_name': 'Georgy Alburov', 'org_link': 'https://www.imdb.com/name/nm9039309/?ref_=tt_cst_t_10', 'char_name': ""Self - Head of Investigation, Navalny's Anti-Corruption Foundation"", 'char_link': 'https://www.imdb.com/title/tt17041964/characters/nm9039309/?ref_=tt_cst_c_10'}, 11: {'org_name': 'Anna Biryukova', 'org_link': 'https://www.imdb.com/name/nm13345645/?ref_=tt_cst_t_11', 'char_name': ""Self - Investigator, Navalny's Anti-Corruption Foundation"", 'char_link': 'https://www.imdb.com/title/tt17041964/characters/nm13345645/?ref_=tt_cst_c_11'}, 12: {'org_name': 'Alexey Alexandrovich', 'org_link': 'https://www.imdb.com/name/nm14919700/?ref_=tt_cst_t_12', 'char_name': 'Self - FSB Agent', 'char_link': 'https://www.imdb.com/title/tt17041964/characters/nm14919700/?ref_=tt_cst_c_12'}, 13: {'org_name': 'John Berman', 'org_link': 'https://www.imdb.com/name/nm1635798/?ref_=tt_cst_t_13', 'char_name': 'Self - Co-Host, CNN New Day', 'char_link': 'https://www.imdb.com/title/tt17041964/characters/nm1635798/?ref_=tt_cst_c_13'}, 14: {'org_name': 'Aleksandr Bortnikov', 'org_link': 'https://www.imdb.com/name/nm9690761/?ref_=tt_cst_t_14', 'char_name': 'Self - Director of the FSB', 'char_link': 'https://www.imdb.com/title/tt17041964/characters/nm9690761/?ref_=tt_cst_c_14'}, 15: {'org_name': 'Konstantin Kudryavtsev', 'org_link': 'https://www.imdb.com/name/nm14919705/?ref_=tt_cst_t_15', 'char_name': 'Self - Alleged FSB Agent', 'char_link': 'https://www.imdb.com/title/tt17041964/characters/nm14919705/?ref_=tt_cst_c_15'}, 16: {'org_name': 'Angela Merkel', 'org_link': 'https://www.imdb.com/name/nm1361767/?ref_=tt_cst_t_16', 'char_name': 'Self - Chancellor of Germany', 'char_link': 'https://www.imdb.com/title/tt17041964/characters/nm1361767/?ref_=tt_cst_c_16'}, 17: {'org_name': 'Aleksandr Murakhovskiy', 'org_link': 'https://www.imdb.com/name/nm14657424/?ref_=tt_cst_t_17', 'char_name': 'Self - Chief Doctor of Omsk Hospital No 1', 'char_link': 'https://www.imdb.com/title/tt17041964/characters/nm14657424/?ref_=tt_cst_c_17'}, 18: {'org_name': 'Ivan Osipov', 'org_link': 'https://www.imdb.com/name/nm14919702/?ref_=tt_cst_t_18', 'char_name': 'Self - Alleged FSB Agent', 'char_link': 'https://www.imdb.com/title/tt17041964/characters/nm14919702/?ref_=tt_cst_c_18'}}","https://www.imdb.com/title/tt17041964/fullcredits/?ref_=tt_ov_2#cast","{1: {'movie_name': 'Women Talking', 'movie_link': '/title/tt13669038/?ref_=tt_mlt_t_1'}, 2: {'movie_name': '20 Days in Mariupol', 'movie_link': '/title/tt24082438/?ref_=tt_mlt_t_2'}, 3: {'movie_name': 'Dvorets dlya Putina. Istoriya samoy bolshoy vzyatki', 'movie_link': '/title/tt13875460/?ref_=tt_mlt_t_3'}, 4: {'movie_name': 'RRR (Rise Roar Revolt)', 'movie_link': '/title/tt8178634/?ref_=tt_mlt_t_4'}, 5: {'movie_name': 'Im Westen nichts Neues', 'movie_link': '/title/tt1016150/?ref_=tt_mlt_t_5'}, 6: {'movie_name': 'The Whale', 'movie_link': '/title/tt13833688/?ref_=tt_mlt_t_6'}, 7: {'movie_name': 'Ya pozvonil svoyemu ubiytse. On priznalsya', 'movie_link': '/title/tt13876312/?ref_=tt_mlt_t_7'}, 8: {'movie_name': 'Black Panther: Wakanda Forever', 'movie_link': '/title/tt9114286/?ref_=tt_mlt_t_8'}, 9: {'movie_name': 'Becoming Nawalny - Putins Staatsfeind Nr. 1', 'movie_link': '/title/tt31357825/?ref_=tt_mlt_t_9'}, 10: {'movie_name': 'Everything Everywhere All at Once', 'movie_link': '/title/tt6710474/?ref_=tt_mlt_t_10'}, 11: {'movie_name': 'Avatar: The Way of Water', 'movie_link': '/title/tt1630029/?ref_=tt_mlt_t_11'}, 12: {'movie_name': 'No Other Land', 'movie_link': '/title/tt30953759/?ref_=tt_mlt_t_12'}}","2.00 : 1","['Color', 'https://www.imdb.com/search/title/?colors=color&ref_=tt_spec_att']","{'Gross worldwide': '$107,186'}","['CNN Films', 'HBO Max', 'Fishbowl Films']","['Untitled Alexei Navalny Documentary']","['English', 'Russian', 'German']","['United States']","04/11/2022","https://www.imdb.com/title/tt17041964/faq/?ref_=tt_faq_1#run-time","https://www.imdb.com/title/tt17041964/reviews/?ref_=tt_ururv_sm","{'Trivia': ['In a 2023 interview with GoldDerby, Daniel Roher spoke about a critical moment captured in the film where one of Alexei Navalny\'s alleged poisoners seems to admit involvement over the phone: ""I don\'t speak a word of Russian, so when we were shooting that scene I didn\'t really understand the intricacies of what was being said. But just reading the temperature in the room, reading the facial expressions, we understood, despite our language skills, or lack of skills, we knew exactly what was happening. We knew that something explosive was being recorded. I remember filming and Maria Pevchikh\'s jaw, this is Navalny\'s chief investigator, she\'s depicted in the scene. Her jaw unhinges and hits the floor, and in that moment I just remember thinking to myself, \'Just keep shooting. Just keep shooting. Just. Keep. Shooting.\'""', 'https://www.imdb.com/title/tt17041964/trivia/?ref_=tt_dyk_trv'], 'Quotes': [""Alexei Navalny: Please let it be another movie. Movie #2 - Let's make a thriller out of this movie and in the case that I would be killed let's make a boring movie of memory."", 'https://www.imdb.com/title/tt17041964/quotes/?ref_=tt_dyk_qu'], 'Connections': ['Featured in The Oscars (2023)', 'https://www.imdb.com/title/tt17041964/movieconnections/?ref_=tt_dyk_cnn']}","","[('https://m.media-amazon.com/images/M/MV5BYTI3MjIzNDMtMmVmZS00NmIwLWEyYjEtMzhhNzZmNGJhOWY2XkEyXkFqcGc@._V1_.jpg', 'Alexei Navalny in Navalny (2022)'), ('https://m.media-amazon.com/images/M/MV5BYTI3MjIzNDMtMmVmZS00NmIwLWEyYjEtMzhhNzZmNGJhOWY2XkEyXkFqcGc@._V1_.jpg', 'Alexei Navalny in Navalny (2022)'), ('https://m.media-amazon.com/images/M/MV5BYzU1YjI0YjAtMmY3MS00NWE2LWJiZjMtNTFkZjYwZTJjYjQzXkEyXkFqcGc@._V1_.jpg', 'Odessa Rae, Diane Becker, and Daniel Roher at an event for Navalny (2022)'), ('https://m.media-amazon.com/images/M/MV5BZTc0MTg3MTItYmZmMy00ZWYzLTg4NTctZmYxMDRkNmQ2YThiXkEyXkFqcGc@._V1_.jpg', 'Daniel Roher at an event for Navalny (2022)'), ('https://m.media-amazon.com/images/M/MV5BMjNiOTc5NzMtNWVhNy00NDk0LWFiYjMtYTgwNmM0YzUzOWE2XkEyXkFqcGc@._V1_.jpg', 'Melanie Miller, Christo Grozev, Maria Pevchikh, Odessa Rae, Dasha Navalnaya, Zakhar Navalny, Diane Becker, Shane Boris, Daniel Roher, and Yulia Navalnaya at an event for Navalny (2022)'), ('https://m.media-amazon.com/images/M/MV5BZGE3ZmMzOWQtMzQ1Zi00MDI2LWI1NGMtZDAyY2E3NTRjM2M5XkEyXkFqcGc@._V1_.jpg', 'Alexei Navalny in Navalny (2022)'), ('https://m.media-amazon.com/images/M/MV5BNTM4ZjFjNDItMWViZC00MzcyLWJmZmMtM2UxNDllNmRmMzU2XkEyXkFqcGc@._V1_.jpg', 'Alexei Navalny in Navalny (2022)'), ('https://m.media-amazon.com/images/M/MV5BYmE0MGUwZTctY2YxMi00YTIzLWE1ZWItNDM0YjI0MjRlZjg3XkEyXkFqcGc@._V1_.jpg', 'Alexei Navalny in Navalny (2022)'), ('https://m.media-amazon.com/images/M/MV5BNjgyN2ZlZGYtNTE0ZC00ZWM2LThhZWQtNDNiNjZiYjBmMjdhXkEyXkFqcGc@._V1_.jpg', 'Alexei Navalny in Navalny (2022)'), ('https://m.media-amazon.com/images/M/MV5BNWFjYjJmMjktOWFkNS00ZTkyLTgyNzQtOWRkYTUzM2U1NzlmXkEyXkFqcGc@._V1_.jpg', 'Navalny (2022)'), ('https://m.media-amazon.com/images/M/MV5BYWY1NzhmMDctNDkwYS00ODAzLTlmMzQtZjhlNzZjMDE5MTk0XkEyXkFqcGc@._V1_.jpg', 'Navalny (2022)'), ('https://m.media-amazon.com/images/M/MV5BZWQzYjgwMGMtYmUyZS00NGE1LWE0ZGItZjFmYjQxZTI2Y2EyXkEyXkFqcGc@._V1_.jpg', 'Vladimir Putin and Alexei Navalny in Navalny (2022)'), ('https://m.media-amazon.com/images/M/MV5BYjIwNGRiNGYtNzlmMi00YzllLWE5MDYtNWRkNjY2MmQzN2Q2XkEyXkFqcGc@._V1_.jpg', 'Alexei Navalny in Navalny (2022)'), ('https://m.media-amazon.com/images/M/MV5BNmM5YjkwNjMtNmY3Yy00MzYwLTkxMjctOGZiZTFlZTc3YTBlXkEyXkFqcGc@._V1_.jpg', 'Alexei Navalny in Navalny (2022)'), ('https://m.media-amazon.com/images/M/MV5BMjdlMzNiMTgtNDZjNi00OTA1LTlhN2UtZGYzMzM2MzI1ZDRiXkEyXkFqcGc@._V1_.jpg', 'Alexei Navalny in Navalny (2022)'), ('https://m.media-amazon.com/images/M/MV5BNmE4Yzk1MTEtNGY4NC00YTFjLThlMTMtNmI4NjRhM2NjMjlhXkEyXkFqcGc@._V1_.jpg', 'Yulia Navalnaya in Navalny (2022)'), ('https://m.media-amazon.com/images/M/MV5BOWYxNGU0MDUtNjY4OS00NDk3LWIzNWEtOWIzZjViYWRmM2ZjXkEyXkFqcGc@._V1_.jpg', 'Aleksandr Murakhovskiy in Navalny (2022)'), ('https://m.media-amazon.com/images/M/MV5BNGI1OTJiZjQtOWQ2ZS00ZDkxLThjZjctMGYxYWIyMDEwZDJlXkEyXkFqcGc@._V1_.jpg', 'Navalny (2022)'), ('https://m.media-amazon.com/images/M/MV5BNjNkMTQxMDQtODYxOS00MWUwLWE5NzMtOWE3M2Q0Yjc1M2M2XkEyXkFqcGc@._V1_.jpg', 'Alexei Navalny in Navalny (2022)'), ('https://m.media-amazon.com/images/M/MV5BZjNmYjFiYTMtNWI2OS00YzE1LTgzOTMtYTYxMjZjMzk0MjFkXkEyXkFqcGc@._V1_.jpg', 'Navalny (2022)'), ('https://m.media-amazon.com/images/M/MV5BNzE2YzQ4NjEtNDRlYy00ZjdmLTkwNTctNDVmYzg1NWFiYjQ0XkEyXkFqcGc@._V1_.jpg', 'Christo Grozev in Navalny (2022)'), ('https://m.media-amazon.com/images/M/MV5BZDYyMzkzNjktZTQwOS00Mjg2LWE5OTgtNjNjODc5YjZhMDRjXkEyXkFqcGc@._V1_.jpg', 'Maria Pevchikh in Navalny (2022)'), ('https://m.media-amazon.com/images/M/MV5BN2Y5Yzk0Y2EtMGJjMS00NDdiLTk0M2UtOTUzYjQ1NTJmZmUzXkEyXkFqcGc@._V1_.jpg', 'Maria Pevchikh in Navalny (2022)'), ('https://m.media-amazon.com/images/M/MV5BMGMyNWYxM2QtZjZkYi00YzdiLTgxMDQtMjc1ZTQ4YjMzZTgxXkEyXkFqcGc@._V1_.jpg', 'Navalny (2022)'), ('https://m.media-amazon.com/images/M/MV5BYmM0MDg2YjUtMzRiYi00Y2U2LTg4MmEtNDQyMTFiOWQ0NTNkXkEyXkFqcGc@._V1_.jpg', 'Dasha Navalnaya, Zakhar Navalny, Alexei Navalny, and Yulia Navalnaya in Navalny (2022)'), ('https://m.media-amazon.com/images/M/MV5BNWIzZTE3ZjMtNzYzOS00NDBhLTg4YjEtNWE0OTU2ZTc2MjQzXkEyXkFqcGc@._V1_.jpg', 'Christo Grozev in Navalny (2022)'), ('https://m.media-amazon.com/images/M/MV5BMzZkMWRkZmMtN2Y3MS00NzBhLWFiNTgtZWY2NzFkNmMzYzA3XkEyXkFqcGc@._V1_.jpg', 'Alexei Navalny in Navalny (2022)'), ('https://m.media-amazon.com/images/M/MV5BMmYyYmUxYTEtY2VjYS00NThkLTlmYzgtYjhiNzQ4OWY0NWVjXkEyXkFqcGc@._V1_.jpg', 'Alexei Navalny in Navalny (2022)'), ('https://m.media-amazon.com/images/M/MV5BYzEzMWJmNWItYjU4ZC00ZjQ3LWI1NmYtYTQwZGMzZGM3NDk2XkEyXkFqcGc@._V1_.jpg', 'Navalny (2022)'), ('https://m.media-amazon.com/images/M/MV5BYWVmZmZkNmItMDMzYS00YjViLTgyZmItYmJkMjlmMGExOGIzXkEyXkFqcGc@._V1_.jpg', 'Vladimir Bogdanov in Navalny (2022)'), ('https://m.media-amazon.com/images/M/MV5BNGEyMTliZWEtYTU3OC00ZjVjLTk2MTItNjBiY2UxNDVjYTg5XkEyXkFqcGc@._V1_.jpg', 'Navalny (2022)'), ('https://m.media-amazon.com/images/M/MV5BZDYwYWY2NzktYTg4NC00ZmRlLWFlMjQtZDk0OGY5NTNlODAxXkEyXkFqcGc@._V1_.jpg', 'Navalny (2022)'), ('https://m.media-amazon.com/images/M/MV5BYzdhZDNmZDctMjY1Yy00NmM3LWIwNjEtYzZlYzNjNGI5MWYzXkEyXkFqcGc@._V1_.jpg', 'Alexei Navalny and Yulia Navalnaya in Navalny (2022)'), ('https://m.media-amazon.com/images/M/MV5BNzMxYzk2N2YtMDViZi00MGZiLTljOTAtNzZhYjU5MGJjMDRkXkEyXkFqcGc@._V1_.jpg', 'Christo Grozev in Navalny (2022)'), ('https://m.media-amazon.com/images/M/MV5BNTBlNzJkOWYtYWYzNi00ODA1LTllYzUtNjgwYWU3NTNhM2M4XkEyXkFqcGc@._V1_.jpg', 'Alexey Alexandrovich in Navalny (2022)'), ('https://m.media-amazon.com/images/M/MV5BNmQ3YjI2NGMtNmFhZi00NTAwLWJiMWItYjdiZTBmODYyODljXkEyXkFqcGc@._V1_.jpg', 'Christo Grozev, Oleg Tayakin, and Alexei Navalny in Navalny (2022)'), ('https://m.media-amazon.com/images/M/MV5BMGNiODU3ODEtMzNhNy00NGM0LWJiMjMtZGExODE0ODAyYjdjXkEyXkFqcGc@._V1_.jpg', 'Maria Pevchikh in Navalny (2022)'), ('https://m.media-amazon.com/images/M/MV5BM2E5M2VmMmEtYjQyNS00ZWIwLWFlNmMtMGU2NGQ4MmFkM2JmXkEyXkFqcGc@._V1_.jpg', 'Navalny (2022)'), ('https://m.media-amazon.com/images/M/MV5BNDgzN2I3NDUtNWJkMy00NTk0LWExNDgtMTFlZTk1NDEyMTRhXkEyXkFqcGc@._V1_.jpg', 'Alexei Navalny in Navalny (2022)'), ('https://m.media-amazon.com/images/M/MV5BZGI2MGYyOWUtYjk1My00YjljLWFmMzEtY2YyNTE0ZDUwZTQ3XkEyXkFqcGc@._V1_.jpg', 'Tim Lister in Navalny (2022)'), ('https://m.media-amazon.com/images/M/MV5BN2E5YWNiMmItMGRlMC00MGE1LWE2NjEtYWQzZTI5N2NkYmFmXkEyXkFqcGc@._V1_.jpg', 'Clarissa Ward and Alexei Navalny in Navalny (2022)'), ('https://m.media-amazon.com/images/M/MV5BMjU2NDM0YTYtZjRiYi00YzdlLWJiNmMtZGQzODc5OGQ1ZmI5XkEyXkFqcGc@._V1_.jpg', 'Christo Grozev and Alexei Navalny in Navalny (2022)'), ('https://m.media-amazon.com/images/M/MV5BMGRmZDQ3ZTgtNWUxMC00ZDlhLTkzZTItNTdiMjY2MGMzMDc3XkEyXkFqcGc@._V1_.jpg', 'Fidelius Schmid in Navalny (2022)'), ('https://m.media-amazon.com/images/M/MV5BMjk5OTViNmItNzhlYi00YmQwLTg1OTEtMmM5YjhlYWVmMTBiXkEyXkFqcGc@._V1_.jpg', 'Dasha Navalnaya and Alexei Navalny in Navalny (2022)'), ('https://m.media-amazon.com/images/M/MV5BOWUwYzRiZTgtYTRmOS00MmZhLTkwNTMtYjYzZWE1NDdlODRhXkEyXkFqcGc@._V1_.jpg', 'Alexei Navalny in Navalny (2022)'), ('https://m.media-amazon.com/images/M/MV5BNWFiYTA3ZTUtNWFkMi00YjkwLTgxZjUtOWZiNjZmZjFjODAyXkEyXkFqcGc@._V1_.jpg', 'Christo Grozev, Maria Pevchikh, and Alexei Navalny in Navalny (2022)'), ('https://m.media-amazon.com/images/M/MV5BYjc1NzIzYzgtMWIyZS00NzRiLWIyNzktZThkNTZlMmJmYzk3XkEyXkFqcGc@._V1_.jpg', 'Vladimir Panyaev in Navalny (2022)'), ('https://m.media-amazon.com/images/M/MV5BNmQ4MTYwNGQtN2RkMy00MzA5LTg3ODUtNGRmZTgzNGVmZjAwXkEyXkFqcGc@._V1_.jpg', 'Maria Pevchikh and Alexei Navalny in Navalny (2022)'), ('https://m.media-amazon.com/images/M/MV5BOTFmMzNlNTktOGZiNS00YmZhLWEzMzMtYzBhZDllNGIzNzhlXkEyXkFqcGc@._V1_.jpg', 'Kira Yarmysh, Dasha Navalnaya, and Alexei Navalny in Navalny (2022)'), ('https://m.media-amazon.com/images/M/MV5BMDM0OGRhNjEtYTA4MS00ODE1LWExMTktMzkwNzMyY2QyMTcwXkEyXkFqcGc@._V1_.jpg', 'Christo Grozev, Maria Pevchikh, and Alexei Navalny in Navalny (2022)')]","{'location': 'n/a', 'description': 'n/a', 'link': 'n/a'}"
"https://www.imdb.com/title/tt17030826/","The American Dream and Other Fairy Tales","https://m.media-amazon.com/images/M/MV5BZTdkMWUyYmEtMjZmOS00YTI2LWE4MTktYzlhN2MzMTA3ZTk4XkEyXkFqcGc@._V1_.jpg","2022","PT1H27M","6.5","['Documentary']","Filmmaker Abigail Disney examines income inequality at her family's company, asking why the American dream seems so out of reach for so many.","209","","['Abigail Disney', 'Kathleen Hughes', '']","['', '', '', '', '']","","4","13","61","{'wins': 0, 'nominations': 0}","N/A","{0: 0}","https://www.imdb.com/title/tt17030826/releaseinfo/?ref_=tt_dt_rdat","{1: {'movie_name': 'My Name Is Andrea', 'movie_link': '/title/tt10369638/?ref_=tt_mlt_t_1'}, 2: {'movie_name': 'La mesita del comedor', 'movie_link': '/title/tt21874760/?ref_=tt_mlt_t_2'}, 3: {'movie_name': 'The Quilters', 'movie_link': '/title/tt32165461/?ref_=tt_mlt_t_3'}}","N/A","[None, None]","{'Box Office': 'n/a'}","['Chicago Media Project', 'Fork Films']","['아메리칸 드림 앤드 아더 페어리 테일스']","['English']","['United States']","09/23/2022","","https://www.imdb.com/title/tt17030826/reviews/?ref_=tt_ururv_sm","{}","","[('https://m.media-amazon.com/images/M/MV5BOTFkNGI2MzMtNzYzMS00ZjM5LWI2Y2EtYWRlNGZlNTdjMTIwXkEyXkFqcGc@._V1_.jpg', 'The American Dream and Other Fairy Tales (2022)'), ('https://m.media-amazon.com/images/M/MV5BOTFkNGI2MzMtNzYzMS00ZjM5LWI2Y2EtYWRlNGZlNTdjMTIwXkEyXkFqcGc@._V1_.jpg', 'The American Dream and Other Fairy Tales (2022)')]","{'location': 'n/a', 'description': 'n/a', 'link': 'n/a'}"
"https://www.imdb.com/title/tt16390870/","The Great Postal Heist","https://m.media-amazon.com/images/M/MV5BMGE1ZmY5ZjMtZTAyYi00OGYyLWIwMGUtNTI5YzgzMDg2ODhjXkEyXkFqcGc@._V1_.jpg","2022","PT1H36M","7.6","['Documentary']","Jay Galione's documentary follows his father, a postal worker harassed and fired for standing up against USPS' toxic work culture, exposing systematic dismantling of the agency for profits at the expense of employee welfare.","54","","['Jay Galione', '', '']","['', '', '', '', '']","['Jay Galione', 'Robert Galione', 'Wayne Barr']","1","N/A","N/A","{'wins': 0, 'nominations': 0}","N/A","{1: {'org_name': 'Jay Galione', 'org_link': 'https://www.imdb.com/name/nm0302221/?ref_=tt_cst_t_1', 'char_name': 'Self', 'char_link': 'https://www.imdb.com/title/tt16390870/characters/nm0302221/?ref_=tt_cst_c_1'}, 2: {'org_name': 'Robert Galione', 'org_link': 'https://www.imdb.com/name/nm13546565/?ref_=tt_cst_t_2', 'char_name': 'Self - Postal Clerk', 'char_link': 'https://www.imdb.com/title/tt16390870/characters/nm13546565/?ref_=tt_cst_c_2'}, 3: {'org_name': 'Wayne Barr', 'org_link': 'https://www.imdb.com/name/nm13546566/?ref_=tt_cst_t_3', 'char_name': 'Self - Mail Carrier', 'char_link': 'https://www.imdb.com/title/tt16390870/characters/nm13546566/?ref_=tt_cst_c_3'}, 4: {'org_name': 'Audrey Davis', 'org_link': 'https://www.imdb.com/name/nm13546567/?ref_=tt_cst_t_4', 'char_name': 'Self - Mail Carrier', 'char_link': 'https://www.imdb.com/title/tt16390870/characters/nm13546567/?ref_=tt_cst_c_4'}, 5: {'org_name': 'Carl Jingles', 'org_link': 'https://www.imdb.com/name/nm13546568/?ref_=tt_cst_t_5', 'char_name': 'Self - Maintenance Engineer', 'char_link': 'https://www.imdb.com/title/tt16390870/characters/nm13546568/?ref_=tt_cst_c_5'}, 6: {'org_name': 'Fred Coleman', 'org_link': 'https://www.imdb.com/name/nm13546569/?ref_=tt_cst_t_6', 'char_name': 'Self - Mail Carrier', 'char_link': 'https://www.imdb.com/title/tt16390870/characters/nm13546569/?ref_=tt_cst_c_6'}, 7: {'org_name': 'Bobby Laton', 'org_link': 'https://www.imdb.com/name/nm13546570/?ref_=tt_cst_t_7', 'char_name': 'Self - Rural Mail Carrier', 'char_link': 'https://www.imdb.com/title/tt16390870/characters/nm13546570/?ref_=tt_cst_c_7'}, 8: {'org_name': 'Ron Williams', 'org_link': 'https://www.imdb.com/name/nm13546571/?ref_=tt_cst_t_8', 'char_name': 'Self - Mail Handler', 'char_link': 'https://www.imdb.com/title/tt16390870/characters/nm13546571/?ref_=tt_cst_c_8'}, 9: {'org_name': 'Rich Lippert', 'org_link': 'https://www.imdb.com/name/nm13546572/?ref_=tt_cst_t_9', 'char_name': 'Self - Postal Supervisor', 'char_link': 'https://www.imdb.com/title/tt16390870/characters/nm13546572/?ref_=tt_cst_c_9'}, 10: {'org_name': 'Terry Stapleton', 'org_link': 'https://www.imdb.com/name/nm13546573/?ref_=tt_cst_t_10', 'char_name': 'Self - Secretary-Treasurer, APWU 2004-2009', 'char_link': 'https://www.imdb.com/title/tt16390870/characters/nm13546573/?ref_=tt_cst_c_10'}, 11: {'org_name': 'Mary Burkhard', 'org_link': 'https://www.imdb.com/name/nm13546574/?ref_=tt_cst_t_11', 'char_name': 'USPS Sales Representative', 'char_link': 'https://www.imdb.com/title/tt16390870/characters/nm13546574/?ref_=tt_cst_c_11'}, 12: {'org_name': 'Tim Radke', 'org_link': 'https://www.imdb.com/name/nm13546575/?ref_=tt_cst_t_12', 'char_name': 'Self - Mail Carrier', 'char_link': 'https://www.imdb.com/title/tt16390870/characters/nm13546575/?ref_=tt_cst_c_12'}, 13: {'org_name': 'Jack Mathews', 'org_link': 'https://www.imdb.com/name/nm13546576/?ref_=tt_cst_t_13', 'char_name': 'Self - Mail Carrier', 'char_link': 'https://www.imdb.com/title/tt16390870/characters/nm13546576/?ref_=tt_cst_c_13'}, 14: {'org_name': 'Wanda Spencer', 'org_link': 'https://www.imdb.com/name/nm13546577/?ref_=tt_cst_t_14', 'char_name': ""Self - Mail Carrier Steve Spencer's Wife"", 'char_link': 'https://www.imdb.com/title/tt16390870/characters/nm13546577/?ref_=tt_cst_c_14'}, 15: {'org_name': 'Tracy Rickard', 'org_link': 'https://www.imdb.com/name/nm13546578/?ref_=tt_cst_t_15', 'char_name': 'Self - Mail Carrier', 'char_link': 'https://www.imdb.com/title/tt16390870/characters/nm13546578/?ref_=tt_cst_c_15'}, 16: {'org_name': 'Michael Mantell', 'org_link': 'https://www.imdb.com/name/nm13546579/?ref_=tt_cst_t_16', 'char_name': 'Self - Author of Ticking Bombs: Defusing Violence in the Workplace', 'char_link': 'https://www.imdb.com/title/tt16390870/characters/nm13546579/?ref_=tt_cst_c_16'}, 17: {'org_name': 'Tom Metz', 'org_link': 'https://www.imdb.com/name/nm13546580/?ref_=tt_cst_t_17', 'char_name': 'Self - Postal Worker', 'char_link': 'https://www.imdb.com/title/tt16390870/characters/nm13546580/?ref_=tt_cst_c_17'}, 18: {'org_name': 'Anthony Frank', 'org_link': 'https://www.imdb.com/name/nm13546581/?ref_=tt_cst_t_18', 'char_name': 'Self - US Postmaster General', 'char_link': 'https://www.imdb.com/title/tt16390870/characters/nm13546581/?ref_=tt_cst_c_18'}}","https://www.imdb.com/title/tt16390870/fullcredits/?ref_=tt_ov_2#cast","{1: {'movie_name': 'Postal', 'movie_link': '/title/tt9127488/?ref_=tt_mlt_t_1'}}","1h 36m","['English', 'https://www.imdb.com/search/title/?title_type=feature&primary_language=en&sort=moviemeter%2Casc&ref_=tt_dt_ln']","{'Box Office': 'n/a'}","","['N/A']","['English']","['United States']","01/25/2022","https://www.imdb.com/title/tt16390870/faq/?ref_=tt_faq_1#run-time","https://www.imdb.com/title/tt16390870/reviews/?ref_=tt_ururv_sm","{'Goofs': ['The scenes of Ralph Nader speaking show him in a room with three blurred paintings, reason not explained. But one time around the halfway mark (46:50) the paintings are briefly visible, then blurred again in later scenes.', 'https://www.imdb.com/title/tt16390870/goofs/?tab=gf&ref_=tt_dyk_gf']}","","[('https://m.media-amazon.com/images/M/MV5BMGE1ZmY5ZjMtZTAyYi00OGYyLWIwMGUtNTI5YzgzMDg2ODhjXkEyXkFqcGc@._V1_.jpg', 'The Great Postal Heist (2022)')]","{'location': 'n/a', 'description': 'n/a', 'link': 'n/a'}"
