Review_number,User_rating,Review_title,User_id,User_id_link,Created_at,Review_Text,Spoiler
18,10,This gets better with repeated viewings--what a film!,planktonrules,n/a,15/08/2025,"SpoilerI saw this film originally when I was about 12 and I wasn't super-impressed by it--particularly since my father was a bit like George C. Scott's character in the film!! However, years later (long after the threat from nuclear annihilation from the Soviet Union has greatly diminished), I was a lot older and experienced and thought the film was brilliant--and not the ""Commie Plot"" my Dad had envisioned!The film features some amazing performances that are absolutely mesmerizing. Sterling Hayden is excellent as the schizophrenic general that orders a first strike on the USSR--he's gruff, weird but pretty believable. However, his performance is unfortunately overshadowed by two other actors. My favorite of these was George C. Scott. Although he didn't need to do the amazing multiple roles that Peter Sellers did (the man was AMAZING), the one character he played was hilarious and chilling. He was the Chairman of the Joint Chief of Staff and you just have to see and hear him to believe him. Although technically NOT schizophrenic like Hayden, he was a totally insane general that actually seemed to look forward to a nuclear war with the ""!@&%@# Ruskies!"". His swagger and bravado was perfectly balanced with all the truly stupid things the character unintentionally said--again and again.Now as for Sellers, he was such a great character actor but all too often, he was remembered more for Inspector Clousseau (a good character, but only one of MANY the man was capable of doing) or he was remembered for all the BAD movies he did in his lifetime. It seems for every great film he made (such as THE MOUSE THAT ROARED or BEING THERE), he also made crap (such as THE PRISONER OF ZENDA or THE FIENDISH PLOT OF FU MANCHU). His lack of discernment tended to hide his brilliance. And, in Dr. Strangelove he was absolutely brilliant--playing three totally different roles. As the British Colonel, he was quite believable and underplayed the role. As the President, he was a little more comical and yet pretty convincing. And, as Dr. Strangelove, he was an over-the-top ex-Nazi (not all that ""ex"" if you ask me) madman. The variety was stunning and almost without precedent--except for a very similar multiple role situation Sellers also played in 1959's THE MOUSE THAT ROARED--another brilliant comedy about nuclear war.In addition to the great acting and writing, I do have to take my hat off to Stanley Kubrick. In past IMDb reviews, I was not particularly kind to several of his ""masterpieces"" (I am one of those who actually disliked 2001, CLOCKWORK ORANGE and BARRY LYNDON). However, I hope I am intellectually honest enough to view his films individually (PATHS OF GLORY, THE KILLING and SPARTACUS were wonderful).The bottom line is that this is a great film and can be enjoyed by anyone who has a decent handle on world events and history. Unfortunately, for a generation that now is at times obsessed with Paris Hilton and SURVIVOR, I also believe that the film is quickly becoming one that is simply beyond the capacity of many to even comprehend, as they can't even remember the past and have no trouble living that way.",True
19,n/a,A true masterpiece!,n/a,n/a,15/08/2025,"Doctor Strangelove or: How I Learned To Stop Worrying and Love the Bomb is truly a masterpiece. It manages to be a hilarious comedy while still being a film with very serious themes. It is just the perfect balance, and it is truly overall a flawless film.",False
20,10,Dr. Strangelove: A Masterpiece of Satire and Drama,nickykelly-65134,n/a,15/08/2025,"SpoilerStanley Kubrick's ""Dr. Strangelove or: How I Learned to Stop Worrying and Love the Bomb"" is cited as one of the director's best films, and one of, if not the best satirical comedy in cinema history, and with very good reason.Dr. Strangelove exceeds exponentially in many ways, the three main being the direction, writing and the unforgettable performances from George C. Scott, Sterling Hayden and of course, Peter Sellers.Kubrick's direction is perfect, the film is perfectly paced, no scene overstays it's welcome and the editing and camera angles do their jobs greatly at conveying a time of nuclear crisis but at the same time remaining darkly humorous. One of the more obvious factors of the film is that it is shot and presented in black and white which works perfectly with the film, the dark representing the terror of the situation and the white representing the comedic side of the film. Kubrick also manages to assist in the comedic side of the film, he achieved this through using 'rehearsal' takes and allowing Peter Sellers to improvise. The level of film making is exquisite, Kubrick uses mostly steady camera shots when in the War Room, and hand-held camera shots when inside the B-52 bomber, he also frames each image with perfection and creates incredible compositions. He never cuts too often or ever drastically changes the angle, thus never confusing the viewer and allowing the scenes to flow. The B- 52 models on real life footage backgrounds may look dated, but oddly enough it still works well with the overall tone of the film, in fact it could be argued that it even adds a small comedic aspect to the film.In my opinion, this film's writing was quite underrated, many people remember the genius unforgettable lines that were likely ad-libbed by Peter Sellers, but overall the film's dialogue and plot is incredibly well written. The plot goes that the general of an air force base goes mad and without-authority, commands a large number of B-52 bombers to attack their targets in Russia, and the men and President in the War Room, desperately attempt to prevent this from happening. This plot is outright brilliant and is executed brilliantly, there is no outright exposition in the dialogue, and any exposition there is, is not jarring or comes of as lazy at all. The film does an incredible job at creating an environment of sheer crisis, with George C. Scott's character explaining that there are very few options in resolving the matter, and the reveal of Russia's top secret 'Doomsday Machine' which adds an almost unbearable amount of tension to the film. The film reaches it's inevitable end of Nuclear Annihilation, after one of the B-52 bombers manages to hit one of it's targets, thus triggering the Doomsday Machine and ending all life on Earth. I found this ending not only to make sense, but also to fit perfectly into the film's tone, there is also a great comedic value to the end, with it coming so suddenly and playing classic music over the footage of many nuclear bombs detonating.Overall, I hope it is clear that I see this as simply one of the best comedies ever made, or even perhaps one of the best films ever made. The film is incredibly unique and although the more satirical points of the film may not be quite as relevant now, they are still hilarious to experience. The film holds up incredibly well even with it's clearly dated visual effects and somewhat dated humour, but Peter Seller's performance alone will allow for this film to be seen as one of the funniest satires ever made even long after the events the film is poking fun at have ended. And even if you don't find the film particularly funny, you can still be in awe of the genius film making and incredibly suspenseful plot.",True
21,10,"Outstanding, timeless classic!",RufusT,n/a,15/08/2025,"One of the best films ever made, this remains timeless despite changes in technology, foreign policy and world politics; the military/political madness remains the same.  Gets better all the time, with successive viewings and its luster has not dimmed since its first release.With three show-stopping performances from Sellers (amongst his best work, if not THE BEST), and an unexpectedly hilarious turn by George C. Scott (if Sellers weren't SO dead on-target, Scott would easily steal the show), STRANGELOVE is filled with cartoonish, over-the-top characters that, despite the lunacy, still ring true.  Special mention must be made for Sterling Heyden's controlled, brooding paranoia as General Jack D. Ripper.  He's funny, he's scary.All-in-all, a brilliant piece of work by all involved.",False
22,7,It's still such an interesting and unique film.,Sleepin_Dragon,n/a,15/08/2025,"A somewhat unhinged US General goes rogue, and orders a bombing raid on The Soviet Union. His actions send The War Room into a panic, various personalities clash, as they try to avoid a nuclear holocaust.I have really enjoyed reading the reviews, especially the numerous 10 star reviews, it's clear that this film is loved my many, personally I enjoyed it, I'd say it's a very good film, I'm not sure I see it as a great.When it comes to Kubrick I still think 2001 is my favourite, followed by Clockwork Orange.The acting is phenomenal, Peter Sellers gives one of his best (and let's be honest there are many) ever performances, he is phenomenal, each character he plays is so different.I enjoyed the cleverness of it, it's very sharp and witty, I thought some of the laughs were a little flat, and at times it was just a little too clever for its own good.I loved the visuals, it looks so sharp and polished, the black and white fits the story incredibly well.How gloriously unexpected that moment where Dame Vera Lynn comes blasting out with we'll meet again.Sellers is a joy to watch.7/10.",False
23,10,Kubrick takes a whack at comedy- and the cold war,Quinoa1984,n/a,15/08/2025,"Stanley Kubrick always likes to try something new with each movie he does, and this proves it. This is truly one of the grittiest, and best dark comedies I've ever seen with some crude moments and some odd ones (who'd think to have Slim Pickens riding a bomb on it's way down). It turns into a flat out masterpiece though with the spectacular acting by Peter Sellers (in three separate roles), George C. Scott (his facial expressions are a crack up every time), and a supporting cast of crazies in a government of loons, the most impressive of these being the incomparable Sterling Hayden in his best dramatic/funny role. It contains a resonance as well that sticks till today, as corruption and pig-headedness rules in all sorts of governments, but most of all in those with the most power. It's almost worth it just for the opening credits and end sequence with ""we'll meet again"".",False
24,6,Before Watching: Dr. Strangelove (1964),josephrygaard,n/a,15/08/2025,"""Dr. Strangelove"" (1964) is an iconic satire about the consequences of nuclear war and arms race. If you want to get as much out of it as possible, there are a few things you need to keep in mind before watching:It is important to remember that Dr. Strangelove is a movie from 1964 and was thereby released soon after the culmination of the Cuba Crisis two years earlier. At its face value, it is a slow-burning feature filled with a unique, dark and time-stamped humor when all things are considered. Expect a lot of dialogue with over-the-top patriotism and prejudice against communists, with a few scenes and conversations sprinkled with a hint of sexuality.Going deeper into the movie however, this was a very real threat that was closer to explode than what most people think, and it that light, Dr. Strangelove is... quite something. Some will find it tedious with clumsy special effects, and other will find it an intriguing reflection of a tense era, capsulated in an hour and a half.My personal grade: a peculiar 6/10. If you found this helpful, check my profile for more reviews.",False
25,4,It does not live up to its hype,c-m-etc,n/a,15/08/2025,"SpoilerI had heard much about this film over the years so I was looking forward to seeing it when I purchased the DVD. It does not live up to its hype. For one, it is not all that funny. Yes, there are some absurd things that happen and yes, there are some characters who are somewhat funny, sometimes, but that's it.Although much of the acting was credible, the characters were neither funny nor satirical. Kubrick simply did not understand how people in high power act and how decisions at that level are made. He didn't understand the dynamics of the cold war. Most of all, he didn't understand satire. Read the book Catch-22, if you don't believe me (I know there is a film, but I haven't seen it so I can't recommend it). The author based most of his satire on Army bureaucracy of which he must have been acquainted. He knew the things about which he wrote and he also understood them so he could show them in a truly satirical light. The essence of satire is that it provides insight into what is currently happening or what is likely to happen. Kubrick based this film, not on what he knew, but on what he felt might be funny based on the bits he had researched and that is why the few bits of satire and comedy in the film come off as being remote.The best parts of the film are those that take place in Kong's bomber. This is, in part, because the bomber and its crew look very real and in part because of the character of Major Kong. Silm Pickens did a brilliant job playing Major Kong. The character was not only plausible, but the few comedic situations involving his bomber arose from his character and his interaction with events and other characters. He was at once a professional pilot and a down-on-the farm (or ranch) human being. His reaction to the contents of the survival pack, for example, fit the character: he methodically listed the contents, as any professional would, then comments that they would make for a nice night out in Vegas (actually, in the original cut, he said 'Dallas', but that was changed after Kennedy's assassination, according to the short documentary DVD extra about how the film was made). It is not at all surprising or shocking or implausible that Major Kong would, inadvertently, end up riding the bomb as it fell to its destination. It's an evocative image he presents: that of a cowboy, riding a bronco - one final, wild ride.What's more, the scenes in the bomber were filled with genuine tension. Was the bomber going to be hit by the Russian missile? Was it going to crash because of the damage the missile had caused? Was something going to stop it before it dropped a bomb? Were the bomb doors going to open? I was very much caught up in the action on the bomber. If the rest of the film had been this way, it would have been a great one.The scenes outside the bomber just don't follow through, though. They aren't very funny and they aren't very satirical. It is, at most, a very mild satire. In particular, the character of Dr Strangelove falls flat. I don't know why the film is named after this character, except that he has a strange name. He is just a stereotypical German. He didn't send out the bombers and he didn't call them back. The only thing he does is to confirm that the Russians could make a doomsday weapon, and any character could have done that. He certainly does not turn his obvious intelligence to trying to figure out how to stop Kong's bomber. The character isn't funny or sinister: he comes off as being pathetic and irritating, particularly when he can't control his hand.The film just doesn't catch my imagination and I don't know why so many people think highly of it. It is probably that people expect that they will like it: it is one of those films that is probably famous for being famous. I wish it had lived up to its hype, but there we have it.",True
