Review_number,User_rating,Review_title,User_id,User_id_link,Created_at,Review_Text,Spoiler
19,3,Be Careful What You Wish For,SusanLervold,n/a,16/08/2025,"A group of talented but naive hopefuls from around the world consent to giving away up to two years of their life to a multinational music conglomeration intent on melding them into an international, cohesive, KPop-style girl group. Though contracts and NDAs were signed by all, apparently not a single participant bothered to have an attorney look over the contracts or have them explained. Apparently, they each took the promise of, ""Baby, I'm gonna make you a STAR!"" at face value and didn't consider the potential price that each would have to pay. Have they never been taught that ""All that glitters is not gold,"" or the clear winner when you make a deal to ""sell your soul""?Besides the giant spiderweb these ingenues become ensnared within, I was immediately struck by the lack of professionalism of (what I call) ""the camp counselors"", particularly the woman in charge, who actually wept with emotion when speaking to the initial group of 14 hopefuls. Her way of speaking, with many of her declarations/statements are made with an upturn at the end, making each sound like questions. Her manner of presents herself in frumpy clothes, slumped posture, and offering little eye contact when communicating, doesn't inspire confidence in her abilities or authority, either. Her sister, the professional dancer (the ""fiery"" one), is far more self-assured and confident, and she deals with the girls with authority and clear(er) expectations.We're given few details about the girls other than some carefully-curated backstories. For example, which girls are homesick? Is school provided for the minors? Which girls are with ""guardians""/parents and which ones are in the house? What does a typical day look like: how many hours spent dancing? Singing? Presenting? Have the girls been instructed on cultivating a unique persona? How disciplined is each girl, really? How reliable? How many dance routines did they have to learn? How do they afford to go out? Who pays for personal grooming? What about conflict amongst the participants? Feelings of jealousy? I can't be the only viewer alarmed by the story told by one of the younger girls' ""guardian"", which goes something like this: While lurking around a random performance event (a pageant or dance recital), she happened across a most charismatic and talented child of about 6 or 7 years old, whom, she was convinced, could become a star, but only under her own tutelage and Hollywood connections. Somehow, this fairy godmother convinced the child's parent/s to sign over guardianship and move her to Hollywood. We're never told what the fairy godmother was getting out of the deal (other than unfettered access to a young child, obviously), nor when her (skeevy) partner came into the picture. If *I* want to know details like this, others do, too.I also take issue with the editing (which, granted, must have been a monumental task): each episode covers such huge gaps in time that it's difficult for the viewer to know where we are in the story. For example: how did a foot fracture heal in the blink of an eye? What did the injured do during the six weeks+ of recovery: practice her voice for the entire six weeks? How on earth did she catch up with the dance routines? Did she receive physical therapy? Who paid the medical bill? I can't imagine you can get out of a boot and be back to new, let alone start back with daily training in heels.While I fully appreciate the immense talent and importance of dancers, singers, athletes, and other performers, making this one's profession is usually folly. What percentage of dancers can support themselves without help? There is simply too much talent and too few opportunities in a field where you're a single injury away from catastrophic failure. Even if you're one of the ""lucky ones"" who escape an acute/devastating injury, the toll dancing/sport takes on a body can't be overstated. We only get one. In professions where the competition is so extreme, corruption is bound to occur; how can it possibly be otherwise? Also, the career lifespan of a dancer is self-limiting: how many professional dancers are there over the age of, say, 35?I couldn't help compare this show with the Dallas Cowboys Cheerleaders (DCC) documentary: as weird and culty the DCC seem to be, I was endlessly impressed by the level of excellence, professionalism, and commitment displayed by every participant of the DCC, from top to bottom. In contrast, ""The Making of a Pop Star"" (MPS) feels like Amateur Hour, like no one really knows what they're doing (save the Chairman and the recording expert). Like the DCC, the MPS participants work around the clock with no days off, and for a pittance, if anything. In both cases, riches are never promised, only fame.In situations like MPS or DCC, the ONLY people who stand to profit are the producers at the top: the performers are truly nothing more than dancing monkeys, performing not even for riches, but merely for the promise of fame. Talk about a deal with the devil! Fame neither fills your belly nor keeps you warm at night; it's both fleeting AND a double-edged sword. Did no one warn these girls?",False
20,4,Genral Spoilers - Behind the Scenes Look on Creating a Girl group,hope-08916,n/a,16/08/2025,"SpoilerHello,I loved watching the stories of young ladies pursue their dreams. However, this Netflix series seemed so rigged because it showcased that the company's dream of a diverse group of ladies was not highly based upon talent level and work ethic. To be in the group, what you look like mattered the most (star quality) and the fan base you could bring in (utilized the public via a public voting system) because the company had to think about sales. That was the concluding reality of this series which is a huge blow on the mental health and self-esteem of many young ladies wanting to become a pop star. This series offers the viewpoint on how the music industry can make decisions to hire talent, and it's a bittersweet enjoyment at the end of the day. Would not watch again, but highly recommend to other young girls who THINK they would want to become a star.",True
21,3,Making the Band knockoff,quieria,n/a,16/08/2025,"SpoilerI was excited thinking it would be like Making the Band or Posters (which formed Eden's Crush) and it was a disappointment from the beginning. The ""experiment"" was off from the outset. The casting is like a year long process, but they don't tell the contestants about the show until months into the process. The judges/trainers were condescending. The eliminating of Naisha for sharing a song with her close friends which consisted only of other contestants was foolishness. I think they thought it would make great TV...wrong! I l skipped episodes 4-7 and just watched episode 8 to see how the train wreck ended.",True
22,5,"Wonderful young people, highly questionable adults",scopesclare,n/a,16/08/2025,"SpoilerI'm up to the episode where it is discovered the wonderful young people have violated the NDA and have gone ahead and, shock horror, posted stuff on Instagram (to a private group consisting of the trainees in the cult - I mean, K-pop group...)This has greatly upset the management, who are absolutely horrified that one of their original songs has leaked out to the public, thereby ruining the hype, which will apparently lead to the bands success. The hype, not the talent, or for the leaked song, but the hype.Which tells you a lot about this outfit. This is the same episode where a number of the lucky trainees are invited to go to the studio and record vocals. Some of them do quite a good job. Not a professional job by any means, but they're pretty good job for young people who have only had a little bit of training. Singing is not an easy thing to do. Professional singers might offended that these young people can go into a studio and be told that they doing a great job by professionals in the industry. Of course they'll come out sounding just fine thanks to auto tune and smoke and mirrors.We all know that these groups are not about the singing. They are about image. Beautiful young people expressing the fantasies of adults who know what sells. Every month a fat overweight man comes in and says who is good who is not. It's revolting. The trainees are told next to nothing about the schedule, about what's gonna happen next, how long they are going to be there, who is going home, how many people are going home? Why, after six months, are there still 20 trainees still remaining? Surely after all this time they could have whittled the field down to six??But little do these poor people realise, they have just wasted a whole lot of time for nothing. They are being left to hang around so that they can participate in an elimination made for TV, a survivor-like competition where apparently the viewers get to choose. Surely this is something each of the trainees should be aware of from the very beginning? And are they being compensated for their time in any way?",True
23,1,Could have been great,mrgnnaz,n/a,16/08/2025,"I was in it for the dream chasing, camaraderie, and character development, but this went way too far into cruel social experiment once it turned into an elimination show. Didn't add any entertainment value and totally broke the immersion.I liked the overall concept, because it is a type of behind the scenes and once-in-a-lifetime opportunity for many people. You can have drama without psychological warfare on underage and barely legal performers if you don't let the board members write the script. The executives are out of touch with reality and at this point I'm only watching for completion.",False
24,1,Demoralizing and depressing,AmberW-00,n/a,16/08/2025,"SpoilerThe most demoralizing show I've watched in a long long time. The message of this long long story was this: Sure, you CAN show up early with a great attitude to put in 200% effort every day for 2 years, break your body and keep going. We will still pick someone who shows up 70% of the time with a bad attitude over you because some vapid 20-something thought they were prettier. The way that Dream Academy/HYBE/Geffen played with this women, lied to and manipulated them was not only immoral but I felt gross watching it. I really hope that all of the girls/women recruited into this get long-term support and advocacy for their future healing, growth and success in life. The way they used these women for their own pursuit in fame, even using singing performances in later episodes after throwing these women out on the streets... it's not okay, and people NEED to see that!",True
25,1,How is Netflix getting away with this,gingersnaps_,n/a,16/08/2025,"SpoilerAnyone looking at this as anything other than sadistic is out of their gourd. These girls and young women were lied to and manipulated for two years. They had no idea that the ""pop star bootcamp"" they were attending was actually a competition show. Are we kidding? Who signed off on this? We are so quick to excuse these bouts of psychological torture as an ""experiment"" and forget that these are actual people on our screens. If the producers wanted a pop star competition show then do that! Adding the twist was incredibly cruel, unnecessary, and blatantly proved that they will do anything for money.",True
