Review_number,User_rating,Review_title,User_id,User_id_link,Created_at,Review_Text,Spoiler
1,3,Time Waste !!,A-J2006_777,n/a,16/08/2025,"""Follow Karlo Yaar"" is a letdown because of how fake and made-up everything feels.The show doesn't seem real at all, with scenes that look more like they're scripted than showing actual moments from the influencers' lives. The so-called 'spontaneous' moments feel planned, and the dialogue sounds rehearsed. Instead of showing real, relatable stuff, the series is full of staged drama and forced situations.It ends up feeling like the show is trying too hard to grab attention, making it hard for viewers to genuinely enjoy or relate to it.To conclude, I would say not to watch this, it's just a sweet way to waste your time.",False
2,3,Keeping up with the DESI Kardashians,rjvyapari,n/a,16/08/2025,Everything is stolen from the Kardashians in Follow Karlo Yaar and it is so scripted..Looks like a replica of US based show.The sisters have obviously been told to keep fighting regularly on the show.... Even her business idea is taken from Skims - Kim's brand.... I actually only liked Asfi..... I hope she makes it big in Bollywood.... Uorfi is deluded and doesn't have humility..... My friends have loved her and think she is a badass but I feel she can be nicer to her sisters...... Especially urusa..... Dolly also needs to calm down a bit...... She is spunky but not everyone can become successful....,False
3,1,Trying to be Next Kardashians - she cant achieve 0.001% of Kardashians,mronline999,n/a,16/08/2025,"1st: Her behavior is questionable. If she desires the same level of respect and fame as Shah Rukh Khan, she should reconsider her actions. Despite claiming to disdain the paparazzi, she still relies on them for appearances. She should be more mindful of her position in the industry. While she may believe she is superior to other influencers, her content is often perceived as cringeworthy. She should remember the hard work and dedication it took for other stars like Shah Rukh Khan to achieve their success. If her arrogance continues, she should consider the potential consequences of a life less glamorous than Priyanka Chopra's.2nd: Her aspirations to become an entrepreneur are misguided. Entrepreneurship involves creating products or services that address people's needs or offer better alternatives to existing ones. Her current endeavors lack a clear understanding of market demand. While she may aspire to model for high-end brands, her audience is primarily accustomed to her extravagant and often frivolous fashion choices. Her career trajectory is largely defined by her appearances on television and Bigg Boss, and she has openly admitted that controversies and paparazzi attention have been instrumental to her success.Given her reliance on controversies and paparazzi, her career is likely to follow a similar path as other meme stars, as there will always be someone willing to outshine her. Her admission that no one wants to marry her, despite her desire for a traditional family life, highlights her addiction to fame, regardless of its source.At a relatively young age, she has resorted to cosmetic procedures that are more commonly associated with older celebrities like Shah Rukh Khan and Salman Khan. Her appearance without makeup reveals a more ordinary face, even compared to her sisters. This documentary serves as a cautionary tale about the pursuit of fame and success at any cost. While it may be tempting to take shortcuts, the long-term consequences can be detrimental.Ultimately, her content is often perceived as cringeworthy and a waste of time.",False
4,9,Hard working girl!,vishprime,n/a,16/08/2025,"She looks like a hard working girl ! I think we should admire that ! Its a good clean watch ! Its the reality of india, so many such families around ! I think she will only inspire many young girls to dream big. Yes her medium is questionable but to each its own !To be frank i have changed my perception about her after the show ! Lot more respect ! Yes she needs guidance! She is very careless with her health ! Etc ! With proper guidance and direction she and her sisters will do well ! Work hard and you will get there !!And she wants to be a business women !! This is something very interesting, hope she can one day !! My best wishes ! Hope to have many more seasons!And to people saying its a waste of time etc ( dont watch ), i think thats very rude ! She is a self made women , give her some respect !Cheers!",False
5,7,Worth watching if you want to get the idea of influencing world,jjendsouza,n/a,16/08/2025,"While the Javed family's drama might be a bit over the top, the series does offer an intriguing glimpse into the life of a famous influencer. It highlights the reality that influencers can't always make their own choices-everything from outfits to actions often requires approval from PR teams and agencies.Urfi, without a doubt, is a fierce and passionate individual. Her approach to money and fame may not resonate with everyone, and her methods for going viral have garnered mixed opinions. However, it's clear that there's more to her than just controversy. She's ambitious, hardworking, and talented-qualities that have helped her stay relevant online for nearly half a decade.The family drama could have been toned down, but given that the Indian audience enjoys some ""masala,"" it's understandable. Overall, I'd say the series is worth a binge-watch-certainly better than shows like Bigg Boss or Splitsvilla.",False
6,8,Worth watching,palsraviki,n/a,16/08/2025,"I really enjoyed this movie because it shows a great journey of a woman who works hard to achieve her dreams. What I liked most was the effort she puts in and her strong attitude toward making money. She doesn't give up, no matter how tough things get, and that really inspired me.The movie does a good job of showing how determined the main character is. You can feel her passion in everything she does, and it makes you want to cheer her on. Even when things don't go her way, she keeps pushing forward with a positive attitude. This makes her character feel real and relatable.I love how the movie shows her journey in a simple and down-to-earth way. It's not just about making money but also about her passion for what she does. You can tell that she really cares about her work, which makes the story even more enjoyable to watch. The movie doesn't make things easy for her, but it shows how hard work can pay off in the end.Overall, this film is a great reminder that with effort and a strong will, you can achieve your goals. It's not just a story about success; it's a story about dedication and passion, which makes it worth watching. If you like movies that focus on personal growth and never giving up, this one is for you.",False
7,10,Reflect Women Empowerment,tiyaj-27680,n/a,16/08/2025,Just now finished watching whole series..I must say I really loved Urfi Javed ..she is so talented n motivating ..throughout the series I observed that she is self made n this self made virtue of her is driving her .. Urfi you are very good you really inspire .. Guys go watch this series...I being a small influencer (my username on instagram: Tintinchakra) really recommend all to watch this series ..don't be judgemental about a person..you can't judge a book by its cover ..watch the series..this series really inspirational and reflects how a Middle class can achieve his or her goal with willpower..Kudos to Urfi love you 😍,False
8,10,"So astonishing and Amazing, the STAR, SELF MADE.",sincostanxyzpie,n/a,16/08/2025,"The series i didn't think it would be so real, realistic point of view of her and her life,the authentic, the genuine, the aura , the confidence THE URFI resonates my gawwwd is so freaking crazy,like WOW, Girl, go get it, your dream life, WE ARE HERE FOR YOU, WE HEAR YOU!!!!Can't wait for your brand to come out and see you in lots of fashion and business activities.Go Entrepreneur! You will do this. We believe in you too!Do what makes you feel bold and powerful and peace.Thanks for doing this show ""Follow kar lo yaar"" and made us see the different side of you, the real side of you! And kardiya follow yaar.... Yehhhhhyyaaah!!!!!!hearts hearts.",False
9,9,Fresh and raw!,thesassywedding,n/a,16/08/2025,"Was initially skeptical to watch thinking its just another scripted show, but got hooked to it from the first episode itself. It is a full on entertainment show. Uorfi proves why she is without any doubt the biggest viral sensation on the internet. She looks raw & authentic without any filters in this show. With all the family drama, it is a desi version of keeping up with the kadarshains. With so much details about her personal and professional life, you will not get bored at any point. In all its a perfect binge watch show, full of drama, comedy and lighted hearted moments. Already looking forward to season 2 of the series.",False
10,10,Deeply Layered and Insightful,ishwarchavan-63135,n/a,16/08/2025,"I loved the show. This is not a rip off of Kardashians. The show had depth and it was all about loving your twisted family. This is how families are - woh garha Bharte rehte hain. Every family under the surface has issues they don't talk about. This family verbalises it. I loved the family, the sisters and my favourites are Sahel and Asfi. They are #couplegoals. I hope they stay intact. But I feel that Sahel should do a regular job and keep his sanity. I cried in the end when she wore clothes by Abu Jani and Sandeep Khosla. I felt like I had lived her struggle. I hope there is a Season 2. PS - urusa should marry khalid.",False
11,10,Woman empowerment,lhamopinku,n/a,16/08/2025,".to watch this show you have to completely left go of your personal prejudice about how Urfi is. It's an everyday struggle and story of a family or a woman who is trying her best to be the best in the world filled with ""star kids"".she show cases how strong she tries to be despite her wrong reasons for chasing fame and money. But isn't that all we want? This is what deferentiates ordinary people like and people like Urfi who has a zeal and is not altered by people's wrong opinion about her. Her anger issues and emotional issues are way out of proportion but he's also battling that herself. I personally loved the way she is.",False
12,10,'Follow Kar Lo Yaar' - A Raw and Inspiring Glimpse into Urfi Javed's Life,shubham-12885,n/a,16/08/2025,"""Follow Kar Lo Yaar"" offers an unfiltered look at Urfi Javed's life, showcasing how she turned controversies into opportunities. Known for her bold persona, the series reveals a side of Urfi that's rarely seen-her resilience and business acumen.The show's authenticity stands out, highlighting both the challenges of fame and the triumphs that come with it. Viewers get a backstage pass to her daily routines, creative process, and personal moments, making it relatable and engaging.In this series, Urfi Javed is more than a celebrity; she's a savvy entrepreneur. ""Follow Kar Lo Yaar"" is a must-watch for anyone interested in modern celebrity culture and looking for inspiration. Raw, real, and captivating-just like Urfi.",False
13,10,Must watch n see a different Uorfi,rhea-80954,n/a,16/08/2025,"Must watch for ppl esp d haters (if she has any) or maybe for ppl who dnt like her much. This show will show a different side of Urofi, what is she going thru n esp why is she like this, wat made her like dis tht she loves fame n money. And as a female how determine she is to reach stars n get success. A great way of story telling, touching all aspects of her life, showcasing her personality n interpersonal relationships with her family. By the end of season u might start liking her or loving her or maybe not hating her if u do. The creators of this show has done a great work. Well scripted n well shot.",False
14,10,A Star Is BORN - A Mega Star,SkySailBark,n/a,16/08/2025,"To be a successful celebrity and an actor/performer, you must be Human. A Human is not perfect and is full of faults, contradictions, suppositions, lies, truths, fears, and triumphs.A True Human is a MIRROR of society.Urfi Javed, of all 25 Years, is a clean and shining mirror to our society. She is an innocent child who will speak her mind, dance with joy, cry with rain, and sparkle like a diamond when the sun shines.It's rare to see an actual true blue self-made celebrity expose herself and her deep-rooted vulnerabilities to the unforgiving and sharp world.In Mumbai's make-believe and fake world, here comes a queen for her throne.She is a brilliant actress in the making, and her performance in her very first show was nothing short of a sensation.It's a worthy show.God Bless You, Little Child.Note: Her family and friend circle is fantastic, and she is lucky to have them around.",False
15,10,Just not an ordinary girl!!,anamwasil,n/a,16/08/2025,"People co.ing and watching means they are curious about Urfi's life. And the sort of hate she receives daammm why do such people even waste their time commenting and bothering.You go girl!Amazing series. Urfi and family in their elements.It does show the rawness and the things that actually go behind the camera and in the family.Just people not very use to of camera might feel that are delivery a dialogue, but it's OK.Why do India have to pull down their people . She might actually turn out to be a international icon one day you never know. And even of not , let the person do want they wanna do !",False
16,10,Absolutely relatable,kamleshtiker,n/a,16/08/2025,"I followed Uorfi after this series.I loved how honest she is.... I am just worried that after her success, she might become Sophisticated and lose her true self...! I would watch an entire show on just Urusa😍😍.All her lines are quotable - ""Hum emotionally unavailable parents ke emotionally unavailable kids hain.....""
I loved what Uorfi said at Social Nation. The universe is not going to do anything for you if you don't do something first. I didn't expect this show to give me life lessons as it did. Wish it had few more episodes, hoping for a another season of this realistic show. Recommended for all reality show lovers.",False
17,10,Relatable and fun to watch,jasjot-bhullar,n/a,16/08/2025,"SpoilerI absolutely loved this show especially the sibling situations. They are pretty relatable! I love seeing someone truly achieve everything on their own marriage without any support especially financial support. I hope the sisters become millionaires, because I wanna see an underdog win and achieve all their dreams. I absolutely love the sister. It's an understatement. I am obsessed with this show and cannot wait for season two. I hope there is an ark for all the characters where they heal from their traumas, and rise above from toxic patterns. I love how they all have each other's back!!!!!!!!!",True
18,10,SOMEWHAT UNIQUE,sethinikh,n/a,16/08/2025,"Spoiler""Uorfi Follow Kar Lo Yar"" is a dazzling addition to the digital content landscape, blending humor, heart, and unfiltered honesty into a show that's as entertaining as it is thought-provoking. Uorfi's magnetic personality and fearless approach to tackling a variety of topics make this show a standout that keeps viewers eagerly anticipating each new episode.What's Great:Authenticity: Uorfi's authenticity is the heartbeat of the show. She isn't afraid to speak her mind, whether she's sharing her thoughts on societal expectations or recounting personal experiences. In one memorable episode, Uorfi opens up about her journey of self-acceptance, turning what could be a simple narrative into an inspiring message about embracing individuality. Her raw honesty makes the show feel personal and relatable, drawing viewers in like a candid conversation with a close friend.Engagement: The show thrives on its interactive elements. Uorfi makes her viewers feel like they're part of the action, whether by responding to their live comments or incorporating their suggestions into the show's content. For instance, in an episode focused on beauty standards, Uorfi invited her followers to share their own experiences, creating a powerful and inclusive dialogue that resonated deeply with the audience. This level of engagement not only keeps the show dynamic but also builds a strong, loyal community around it.Diverse and Relevant Topics: Uorfi masterfully balances a wide range of topics, ensuring there's something for everyone. From dissecting the latest fashion trends to diving into important societal issues, the show is as varied as it is insightful. In a particularly compelling episode, Uorfi delves into sustainable fashion, offering practical advice on how to stay stylish while being environmentally conscious. Another standout episode sees her discussing mental health with a psychologist, providing viewers with valuable tips on managing stress in the digital age. This variety ensures that the show remains fresh, relevant, and endlessly interesting.Visual Appeal: Visually, ""Uorfi Follow Kar Lo Yar"" is a feast for the eyes. Each episode is bursting with color and creativity, from Uorfi's bold fashion choices to the show's vibrant set designs. A standout example is an episode where Uorfi explores the evolution of Bollywood fashion, donning iconic looks from different eras. The attention to detail in both the costumes and the set design elevates the entire viewing experience, making the show as visually captivating as it is content-rich.Humor and Heart: Uorfi's ability to blend humor with heartfelt moments is one of the show's greatest strengths. She effortlessly shifts from making the audience laugh with her witty remarks to moving them with her sincerity. In a lighthearted segment, Uorfi humorously critiques her old fashion choices, only to follow it up with a poignant discussion on how those experiences shaped her self-confidence. This balance of humor and heart gives the show a unique charm that keeps viewers hooked from start to finish.Conclusion: ""Uorfi Follow Kar Lo Yar"" is a vibrant, engaging, and deeply authentic show that brings something truly special to the digital space. With Uorfi at the helm, the show is a perfect mix of entertainment, insight, and inspiration. Whether you're tuning in for the fashion tips, the honest conversations, or just to enjoy Uorfi's infectious personality, ""Uorfi Follow Kar Lo Yar"" is a show that promises to entertain and inspire, making it a must-watch for anyone seeking content that's as meaningful as it is fun.",True
19,10,"""Follow Kar Lo Yaar"" offers a fascinating look into the woman behind the headlines",lucidtrooper,n/a,16/08/2025,"The show skillfully balances the public persona with the private person, showcasing Uorfi's genuine moments of joy, introspection, and the challenges she has faced. It's a refreshing departure from the often-superficial portrayals of celebrities, providing viewers with a deeper understanding of her journey.Uorfi's courage to be herself, despite facing criticism, is inspiring. Her authenticity shines through, making her relatable to many who may feel misunderstood or judged. The show's portrayal of her as a young woman navigating the complexities of fame and personal growth is both heartwarming and thought-provoking.""Follow Kar Lo Yaar"" is a testament to Uorfi's talent and the showrunners' ability to capture her essence. It's a show that not only entertains but also challenges stereotypes and encourages viewers to embrace individuality.I wish Uorfi and the entire team continued success in their future endeavors!",False
20,8,Loved watching urfi and uruusa,vk-87989,n/a,16/08/2025,"SpoilerI really enjoyed watching the show and specially Uruusa how she being the eldest one carries the most of the trauma but still tries to be okay with the remarks on her by the family.. also i loved how urfi comes from a mediocre background and now doing so good and i wish that she'll get more because they really deserve it..
Overall I loved the show but there were some parts like the surgery one i think that's just useless and if urfi you are reading this review.. you don't need that surgery youuu are already so beautiful and be the way you are that's what you are known for and specially i liked you because of your confidence but after seeing that it feels like you are not confident of your body.. ik it's your choice you can do anything with your body but it's just my opinion you are perfect the way you are.. and at last i wish that we'll get a season 2 soon and i would love to see Uruusa more.",True
21,10,"Brilliant series, Urfi is larger than Any canvas you'll ever see",manavkum,n/a,16/08/2025,"Love this series, absolutely crafted with care and great edits, never a dull moment to watch...made this series almost to the level of ""Wild wild country"" and other in genre.Youll learn a lot about Urfi and her family members a lot, more than media ever said. She is not your so charming happy go lucky Ananya and jhanvi...she dares to dream big , dream it all, sharp to know her bottlenecks and issues, coming from B town but not shallow and stupid like Kangna ..less said the better, must watch this entire series.Never felt like it was prescripted show, natural conversations fitted in. Her Sisters , Urusa is wise , Asfi is more human like and vulnerable, wise but dolly is ambitious like her and MUST get out of Lucknow regardless anyone goes with her or not...And what's wrong with sameer...he should've never born. Their dad's final AND only WIN. Can't he do graduation on his own without mama's and sisters support?URFI, wish you best and hope you kick asses of hardest kinds.",False
22,10,Urfi is autistic and has a powerful vision that others don't understand,anikadamg,n/a,16/08/2025,"I'm autistic myself and she says so many of the things I believe for the reasons I believe them.She consistently explains what she's trying to do and why, invites others to explain themselves and guide her but they keep listening to her tone and misunderstanding her.She hates change and hates being lied to and has the classic three sources of hydration in mugs going all day.She's driven as hell and literal and direct and an amazing autistic icon.It's so cathartic watching her be right over and over again seeing her struggle to communicate, have meltdowns over social situations and feel guilt over them.I hope one day she realises she's autistic and reads Love and Autism by Kay Kerr.",False
23,10,Badass!! You Go Girl!!,drvidhya,n/a,16/08/2025,"I am so impressed by this girl!! She is a total badass!! She is ready to carve her life out on her terms without giving two hoots about people trying to pull her down. She comes from nothing and has made it so far!!I have to say, I never watched her or followed her before. I just saw some crazy pics of hers and didn't think much of her. But I have a new respect for this woman now!! But I will follow her now. She is like the Kardashian of India. And despite the crazy sisterhood, they somehow make it work. She is uplifting the whole family. I am looking forward to the next season.You go, girl!! I am sure the women's brigade is rooting for you. You inspire us all 💕",False
24,10,Kim could never!,bmstinsontore,n/a,16/08/2025,"Urfi Javed is like that sparkly glitter that sticks with you - once she's in your life, you're hooked. Some may call her the Kim Kardashian from Meesho, but let's face it: Kim could never!I find Urfi and her family extremely relatable. Follow kar lo yaar is less about being aspirational and more about documenting what a small-town ambitious girl would do when she's hungry for success and willing to go after it, even if she doesn't have many options.Urfi's youngest sibling is the only guy in the family and he plays the role of the straight man, which is pretty funny. Asfi is the sensitive one, Dolly is like a mini Urfi, and Urusa is the dark horse.Makers did a great job with keeping things organic and authentic!Overall, it's a fun show to watch. I would definitely recommend it.",False
