Review_number,User_rating,Review_title,User_id,User_id_link,Created_at,Review_Text,Spoiler
1,10,Moles And Rats,bkoganbing,n/a,15/08/2025,"When The Departed finally gained for Martin Scorsese a Best Director Oscar it was felt it might have been for the work of a lifetime. It's not my favorite Scorsese film, that honor belongs to Casino for me. But it certainly was the Best Film of that year as well, rivaled in my humble opinion by Blood Diamond.Instead of an Italian atmosphere for The Departed, Scorsese decided to use the Boston Irish who are the dominant group of that city in everything including crime. The film is simple enough, the police want to take down organized crime kingpin Jack Nicholson who plays a character named Frank Costello. That was Scorsese's little joke because the real Frank Costello was one of the Mafia overlords back in the day, although his real name was an Italian one.Nicholson's character is based on Whitey Bulger who was the real life organized crime chieftain of the Boston area. He came from a really interesting family because a brother of his William Bulger had a long political career that culminated in that Bulger being elected President of the Massachusetts State Senate. I didn't add the word distinguished because scandal crept around that man all his life.Getting this man won't be easy because he has a full bag of tricks. One of them being that years ago he put a young man played by Matt Damon through the Boston Police Academy, concealing a juvenile record and Damon moved gradually up the ranks and got to work in the Boston PD Internal Affairs Division. A great spot for a mole to keep an eye on pending investigations.But the Boston PD has put one of their own undercover in the person of Leonardo DiCaprio whose family knows Nicholson from the neighborhood. At that point the whole film becomes a cat and mouse game on both sides with each having their informants on the other side. There are no dummies on either side, the police aren't keystone cops and the criminals as shrewd and brutal as they come.Scorsese probably had a lot of help in having both Matt Damon and Mark Wahlberg in the cast. Both of these players are well known for their Boston roots and they fit really well into their parts. Mark Wahlberg for his role as one of the task force trying to take Nicholson down got an Oscar nomination for Best Supporting Actor. He lost to Alan Arkin for Little Miss Sunshine.Wahlberg was the only one who came up short at Oscar time. The Departed won additional Oscars for Best Adapted Screenplay and Best Film Editing to go with the Best Picture And Best Director Oscars for Scorsese. Leonardo DiCaprio had a career year, he might have been nominated himself if he wasn't up for Best Actor in Blood Diamond.The real Whitey Bulger is 80 years old now and in real life he was as full of tricks as Nicholson's character is in the film. If you think you know how this film ends, I guarantee you will be wrong. Nicholson's character has survived in many ways, that's all I can say.Scorsese has a nice feel for Boston's atmosphere, as good as what he had for Goodfellas in New York and Casino in Las Vegas. He assembled a great cast of people who all got a crack at working with one of the best film directors of all time. The cast didn't let Martin down at Oscar time and they won't let you down when you see it on the big screen or the small.",False
2,8,"Twist endings and Leo, name a better duo",jackgdemoss,n/a,15/08/2025,"Nicholson, Damon, and Dicaprio make for an absolute powerhouse trio in this classic film. I have had this on my watch list for quite some time, and although it wasn't as rock solid as I was expecting, it's ending was right up my alley. Aside from the phenomenal acting and the satisfying conclusion, I was only impressed with the simplicity of which a complex double-rat story was told. I never felt lost trying to keep track of who worked for who and who was spying on who, because the filmmakers laid it out so clearly for me.",False
3,10,10 out of 10 and WOW does this film deserve it! Absolutely Brilliant!!,James_Denton,n/a,15/08/2025,"SpoilerBlood Diamond (2006)was the film which turned me into a fan ofLeonardo DiCaprio, and he must have been on a roll that year asThe Departed (2006)was not only made that year, but is just as good as Blood Diamond with again phenomenal acting from almost all.The good and the bad:The film is 14 years old at the point of writing this, and is still as good as the day it was released first saw it.The acting is phenomenal with the award (in my opinion) going toLeonardo DiCaprio.One of the beauties about this film is: Just as you think you've grasped what is going on it throws another twist in.The only let down for me (and it is minor irritation) wasMatt Damon, whom I'm not a fan of or his acting.With all the great reviews it should do without saying thatThe Departed (2006)is outstanding! A fantastic great story, with twists and turns and that will keep you guessing to the end - and even then you will mostly have guessed wrongly.The film has it all... suspense, thrills and tense moments... the brilliance of theThe Departed (2006)cannot be overstated. A must watch!So this is one of those rare moments where 10 out of 10 is deserved.Recommended.",True
4,10,Superb acting on top of brilliant storytelling,General_Turgidson,n/a,15/08/2025,"Now I know that 'The Departed' is based off of the Hong Kong movie 'WuJianDao', but Scorsese really grabs hold of a great story and brings it to the American Screen. My father grew up in Boston and when we walked out of the theater he couldn't stop talking about how authentic the environment and attitude was. Then there's the acting in which the lead actors (Nicholson, DiCaprio, Damon) not only give stunningly entertaining performances, but you become engulfed in each one's perspective and dilemmas. The smaller roles that of (Baldwin, Walberg, Sheen) are supporting roles that remind me of Jesus Quintana from 'The Big Lebowski', by this I mean that their screen time is limited but they make lasting impressions that you cherish each and every scene they are in, Alec Baldwin especially. The story itself starts off with the basic intro of the players and the setting, but you'll find yourself slowing following each and every plot twist and rooting back and forth for the good guys and for the bad guys. If you're a Scorsese fan, which I am, I think you will appreciate this film. You can clearly see the Scorsese touch ranging from the cinematography and of course the music, it's great to hear ""Gimme Shelter"" again, but ""Comfortably Numb"" played in so well. It's another gangster flick from Scorsese, yet this one stands alone because feels so fresh and most would agree Scorsese does gangster films the best; so why not let him. Oscar worthy, the acting I certainly hope; this is DiCaprio's best role since 'The Aviator' which was his best role since 'Gangs of New York', am I seeing a pattern here. But my lasting impression wasn't concerned with the politics of the golden statue; my lasting impression was that I had sat through 2 and half hours of brilliant and especially entertaining storytelling. Thank you Mr. Scorsese.",False
5,n/a,"Lies, Betrayal, Sacrifice. What will you believe?",n/a,n/a,15/08/2025,"First off, this is an American stylized remake of the Hong Kong hit, Infernal Affairs. I have to give credit to that, a good film. I have seen both Infernal Affairs and The Departed. I personally prefer The Departed, and I think because of one thing: Martin Scorsese. This is the master behind such greats as Taxi Diver, Raging Bull, Goodfellas, and he's at it again. The film has an all star cast with Leonardo DiCaprio, Matt Damon, Jack Nicholson, Mark Wahlberg, Martin Sheen, and Alec Baldwin.The Direction was amazing. (maybe one of the reasons why he won the Oscar for it) I loved how some of the scenes were shot and set up. Especially regarding the Chinatown, and police interrogation scenes, among many others. The film is perfectly set up with intense, suspense scenes while adding in amounts humor at times. It works really well. The script is top notch. (Also Oscar winning) Realistic strong dialogue from scene to scene.Another thing I liked more in The Departed, as opposed to Infernal Affairs, was the acting. DiCaprio really seemed to earn a lot of respect from this role. Here, he takes on the tough guy persona so well. Sure it was known he was a good actor from his Oscar nominated performances in What's Eating Gilbert Grape and The Aviator, but he really takes it to another level here. I can't see anyone else as the character, he fits so perfectly with it. Matt Damon and Mark Wahlberg, being Massachusetts natives, also give solid performances, with their natural accents. Nicholson works well in his role, as well. Everyone was extremely solid and everything seemed so real.Set in Boston, The Departed takes in all the Boston like atmosphere. Beautifully shot scenes of the Massachusetts Golden Dome State Capital building is just one part of the landscape. The Dropkick Murphys song ""I'm Shipping up to Boston"" really fits, great use of songs. Scorsese usually works music into his films really well.""Cops or Criminals. When you're facing a loaded gun what's the difference?"" This quote really represents the film."" Matt Damon plays a state officer in the Police, working for the crime boss of the area, Frank Costello (Nicholson). While Damon's character can be described as a ""bad guy,"" he is really misunderstood. As a kid, he is sort of mentored into crime business by Costello while Costello becomes the father figure Damon's character never had. Leonardo DiCaprio plays a young guy, coming from a bad, crime ridden family. He's decides to become a police officer to get away from the crime life he's been surrounded by. Taking all this into account, Captain Queenen (Sheen) and Seargent Dignam (Wahlberg) decide to send DiCaprio's character undercover to find out more about the criminal underworld and Costello. With his family's crime record, he fit's perfectly into the situation. Now you have a highly ranked officer working for bad guy, and an undercover cop in the criminal underworld working for the State Police. From here it's an all out suspenseful thrill ride. Who's who? Who's working for who? Who can you trust? Paranoia threatens everyone. Lies. Betrayal. Sacrifice. How far will you take it?At the heart of this film is character development. We really feel for the characters. We feel like we know them. It's really amazing part of this story and film. Tremendous story telling here.This is one of the most entertaining and suspenseful crime/drama's I have seen in a while. While Infernal Affairs, came first, I think The Departed expands on it in so many ways. Really solid crime/drama. Check both out when you get a chance. It's really worth it. 9/10",False
6,10,One of Scorsese's very best movies,Leofwine_draca,n/a,15/08/2025,"SpoilerMartin Scorsese returns to familiar territory with this story of the lives of cops and gangsters living in America. However, a few things are different this time around – it's Irish gangsters rather than Italian, and for the first time in his life, Scorsese is shooting a remake, of the Hong Kong film INFERNAL AFFAIRS. I haven't yet watched the original film but I'm pleased to say that THE DEPARTED is an example of the director at the top of his game and I'm completely satisfied that he finally won his best director Oscar for his efforts here.To say too much would be to spoil the experience. Cinematography is spot on and the ensemble cast fantastic – headlined by DiCaprio, playing it on the edge as the undercover cop, and Damon as the hateful cool cucumber, a con on the inside. Jack Nicholson plays it OVER the edge as a past-his-prime gangster; gradually losing his marbles in a world of violence, while Ray Winstone's heavy is another weighty performance from this underrated star. Kudos to newcomer Vera Farmiga for holding her own among the established talent and Martin Sheen for taking a small role and running away with it. Mark Wahlberg also deserves mention for his Oscar-nominated supporting role as a foul-mouthed cop, the best of his career.The plot twists and turns and is chock-full of Scorsese's trademark violence, with bloody shootings and beatings taking place throughout. The story is complex, forcing the viewer to give the film their full attention, so the 2 ½ hours just fly by as you're watching it. Things culminate in what I think is a very effective, brutal, shocking, sudden climax, which some people have criticised as being too rushed and too violent, but which I think is perfectly realistic, an example of how a house of cards can come tumbling down so suddenly. A perfect ending to a perfect film – and a must for all fans of twisty thrillers and gangster flicks.",True
7,10,Martin Scorsese Hits the Streets Again!,Alwood,n/a,15/08/2025,"Please don't make negative comments like some of the aforementioned people have been doing if you haven't seen the film yet! I have seen it, at a press screening last week. Not only is it the best film of the year so far, it marks a return to form for Martin Scorsese, and ranks with the likes of GOODFELLAS as being one of the best in his canon of films.I'm a fan of the Hong Kong film, INFERNAL AFFAIRS, upon which this is based. While THE DEPARTED keeps the basic structure of the original, it is very much its own movie, so much so that the screenwriter, William Monahan, didn't even watch the original film while adapting its screenplay, thus enabling him to infuse the script with his, and Scorsese's, respective visions.All the actors are first-rate (yes, even Leo, for all you DiCaprio bashers out there), and turn in some of their best performances to date. THE DEPARTED is sure to garner a host of Oscar nods, if not wins, including (hopefully) Scorsese's long-overdue statuette for Best Director. Plus, with actors like Martin Sheen and Alec Baldwin playing supporting roles, that says a lot about the quality of the film they signed up for! THE DEPARTED is tough stuff, not for the faint-of-heart. That said, it is a must-see for adult viewers who long for intelligent, gritty stories to grace our movie screens once again.",False
8,10,Martin Scorsese never disappoints,ghalibalfalasi,n/a,15/08/2025,"I have yet to watch a good or a very good Martin Scorsese movie. Every movie I watched is a 10. Also, old Jack Nicholson is as good as young Jack Nicholson.",False
9,10,"Amazing movie, with an ensemble cast.",Sleepin_Dragon,n/a,15/08/2025,"Boston Police are trying to bring down Gangland boss Frank Costello, Billy Costigan goes undercover to try and nail him from the inside, but his actions are countered by Colin Sullivan, a criminal who has infiltrated The Police, handing information to Costello.This film doesn't date, as I'm watching it, it is now seventeen years old, and apart from the flip top phones, oxycontin, and the fresh faces of DiCaprio and Damon, it has hardly dated.Intense, fast paced, gritty and violent, it doesn't hold back for one second, I'd place The Departed in my top ten list of greatest films. The action sequences are tremendous, and there's a subtle humour rubbing through it. Even if this film doesn't quite fit into your favourite genre bracket, I suggest you still watch, it's an incredible movie.It's one of those films that gets better with subsequent viewings, you may struggle to put some of the pieces together first time round, knowing what's happening only seems to make it more satisfying.The cast, has there ever been a more incredible cast assembled, it's a tour de force from Jack Nicholson, but Damon, DiCaprio, Winstone, and many more are all fantastic.10/10.",False
10,10,A cat and mouse game done at it's finest.,renogade,n/a,15/08/2025,"An undercover cop and a mole in the police attempt to identify each other while infiltrating an Irish gang in South Boston. Let me start off with saying that this is my favorite movie, no doubts about it. the movie starts out slow with it's LONG intro, but picks up and never breaks pace. I normally hate pace breaking in movies, so this is already a big + in my book. the story is interesting to watch as Dicaprio and Damon struggle with their identities while Jack Nicholsen has some fun as the bad guy. This movie has a great plot, cast, music score, length and almost all elements of movies possible such as: drama, comedy, action, crime, thrills and suspense and many more. The Departed is a great movie and should be recognized as one.I find nothing wrong with it. maybe the lack of female characters, but it ain't that bad.",False
11,7,Jack is great but the Original is MUCH BETTER,kongwong,n/a,15/08/2025,"SpoilerJust watched it last night and can't help but think how much better the original ""Infernal Affairs"" was compare to ""The Departed."" The Departed had wasted its cast power, failed to fully develop the characters, failed to focus on the inner conflict for the two undercover, didn't make enough of a point in betrayal, and tried but failed to made up with Scorsess' trade mark violence and sex.I didn't feel the inner conflict of Matt Damon the same as Andy Lau. I couldn't help but feel for Jack when Matt betrayed him while I could understand Andy's inevitable turn and his trying to be a better person than he was.I couldn't feel for Leonardo. He was crying and breaking up after what? SIX MONTHs? Damn! Tony Leung was a undercover for nine years and he didn't sign up because he chose to, he signed up because that was the only way he could be a cop! Martin Sheen got shafted in his role. There was no time for his character to develop a believable relationship with Leonardo. His screen time was wasted. When he got pushed off the roof, Leonardo wasn't feeling the loss of his only life-line to the world, there was still Mark, he wasn't feeling the loss of a trusted friend, there was no friendship, he wasn't feeling the loss of a fatherly figure, and the only emotion he could have was the shock from the brutality of the murder.Mark Walhberg and Alec Baldwin got shafted, too. Mark Walhberg was reduced to a foul mouth asshole turned plot device. What do we need him for other than showing up at the end to put Matt out? Alec Baldwin? His whole highlight was to make that stupid speech about marriage at the golf course? COME ON! The only bright spot in this movie is Jack Nicholson. But even his talent is wasted because he had no one but ""Mr. French"" to play off his evilness. The classic scene of the original Infernal Affair had Jack's character to confront his counter part in the police station with some of the most memorable moment of the film. Jack has no counter part in ""The Departed"" and his brilliance was wasted. (The dock encounter was lousy with Martin Sheen making empty threats and Mark Walhberg just running his mouth off.) Matt Damon and Leonardo Dicaprio made lousy under covers, nowhere up to the professionalism showed in the original. Even the confrontation at the end lack the power of the original with the surprise. More dead bodies and more punches and elbows actually subtracted the suspense and the confrontation. There was nothing like the psychological confrontation with the calm manner in the original. Instead, we had elbows flying and a character cracking up crying. Mark Walhberg's existence actually ruined the helplessness of Leonardo. Unlike the original, logically he didn't have to do it alone.""The Departed"" is a good movie if only it wasn't a remake. There is a reason it is not doing well in Hong Kong. The original is much much better plot wise and character wise. The acting was superb in both movie but the script and the direction was the difference. Even though the plot was essentially the same, Infernal Affair was a much better movie.Watch the original if you haven't seen it, and see the difference in camera work and characters.",True
12,10,Scorsese's best since Goodfellas!,MaxBorg89,n/a,15/08/2025,"He has made good musicals (New York, New York), surreal comedies (After Hours), satires (The King of Comedy) and biopics (The Aviator), but Martin Scorsese has never done better than the times he's dealt with life on the streets and gangsters. Mean Streets, Goodfellas and Casino (and, to some degree, Taxi Driver) are proof of that. It doesn't seem strange, then, that his finest film in over a decade (Goodfellas was released in 1990) sees him return to that familiar ground. With a few changes.The Departed, based on Hong Kong thriller Infernal Affairs (2002), is Scorsese's first gangster film not to feature Italian-American criminals. In fact, this film is set in Boston, where the Irish rule. One of these ""godfathers"" is Frank Costello (Jack Nicholson), the man the State Police want the most. After years of investigation, they're finally getting close, thanks to undercover agent Billy Costigan (Leonardo Di Caprio). Because of his family (all Irish, all bad), becoming a member of Costello's crew isn't that difficult. Now all Costigan has to do is report to his superiors, Queenan (Martin Sheen) and Dignam (Mark Wahlberg), who will pass on the information to Ellerby's (Alec Baldwin) Special Investigations Unit. What they don't know is that Colin Sullivan (Matt Damon), the most promising element of said unit, has been on Costello's payroll since he was 12. Soon enough, both cops and crooks become aware of the situation, beginning a manhunt that's gonna make the already fragile Billy even more nervous and Costello increasingly crazier.By moving from Hong Kong to Boston, Scorsese and screenwriter William Monahan have made the first step in ensuring this film will be quite different from its Chinese inspiration. Another significant factor is the running time: a mere 97 minutes for Infernal Affairs, 150 for The Departed. This is due to new characters (Dignam and Costello's henchman Mr French, played by Ray Winstone, were missing in the original) and subplots, such as the one concerning Madolyn (Vera Farmiga), a psychiatrist who gets emotionally involved with both of the moles. But the most crucial difference is in the depiction of the underworld: whereas IA was stylish without being excessive, Scorsese's vision comprises very colorful language (some insults are so creative one might expect Joe Pesci to show up) and, of course, buckets of blood, the last part of the movie proving to be particularly shocking. None of the scenes ever reach the gross-out level of Casino's head-in-the-vice scene, but in pure Scorsese tradition it remains unflinchingly violent (also notable is the music, perfectly setting the mood, scene after scene, alongside Thelma Schoonmaker's impeccable editing).Amidst these brutal surroundings, the director handles a spot-on cast: Baldwin, Sheen and Wahlberg (the latter finally back on form) make good use of their little screen time, Damon fine-tunes the edgier side he showed in The Talented Mr Ripley and the Bourne movies, and Nicholson, playing the villain again at last, delivers another OTT but classy turn (original choice Robert De Niro would probably have played the part with more calm and subtlety). A special mention is needed for Di Caprio: working with Scorsese for the third consecutive time, he has finally found a way to shake off his Titanic image, thanks to a vulnerable, gripping (and arguably career-best) performance.With its clever plot, excellent acting and expert direction, The Departed is without doubt the year's best film so far. If this really is going to be his last gangster film (he has said so), as well as his last studio-endorsed picture, Scorsese can be proud, given the masterpiece he has given us. If only they gave him the Oscar in return...",False
13,6,Entertaining but Nothing Spectacular,mwendel,n/a,15/08/2025,"For a movie over two hours long I felt like there was a lot missing. A lot of the story felt rushed while at other times it felt like it was dragging. The movie just seemed to fall flat despite all the talent assembled on the screen. I don't know if it was the dialog or all the plot holes (there are a lot of loose ends in my opinion).I just always felt like I had a lot of interesting characters but I kept asking myself as I watched this film - what the heck is going on? How much got lost on the cutting room floor? Maybe this film needed to be four hours.I would like to see an unedited unrated director's cut or read the original screenplay for this movie. It covers such a large span of time and seems to jump all over the place without neatly putting things together. And the end seems like a desperate attempt to close off as many open plot lines as possible.Entertaining, yet frustrating. I expected a lot more out of this film and I don't really feel like it delivered. I recommend waiting for DVD.",False
