Review_number,User_rating,Review_title,User_id,User_id_link,Created_at,Review_Text,Spoiler
14,5,Good but not as good as the original,PhoCris,n/a,15/08/2025,"SpoilerJust came back from watching the movie so it's still fresh in my mind. Overall the movie was good but it could have been shorter. Good movie but nothing extraordinary, not a master-piece, not a classic. In this period filled with really bad movies it's a movie you have to watch.Some things are better than in the original (Infernal Affairs) like character development. It is especially true for DiCaprio's character (not really for other character). However the scene, when Wahlberg cites all of DiCaprio's family connection to the mob, takes too much time. They take a long time establishing how DiCaprio sells drugs with his cousin and finally get into Nicholson's gang. However after that it doesn't take long for Nicholson to give his total trust (in one year and a half to two years), which bothered me. This takes the first hour of the movie and i think it could have been cut by at least 20min.Some scenes have a lot more impact in Infernal Affairs than in The Departed. I'm gonna cite 3 scenes which are some of the most important in the story in my opinion:-The death of Wong/Queenan: in IA, Wong falls suddenly, lands on a taxi cab taking Yan by surprise. When Yan realizes Wong is dead you can feel the suffering Yan goes through by the loss of the only person who knows he's a cop but also/mainly by the loss of his friend.In The Departed we see Sheen falls in slow-mo until he hits the ground in a splash of blood. There's absolutely no connection, no friendship between DiCaprio and Sheen. We see DiCaprio almost on the verge of crying. But Why ? He's not his friend and there's still Wahlberg to prove he's a cop.-The death of Sam/Costello: In IA, Ming seems to show a desire to redeem himself and become a good man for his girlfriend. When he confronts Sam in the parking lot during the raid, he kills Sam to remove any evidence he's a mole and restart on a blank slate.In The Departed, although Damon slightly mentions starting anew in another city, when he kills Costello he does it just to cover his a-s-s. Never after he seems like he might become good.-The elevator and final scene: In IA, the meeting on the rooftop is between two men on each side of the law but sharing so much in common. You can even sense that Ming has some respect for Yan. There's no violence until what happens in the elevator. When Yan dies you can see Ming didn't want this to end like that. Yan's death is really emotional, all sounds are drawn off and only an opera piece is playing. When the second mole gets killed by Ming you only hear gunshots.In The Departed The final scenes are a mess. Damon and DiCaprio just hate each other's gut, the token black guy shows up, the 2nd mole shows up and everybody executes everybody. They just stand there to get shot. The scene seems really rushed.And when Damon open his door at the end of the movie to see Wahlberg waiting for him, it was the cherry on top of the cake. Everybody was cracking up. How many shots to the head do we need to see ? Was it really necessary to kill Damon and provide the audience with a happy ending ?Although The Departed is a good movie I felt a lot more satisfied with Infernal Affairs. They have very different feel to them. One is over-the-top street violence while the other one is more subdued, concise and nuanced.For those who says that The Departed is way more psychological than IA I would have to disagree. Infernal Affairs shows how two men struggle to know what defines if they're good or bad. Is it their actions or their allegiance to one side or the other of the law? In the end they're really similar. Yan tells the Psy he's a cop and lift that weight off his shoulder even if it's for just a second. Ming wants to redeem himself and prove his girlfriend but also himself that he's not that bad. Others before me have also commented on the buddhist notion of eternal hell so I won't talk about it :)The Departed lacked in that department. There's no connection between the two main characters except for the fact they are moles. They're almost portrayed as black and white. Especially Damon who doesn't seem to have any nuance. He's just bad till the end.The Departed 8/10 Infernal Affairs 9/10",True
15,8,Sublime Scorsese,pedofski-radar-cole,n/a,15/08/2025,"Definitely the the type of movie that makes it worth going to the theater. Very intense action and violence, twisting plot, lot's of misdirection.The story line is a bit overly whelming at times, this isn't a good movie to watch if you're tired and follow the action, the double crosses and the sometimes confusing who's who of the movie, but if you can just remember the basic characters the minor twists won't be too confusing.While it's certainly not a love story, there is that element, with a bit of a morality play going the whole time.I can't make some of the statements I'd like to make because I really try to avoid spoilers in my reviews, but I'll say that I enjoyed the movie even though had I been in charge it may have ended differently...All that said, if you like a thriller that has some rough and tough violence and a plot with a few twists and turns this film would be one I'd recommend to you.",False
16,10,A movie that makes you want to watch non stop,f-62204-72175,n/a,15/08/2025,"SpoilerThis is definitely Martin Scorcese at it's finest. Something I must warn about is that this is not an ""action movie"" even though there are fight scenes and deaths it's not like a Jason Statham movie with the main character kicking everyone and easily beating his enemys, plus the action isn't the main focus. The main focus is the cat and mouse chase between the police informer and the mob informer, with many scenes that make you think that they will finally find the truth but end up failing. This movie is also full of twists and surprises that don't feel forced or random and actually make the story better. The acting is amazing but it was to expect because of the casting. And the direction, the soundtrack,everything is perfect in this movie. Truly one of the best movies of all time.",True
17,10,My Heart is Still Pounding,awvknj,n/a,15/08/2025,"SpoilerI swear I thought I had seen this before and knew it was a good movie how could it not be with this cast so this must've been my second time through but I honestly did not remember the plot it was like seeing it for the very first time I was so caught up and enthralled in who was zooming who this movie definitely is one of my all-time favorites and I think it gets better every time you watch it the performances are totally stellar. So many great lines in this movie two classics !! One of my favorites ""this is not reality TV"".",True
18,9,Brilliant,Movie_Buff_Brad,n/a,15/08/2025,"Before seeing this, I knew I was in for a treat, given that it's a Scorsese movie, but The Departed was even better than I expected.The acting is outstanding. Leonardo DiCaprio gives what is quite possibly the best performance of his career. Even the people who hate him admit he did a good job. It's turned some haters into fans and my brother who despises him even says he was great. Matt Damon and Jack Nicholson give their best performances since The Talented Mr. Ripley and As Good As It Gets. Mark Wahlberg almost steals the show with the best lines. Ray Winstone, Alec Baldwin, and Martin Sheen are good, too.Definitely one of the best films of the 00's. And easily one of the best remakes of all time. It's intense, funny, exciting, suspenseful, superbly acted, violent, has great characters, and has one of the most shocking scenes I've ever seen. And there's not a boring moment in it's two and a half hour running time.The film will most likely be nominated for picture, director and adapted screenplay, and in my opinion, it deserves all three of them. DiCaprio and Wahlberg also deserve nominations.See this as soon as you can.",False
19,9,Whatever I say does not do this film justice,Balidorf,n/a,15/08/2025,"The DepartedThe screenplay: Top NotchThe performances: all-star cast delivering all-star performancesThe music: perfectThe Directing: Martin Scorsese at his finest and that is saying something.Once again Scorsese delivers a film that meets or exceeds the expectations of its audience in nearly every way. There are moments of incredible tension, violence, and drama, moments where characters reveal their vulnerabilities and weakness. Comedic moments and moments of sadness and through it all a multi layered and brilliant story is told by an American film maker who once again proves Harvey Keitel correct when he said, ""Maybe he (Scorsese) got what he deserves--exclusion from the mediocre.""This film is Scorsese's finest work since Raging Bull, but it is not simply about Martin Scorsese or the amazing screen play by William Monahan, it is more than an amazing score, and great cinematography. While many of the accolades for this film belong to those behind the scenes people who envisioned and directed this film. One would be remiss to not point out the great performances of an all-star cast, many of whom deliver the finest performances of long and storied careers. Martin Sheen, Alec Baldwin, Jack Nicholson, Leonardo DiCaprio and Matt Damon deliver incredible performances.However the performance that stood out for me was Wahlberg, Mark Wahlberg's Sgt. Dignam stole every scene he was in, and he shared screen time with each of the afore mentioned actors. He gets to deliver some of the best lines, and with every scene he leaves the audience wanting more, and anticipating his next scene.Since The Academy has had its collective heads stuck  for so long, mentioning a Scorsese picture and Oscar in the same sentence seems to be a waste of time. That being said I can not say if he will finally win the Oscar that he has deserved for so long, as his major competition (Flags of our Fathers) has yet to be released, I will say that I expect to see Wahlberg nominated for best supporting, and Leo and Damon will be pitted against one another once more, this time for best actor, Monahan will be nominated for writing, and of course Scorsese will be nominated for director. Also, it goes without saying a best picture nomination will be in order for The Departed.That was the long version; the short version is if you like a movie with incredible performances, direction, music and visuals. If you like a layered story that is not formulaic, in short if you appreciate film making and story telling at its finest then see this film. Even with the glowing reviews of myself and others, and the high expectations they will undoubtedly bring I assure you that you will not be disappointed.",False
20,10,Fantastic Bro,SoncoChairman,n/a,15/08/2025,"Excellent. A great, great movie. I saw it last night at a special screening and must say it was a tour de force. Even though Boston is not really a gritty town Scorsese was able to capture a darker side of the city. Coming from that area, I am always concerned when actors put on the local accent as it tends to be distracting rather than supportive. However, with local pros like Damon and Wahlberg they were able to really grab hold of it and not go overboard... most of the time. The true stand out performance has to go to DiCaprio. He has really come into his since hooking up with Scorsese, having scored a number of original performances all of which have expanded his range. He really snagged onto a deep and tragic character and created something that will hopefully be recognized come awards season. One of my favorite aspects was the friendly hostility the characters had for each other. It is a specific trademark that I have never noticed in any other city. In Boston, when you are really close with someone (or not really) it is, more or less, a requirement to bust their balls and shoot cruel insults back and forth in rhythmic banter. That detail was extensively realized in THE DEPARTED and I doubt anybody who was raised outside of the metro Boston area, or at least visited at some point, would find it nearly as hilarious as those who were. As for Scorsese's direction, I think he scored big with this one. While many have criticized that his movies have become more commercial I believe that he has just evolved. There were some classic Scorsese moments here, my favorite being a scene where DiCaprio is alone and packing his things in his apartment. Beautifully cut and stylistically directed. Is it his best effort? No. But it still is truly mesmerizing. He has created something truly special from a city that is highly underrated.",False
21,6,"Not That good,, here is why... spoiler.. (just my opinion)",speedy-gonzales-1,n/a,15/08/2025,"Spoilermany things that I did not like about the movie... (try to keep it a little bland to keep movie interesting if you haven't seen it.. even though you know this is a spoiler)* the girlfriend was into the bad boy thing.. but when she finds out that her boyfriend that shes cheated on has broken the law on occasion she is ready to leave him for it, and go to the criminal guy.. ?* the envelope she is given if ""whats his name"" dies,, she never opens it.. she does open the other one.. the scene of her getting it had no point..* to many names to remember,, they could have fixed this.. Mark Walberg played his role excellent.. but his character was not needed.. the movie would have been better without his character.* Movies that kill all the main characters, seem to have no point..i'll take some Shakespeare where the message is in the death,, but this wasn't like that.. is shake is spelt wrong,, he didn't even know how to spell it..* the rat on the railing.. how cheezy. and like that building would have that rat problem.. if it was left there ,, why kill him before he sees it?* the killing at the end,, why would he kill him? and the way he did it.. no one is going to notice a guy in a fancy high end condo walking around in a plastic outfit, that body would be noticed very fast. and what a horrible death.. why show all this guys fight and reflexes, and football skills and leadership, just die with no fight.. from his point of view,, he's just killing a good cop.. and he (walberg) was not a rat.. he set up everything that had to be undone..just my opinion,, acting was excellent,, 3/4 of the movie was really good.. maybe there is a directors cut that will change a lot of these points.. I still give it a 6 out of 10..",True
22,10,Hands down the best film of its genre/one of the best films of the century,thecarmenlips,n/a,15/08/2025,The plot line of this film you could almost say is a Shakespearean tragedy. Beautifully written with surprise reveals. Casted perfectly and Howard Shore's score works great to bridge together the scenes. It's honestly as high of a 10/10 as you can get.,False
23,7,"Scorsese tries, almost succeeds, but  fails in my eyes...",kane4782,n/a,15/08/2025,"SpoilerI have loved the original (Infernal Affairs) from the first time it enthralled and enticed me into its engrossing story, and I have watched it so many times without ever losing a moments interest. When I found out it would be remade, I was annoyed at Hollywood for meddling with masterpieces, but then I heard it would be Marty at the helm. His films have always impressed me and he deserves an Oscar for his efforts, yet his recent offerings have left me feeling a bit underwhelmed. Take Gangs of New York, it was entertaining, it had all the right elements to make it a great film, but after watching it, I felt a bit robbed. Undoubtedably, the best thing was Daniel Day Lewis' 'Butcher' character, along with the fight scenes and the setting, yet none of it really ever gelled together to make that masterpiece Scorsese always craves.This brings me onto 'The Departed'. I went in thinking, this should be OK, Scorsese has taken an amazing concept and is trying to make it his own with a stellar cast that with such material, really shouldn't go wrong. I was right to an extent, but I was left with a feeling of dissatisfaction.Having read in reviews that Jack Nicholson stole the show, to be honest, he didn't really do much for me in the film, just his usual on screen persona (feisty, scary, loud). He fits the bill though, he took up the screen and he owned the scenes he was in. However, if you look at the original and compare it to Sam, you'll notice that Sam seemed more menacing, because you really didn't know what he was going to do or say next.Martin Sheens 'Quinan' was probably one of the weakest characters, his role in comparison to the original does not give a real mentor bonding with Billy Costigan (Leo Di Caprio) and defeats the idea of the closeness of the two main good characters. His sidekick however, Mark Wahlbergs 'Dignam', I think was the best thing in the movie. It allowed for a bit of banter and sparked off a few laughs in the cinema. He was more developed in this version, however he got in the way of Quinan making any impact on the story.The two leads were well cast, Leonardo Di Caprio does well with his role and looks frail but tough, and caught in the middle of things. Matt Damon had probably less to do, in acting terms, however he manages well with what he had. Having said this, neither of them match up to Tony Leung or Andy Lau, from the original.The one thing I did like about The Departed was the new idea that they both fall for the same woman. It added a bit more to the back story and suspense, towards the end.Overall, I gave this a 7, because it is a movie in its own right and being that, it is a pretty good offering by Scorsese. The problem is, for me, the original is far better. The whole concept, suspense and acting from Infernal Affairs is so much more believable and flowing. I think one important point to note is the environment, the Hong Kong police force and triads are much better suited for this plot, as well as the language. Scorsese did well with transferring the idea over to the S. Boston Irish 'mafia', but he failed in trying to translate a lot of the dialogue over from Cantonese (eg. the wrong way of writing the word 'bodyguard' on the envelope, changes to the misspelling of the word 'citizen').To conclude, if I was to take into account the original, I would have given this a 3.5/10, which may seem harsh, but I believe its nowhere near as good. If you haven't seen Infernal Affairs and were intending on seeing The Departed, I would advise you to see the latter first, so you will know what I mean about feeling unsatisfied. I think the rating of 8.7 (at the time of writing) for The Departed does not do the original justice. I leave it for you to decide.",True
24,5,I beg you all to see the original version from HK,gezhao,n/a,15/08/2025,"SpoilerI beg you all, especially those who vote > 8, please view the trilogy of ""infernal Affair"" (Wu Jian Dao) from HK before doing any judgment on anyone in Departed.I personally favorite staff in the movie, Jack, Matt, Leo, Martin. I have to say all actors are the best, also, the script. Director, i am so disappointed.The story and even most charming details are borrowed from the original version(the first installation of the trilogy, if you are interested, the following two are also the most excellent movies in HK movie history), however, Martin turned me down finally.No discussion on the reasons why the two mouse come to be themselves, (it has been a long way why they ""departed""), please do not use only F-word to attract us, please don't regard everyone of us as fool. Matt is kind of no-brain to get all the info to Leo when they finally meet at the police office, and then became just a cold blood killer(still no-brain) to delete his files. is that make any sense, they looks like idiots there? Music is nice, but still a long way to the old one, which is much compatible to the atmosphere(which is also missing in this cut).And finally, the end is disappointed. where in the HK version, it is most exciting and moving 10 minutes during last 10 years. thanks!",True
25,10,A gripping and unique crime drama about the duality of undercover work,kilroythenomad,n/a,15/08/2025,"I got to see a sneak preview of it, and I must say: the BEST film of the year so far. Scorcese is at his best and truly deserves his anticipated first Oscar for this film. Also notable are the performances of Matt Damon (such a great ""bad-guy;"" he really must do stuff like this more often), Leo DiCaprio, Jack Nicholson (as always), and Mark Wahlberg (best since Rockstar). However, some in the theater with me who had seen Infernal Affairs did say that Departed did not live up to the original. I have yet to see Affairs, but I honestly believe that Departed was pulled off well enough to really bring in some respectable awards in the upcoming season.",False
