Review_number,User_rating,Review_title,User_id,User_id_link,Created_at,Review_Text,Spoiler
11,7,A fun film,gregmovies,n/a,15/08/2025,"Filled with great characters and a fun story, Star Wars is well deserving of its reputation as a classic. John Williams score alone makes this a film worth seeing. The characters are unforgettable and the special effects impressive for its time, but very outdated now. The different alien species are one of the best things about the film. The Cantina scene showing an array of Lucas' creations is particularly fun.I give this film a 7/10. Looking at it subjectively, it isn't a really good film. A lot of clichés, bad dialogue, cracker jack philosophy, and unimpressive acting. Yet, for some reason, I find it hard to say anything bad about this movie. My favorite film as a child, and one I still enjoy, mostly for nostalgia.",False
12,9,"The Best of Sci-Fi Times,the Worst of sf Times",Bogmeister,n/a,15/08/2025,"Though now known as ""Episode IV-A New Hope,"" for many of us, namely those of us who first saw this exhilarating entertainment in theaters back in '77, this will always be the first ""Star Wars."" We will always think of it as just ""Star Wars"" - plain & simple, no pretensions, no aspirations to deep film-making or high art. This is where we first met them all: Luke, Han Solo, Princess Leia, Obi-Wan Kenobi (old 'Ben'), Chewbacca, the 2 robots C3PO & R2D2 and, of course, Darth Vader. They were instant pop culture icons; you got the sense you'd seen them before somewhere, but were sure this wasn't possible. But they'd been there before in our minds. We'd read about them constantly in science fiction novels and short stories - tales of outer space civilizations, of spaceships zooming through asteroid belts, of exotic-looking aliens hanging around space ports. We'd dream about them at night and try to imagine ourselves in their midst; up until then, we could only imagine such things - there were no projected images to realize such dreams. ""Forbidden Planet"" from 1956 came close, and then there were the ""Star Trek"" and ""Lost in Space"" TV series, both hampered by dime store budgets and cheesy sets. We ate 'em up since there was nothing else. Then Lucas made it real.I remember when I first got wind of the upcoming movie, to open in May of 1977, I think. I saw the first publicized poster and bought the novel adaptation. On the poster, a young man stood with some light sword raised, a princess at his feet, numerous spaceships flying all over the place. I was in my mid-teens and felt the first pulse of building excitement as I realized all those fantastic tales I'd been reading the past few years were going to come alive on the big screen for me. It didn't disappoint. Luke Skywalker, who stood in for all the boys pretending to be on a galactic adventure, gets swept away from his mundane desert home smack dab into the middle of an honest-to-gosh galaxy-wide civil war! The strength of the narrative is / was amazing. There are no slow spots and you can't wait for the next scene during the entire experience; and, experience is the better description for it, rather than just 'movie.' You can't wait, for example, for the moment when Luke actually meets the princess; what will happen then? It's a textbook case of an exciting narrative and what I believe makes this superior to all the sequels (knowing that many feel ""The Empire Strikes Back"" is superior - I must disagree).The one character you really can't wait to see again is the ominous Vader, naturally. The instant he steps into view during the first few minutes of the story, you just know this is the ultimate villain. This is the baddest of the bad, the coolest of the cool, the supreme uber-evildoer of the entire galaxy. You just know it by his stance, by his attitude, and by the electric chill that runs through your frail form as he steps down the corridor, moving into the annals of film history with one fell swoop. You can't wait to see what he does next, what nefarious action will send someone or some planet to its doom. Sure, he seems under the control of Tarkin (Cushing) here and later, the Emperor, but you just know he's simply biding his time until he takes over the whole damn universe. There is no precedent for Vader, and nothing close to him after. He's at his best here where there's still much mystery attached to his dark frightful form, a minion of Satan and Nazi stormtroopers all rolled into one.This was also the movie-experience which catapulted Harrison Ford (Solo) into superstardom. He seems almost childish here, not really straining to create a character, and it's this flip charm that makes it work, against all odds. He really does appear to have stepped out of the pages of some juvenile space opera, laser guns blazing, all snide remarks and foolhardy bravado. But he also becomes the older brother figure to Luke, who cannot carry the story by himself. Hamill, whose movie career began & ended with Luke, epitomizes the center of destiny for a galaxy. Both humble and arrogant, he's perfect in the role. Fisher's main surprise is that she's not all sugar and sweet as one would expect of a princess. These three characters evolved in the next two films, but they were always at their best here, icons given life for a short period - but also forever in film. The same could be said for Alec Guinness as Kenobi, a first class act all the way. You almost believe this elderly warrior could topple an empire, given enough time. Unless he runs into Vader...",False
13,6,Great impact on cinama but also incredibly cheesy.,tagerjd,n/a,15/08/2025,"Star Wars Episode 4 A New Hope tells the story of a farm boy Luke Skywalker who upon his purchase of two droids R2-D2 and C3-P0, and running into the old and wise Obi-Wan Kenobi he is thrown into a world bigger then his own.A New Hope has great sense of pacing and having a flowing narrative build up to its conclusion almost flawlessly. The characters feel like real people with fleshed out motivations. The effects although aged today definably inspired what we have today in the art of cinema. The score just like all the other films in the saga is fantastic. But what this movies greatest feat is just how much it inspired a generation of cinema, as well as is outstanding impact on pop culture that keeps this film fresh.In spite of how much we can all appreciate this movies impact it is still far from a perfect movie. Most of the acting is hooky, and the effects are hard to by today. And although it has a good sense of pacing it still has many plot conveniences. The action is also pretty slow which prevents it from feeling like a real fight is going on. Even the dialogue is pretty hooky and hard to by. This is a problem because if characters are unable to talk like people do it makes it hard to relate to them and get invested in there conflicts.In conclusion I can appreciate its impact on culture, as well as love the movie. I personally consider myself to be a Star Wars fan. Keeping in mind that I feel on an objective level I consider this picture to be above average instead of great I'm giving this one a 6/10.",False
14,5,Revised versions were disappointing,owenrees,n/a,15/08/2025,I saw this movie in the cinema when it was first released and from the very beginning it was impressive. The opening set the tone - a spaceship is seen running away from a pursuer and then the ship following it appears and just keeps on getting bigger until it fills the whole screen and you finally see the engines at the back. The scale was far beyond anything else I had seen.The cantina scene was also memorable with the alien band not being overdone and the character of Han Solo being established as rather doubtful as one to associate with.The revised versions added filler in various places that did not add to the story at all. In many ways they undermined the sense of bleakness and despair that should have been seen as what you would expect in a remote outpost of a ruthless empire.I wish I could get hold of a copy of the original version to revisit my first experience but that does not seem possible.,False
15,n/a,A kid's fantasy. An Adult's memory,n/a,n/a,15/08/2025,In respect to the many kids of the seventies. I rated this movie as one of the greatest movies ever made. I was thirteen and enjoyed this fantasy getaway more than I could count. Like many other kids of the seventies you left reality before walking into the theatre and escaped into the adventure once the reels begin rolling. It provided the special effects and excitement a kid was looking for. Even today when I watch this movie on VHS I recall those times. Whenever I get the chance to watch it I feel like that eager thirteen year old over and over again. I hope the new movies will meet the same expectations of kids of  this decade and the next.,False
16,10,The greatest cinematic epic of all time begins here.,budmassey,n/a,15/08/2025,"Here begins the greatest cinematic epic of all time, and arguably one of the greatest stories ever told. Originally conceived as a serialized popcorn movie in the manner of the old action movies that Lucas grew up with, Star Wars surpassed even George's keen and bombastic imagination to become a central part of movie history.There are countless tales of the making of this movie; how Lucas never believed he would get the chance to complete the series, how it spawned an industry and made the name of nearly everyone who touched it a household word. But what that does not reveal, nor do the much diminished prequels, is the sheer joy and excitement these movies generated.It was a once in a lifetime experience. You could feel it from opening day, earlier if you paid attention to such things. We had never seen anything like it, and we are not likely to again.This episode finds young Luke Skywalker yearning to leave the agrarian life he has with his aunt and uncle, and chase after adventure as his friends before him have already done. And what adventure there is. The galaxy is in the grip of a massive rebellion against a tyrannical and oppressive empire, but on Luke's home planet, it's something you only dare speak of in a whisper.Along come two robots, ""Droids"" for short, who inadvertently involve Luke in a stellar attempt to contact an old wizard named Ben Kenobi, who lives in the caves near Luke's home.The rest is history, and there isn't a person alive in the civilized world who doesn't have at least some awareness of the epic story that unfolds. Luke's rise from adolescent obscurity on Tatooine to a leading role in the greatest struggle of all time is told with humor, action, adventure, and always a sense of story that is unmatched on the screen or on the page.With the completion of the prequel trilogy, these films are enjoying a renewed popularity among a generation that never saw the films on the big screen, and the theatric revivals are almost guaranteed. Go. Get some popcorn. And may the Force be with you.",False
17,10,No words to say,Laz75,n/a,15/08/2025,"There's not much to say about this movie this is *THE* movie that changed it all.It's my favourite movie, and not only among the quadrilogy, among all movies; it has everything that can be great in a movie, great characters, great story, great sights, great special effects (they don't show 23 years) and a mythological background that made us dream for decades now, and that'll keep us dreaming for a long, long time. Maybe the characters I liked most in this one are Old Obi-Wan Kenobi, wonderfully portrayed by Alec Guinness, and Han Solo, Harrison Ford's first important role, they're both great.Not to mention John Williams' wonderful score, without of it, the movie wouldn't have been this great it's a perfect mix, that's what it is!",False
18,10,The Movie that Changed My Life Forever!,jay_amer,n/a,15/08/2025,"This movie when I first saw it as a kid absolutely amazed me and put me into a world where I wished I could be! The story is absolutely genius, the characters are amazing! Everything about this movie is amazing! George Lucas made an absolute masterpiece of a film!!!!! May The Force Be With You!",False
19,10,The classic...,paul_m_haakonsen,n/a,15/08/2025,"Having grown up with the ""Star Wars"" trilogy, then ""Star Wars: Episode IV - A New Hope"" is a classic in every sense of the word. This is the epic story of good vs. evil and of light vs. dark. But it is also a story of heroism, bravery and adventure. I am an fan-boy, yes, but what is there not to love about ""Star Wars""?George Lucas really managed to piece together a timeless classic that stands its own even today. And even with effects from 1977 it was light years ahead of its time, no pun intended. And the effects stand their ground even by todays standards.There is something uniquely amazing about the atmosphere and feel of the ""Star Wars"" universe. And it doesn't require much to be swept away and carried along to a galaxy far, far away...The cast in ""Star Wars: Episode IV - A New Hope"" did a good and memorable job with their individual roles and characters. And with this movie George Lucas established some characters that instantly became well-known and well-loved.""Star Wars: Episode IV - A New Hope"" is a movie of high space adventure with vibrant characters, creatures and spaceships. It is an enjoyable movie for the entire family, space nerds or not.If you are not already familiar with the legendary ""Star Wars: Episode IV - A New Hope"" movie, then it is more than due time to get to it.",False
20,10,"In 1977, in a galaxy far, far away...",MaxBorg89,n/a,15/08/2025,"This great classic has so many good elements it's almost impossible to list them all: The breathtaking visual effects, still awesome 28 years on; the brilliant script, which mixed epic battles and duels with matinée-serial-style characters and dialogues; the debut of one of the greatest villains in cinema history, Darth Vader; John Williams'amazing and unforgettable score, among the Top 10 best scores ever...All those things are just some of the reasons Star Wars is among the best movies (not just sci-fi) ever made: viewing after viewing, it never stops being impressive, and words are nearly useless to describe the impact it still has on the audience.George Lucas basically took a medieval story and moved it to a distant galaxy, on weird and fascinating planets. Almost everything is taken from the Middle Ages: there are knights, sword-fighting, evil Empires, unsatisfied people who want to overthrow the system, beautiful princesses waiting to be rescued...Then we've also got speeders, light-sabers, peculiar (and, in the case of Jabba the Hutt, disgusting) creatures, the Death Star, and of course the Force, that fascinating energy which is supposed to bring balance to the galaxy.The cast is a gas, both the newcomers and the veterans: Mark Hamill, Carrie Fisher and Harrison Ford are great as Luke Skywalker, Princess Leia and Han Solo (Ford in particular is hilarious as the arrogant but ultimately nice ""scoundrel""), but the most memorable performance is of course Alec Guinness'portrayal of Obi-Wan Kenobi, the old, wise Jedi who returns one last time to initiate Luke to the mysteries of the Force.But let's not forget what everybody immediately thinks of when Star Wars is mentioned: Darth Vader. Feared by his opponents as well as his servants, this completely emotionless foe has become the very symbol of Lucas'masterpiece. He's one of those movie-characters people will remember as long as films will keep being made and his unsettling breathing noise still echoes in our memories...The beginning of a wonderful saga, whose only rival is The Lord of the Rings.May the Force be with you...",False
21,9,Cinema Classic,owenmul,n/a,15/08/2025,"Star Wars is simply a fantastic film, on every level this film is amazing.Each of the characters in this film are so well developed and so interesting that you just cannot wait for the next scene with them in it, the interactions between the characters us at times tense and at times downright hilarious, leaving no room for boring or lacking dialogue. The particular stand outs in this respect I feel are: Han Solo, the wise cracking bounty hunter with a tendency for arrogance that makes every scene as entertaining as possible. Secondly there is Darth Vader, who is the optometry of cool, scathing evil who poses as the ultimate villain.Surprising to me, the cinematography and special effects have held up all this time. Although there are some minor issues, one particularly notable one is during the scene where Luke is training with the training droid aboard the Millennium Falcon there are a few frame skips where Luke extends and contracts his lightsaber. Other than this though, the cinematography and special effects are amazing to have held up, particularly the shots of the Empire's space fleet moving through space which are absolutely stunning.One of the things that absolutely makes this film for me is the magnificent score, composed by John Williams. This score, while being one of the most iconic scores of all time, manages to make every single scene, fitting the mood of the scene perfectly.The story as well is fantastic, there is never a dull moment; every second of it an absolute thrill ride. Whether its the attack on the Death Star or the Cantina of Mos Eisley the story takes you through the twists and turns of this classic space opera.If I could recommend one sci-fi adventure film to someone, it would be this, it's an absolute must see.More Reviews at: http://12yearsacinephile.tumblr.com/",False
22,6,A great movie - for its time,Horst_In_Translation,n/a,15/08/2025,"Spoiler""Star Wars"" is a 2-hour science fiction movie from almost 30 years ago written and directed by George Lucas. There really needs nothing to be said about how good this is for a 1970s movie, especially in terms of technical aspects. The Academy certainly got it right by giving them all these Oscars for it. However, it lacks in certain other areas unfortunately. First of all, the acting isn't too great. That is not really a problem of the characters though, but rather of the way they were written, which simply offered no room for outstanding performances. And Peter Cushing's character was downright forgettable despite being the main antagonist. Instead people remember Darth Vader obviously. Why? Because this film is all about the way the characters look and not what they do or say. A bit style over substance. Apart from that, I am quite surprised Alec Guinness scored an Academy Award nomination for his turn here.The script is not the greatest achievement in general. It's the usual black-and-white characterization with good vs evil and the characters have no real shades, no facets. This was made up again by the strong work in other departments as it's not too memorable what they say and do, but what they look like, especially the non-human characters who are all somewhat considered legendary today. I am not saying the characters are written badly. Not at all. But it's just other contributions that made them what they are today. Not the script. And while I enjoyed most of the film, I cannot see it as an epic or a cult classic as so many people do to this date. ""Star Wars"" is bound to rise again with the new film coming out soon and featuring the original cast again. It should be interesting what they make out of it. Until then, feel free to watch the old films like this one, but not too many. The very first Star Wars film here is not a great achievement in terms of story, only in terms of all visual and audible aspects.",True
23,10,In A Galaxy Far Away................A Franchise Was Born,bkoganbing,n/a,15/08/2025,"The awesome special effects and the creation of creatures that are part of the vivid imagination of George Lucas are not the reason for the enduring popularity of Star Wars and the franchise it spawned. Rather it is because of the characters Lucas created that will live as long as we have cinema and the means to display it.The spectacle is behind some real, but simple people. No shadings of gray in the first Star Wars we know without any doubt who the heroes and villains are of this piece. On an isolated planet a galaxy wide dictatorship called the Empire and the revolt against come to wear young Luke Skywalker as played by Mark Hamill and his family reside. So does Alec Guinness, a reclusive and mysterious hermit.An escape pod crashes there with two androids, C3PO and R2D2 and in the latter is a message for Guinness who was at one time a Jedi Knight, fiercest of a warrior class, from Carrie Fisher playing Princess Leia. Also in R2D2 are the schematics for the Empire's ultimate weapon the satellite size death star that can deal killing out on a planetary scale.This starts an adventure with young Hamill who teams up with futuristic soldier of fortune Harrison Ford as Han Solo and his simian like sidekick Chewbacca to rescue the Princess and defeat the Death Star.Those are the good guys. The bad guys are the blackest of black villainy. Peter Cushing cold bloodedly commands the Death Star, but the mysterious Darth Vader, clad in black with a helmet completely covering his head, has mysterious powers and even his superiors are wary of him. The voice of James Earl Jones is unforgettable as the black prince of the galaxy.These are characters that bring out the kid in all of us. The ones who claim the most sophistication in their lives will cheer on for Hamill and Ford and will be fascinated by the double dyed villainy of Darth Vader.Perhaps the most interesting aspect of Star Wars and I speak now of all the films is the way such non-humans as the robots and Chewbacca the Wookie became characters. C3PO had dialog, but R2D2 had a few clicks and bleeks and all Chewbacca did was grunt, still they became as identifiable as the human characters.Star Wars set the standard for science fiction films to come for the next several generations. It was given six Oscars in a bunch of technical categories and it's got a re-release value that Gone With The Wind used to have.The Force Will Be With Us Always.",False
24,7,A product of its time. A classic,Kingslaay,n/a,15/08/2025,"When Star Wars came out in 1977 there was nothing like it, it came out of nowhere and was so different. It is indeed a product of its time and would have fascinated many kids of the era.As a film it is very simple and easy to follow. There are no big twists, dilemmas and the good forces come on top. The special effects and film have definitely aged but it has some classic elements. Darth Vader, the army of storm troopers and the mighty light saber is unlikely to be forgotten. Star Wars as a franchise clearly benefited from coming out at the right time, this was the day before competitive television, streaming services or films like Inception.The immortality of Star Wars lies in its simplicity, linear story and vast imagination. This appealed to millions of kids who grew into adults who still loved identified their childhood with this series.",False
25,4,Children's Fairy tale in Space,nymeria-meliae,n/a,15/08/2025,"SpoilerThere are two major problems with this film... 1) the plot 2) the actingI think this film is so popular largely because of childhood nostalgia. It is essentially a children's film.Spoiler? The Plot: When stripped to its bare bones the plot is essentially... princess gets kidnapped by evil sorcerer. Wannabe knight is trained by wizard to rescue princess from sorcerer. Wizard is killed by sorcerer. Knight comes back and destroys sorcerer's dragon (aka death-star). With the exception of death-star = dragon, each character is referred to according to those titles. Obi Wan is called a wizard by Luke's uncle. Darth Vader is referred to as having sorcerer's ways. Luke is to train to be a Jedi Knight... and Leia is a princess.A typical children's fairy tale story... and the twist being that it is set in space.The acting at times is so wooden that it is cringe worthy.Everyone has fond memories of this film from their childhood... and the reason why people don't like Return of the Jedi or the prequels is largely because they have grown up and have forgotten that this was a children's movie and was merchandised as a child's movie. However, if you look at it again on its merits as a film... it is actually quite a poor over-rated movie. It's one saving grace other than nostalgia is the model making and special effects for the time of its release were impressive but no more so than some previous sci-fi movies.",True
